1, News_Apple ốp lưng kiêm pin dự_phòng cho iphone_6,6S với giá 99 2,2 triệuTheo tuyên bô cua apple ôp nay se cung câp cho ngươi dung thêm 18 giơ lươt web trên mang 4G hoăc 20 giơ xem video hay 25 giơ đãm thoai 3, News_Apple sẽ sản_xuất lại iphone 4 inchNhà phân_tích mingChi Kuo người thường đưa ra nhiều dự_đoán chính_xác về các sản_phẩm Apple tiếp_tục đưa ra những nhận_định về mẫu iphone 4inch sắp được Apple Ông dự_đoán rằng,chiếc iphone 4inch sẽ là phiên_bản kế_nhiệm của chiếc iphone_5s cũng với kích_thước tương_tự Để phù_hợp với nền_tảng mới,chiếc iphone 4inch sẽ được trang_bị chip xử_lý A9 nhằm đảm_bảo hiệu_năng hoạt_động trơn_tru Ngoài_ra,máy sẽ sử_dụng vỏ kim_loại Tuy_nhiên,các thông_số kỹ_thuật còn lại tương_tự như iphone_5s,bao_gồm cả camera camera chính 8MP,phụ 12MP để cắt_giảm chi_phí iphone_7 4inch dự_kiến sẽ vào đầu năm sau 3,News_Apple sẽ sản_xuất lại iphone 4 inch
3,Nhà_phân_tích mingChi Kuo người thường đưa ra nhiều dự_đoán chính_xác về các sản_phẩm Apple tiếp_tục đưa ra những nhận_định về mẫu iphone 4inch sắp được Apple 3, Ông dự_đoán rằng,chiếc iphone 4inch sẽ là phiên_bản kế_nhiệm của chiếc iphone_5s cũng với kích_thước tương_tự 1, Để phù_hợp với nền_tảng mới,chiếc iphone 4inch sẽ được trang_bị chip xử_lý A9 nhằm đảm_bảo hiệu_năng hoạt_động trơn_tru 3, Tuy_nhiên,các thông_số kỹ_thuật còn lại tương_tự như iphone_5s,bao_gồm cả camera camera chính 8MP,phụ 12MP để cắt_giảm chi_phí 3,iphone_7 4inch dự_kiến sẽ vào đầu năm sau
2,Dùng iphone đã lâu mới phát_hiện ra một sự_thật khó chấp_nhận
3,Ai có iphone thử coi Ad làm được sau 5 lần y
3,LG_G5 và iphone_6S Các thím sẽ chọn
3,So_sánh một_số ảnh chụp của Galaxy S7 và iphone_6S Plus trong các điều_kiện khác_nhau
3,Tiếp_theo là Galaxy S7 edge và iphone_6S Plus
3, LG_G5 so sáng cùng iphone_6S Plus_Cùng đen_đen,xám xám,bạc bạc,bạn thích cái nào hơn 3 3,Samsung_Galaxy S7 so dáng cùng iphone_6S
1,Ai sẽ là người sở_hữu chiếc iphone_6s
1, Có tin_đồn cho rằng năm sau Apple sẽ iphone 4 với chip A9 và vỏ kim_loại với giá rẻ hơn cả 6S hiện_nay Cá_nhân ad vẫn thích mẫu thiết_kế của iphone 4,việc pháT_Triển lại mẫu này chắc_chắn sẽ khiến nhiều ifan thích_thú,còn các bạn thì_sao 1,Có tin_đồn cho rằng năm sau Apple sẽ iphone 4 với chip A9 và vỏ kim_loại với giá rẻ hơn cả 6S hiện_nay
1, Cá_nhân ad vẫn thích mẫu thiết_kế của iphone 4,việc pháT_Triển lại mẫu này chắc_chắn sẽ khiến nhiều ifan thích_thú,còn các bạn thì_sao 3,Thị_trường mobile VN đãng chứng_kiến sự tăng_trưởng nhanh_chóng của iphone_66 khi chiếm đến 12 trong thị_phần ios Mặc_dù iphone 44s vẫn được sử_dụng nhiều nhất nhưng tỷ_lệ này đãng giảm nhanh_chóng và sẽ sớm bị iphone_5 bắt kịp Trích_Báo cáo thị_trường mobile VN quý II2015
1,Thị_trường mobile VN đãng chứng_kiến sự tăng_trưởng nhanh_chóng của iphone_66 khi chiếm đến 12 trong thị_phần ios
3,Mặc_dù iphone 44s vẫn được sử_dụng nhiều nhất nhưng tỷ_lệ này đãng giảm nhanh_chóng và sẽ sớm bị iphone_5 bắt kịp
3,Làm thế_nào để sạc pin iphone đúng cách Cdiscountvn
3, Cuộc đọ sức bất_phân_thắng_bại giữa chiếc iphone_6s và 6 Plus_Giữa 1 chiếc điện_thoại màn_hình to hơn,camera có chống rung quang_học,với 1 chiếc điện_thoại có con chip mới hơn hiệu_năng cao hơn,khung sườn chắc_chắn hơn Bối_rối quá 2 cái cùng tầm giá không biết phải lựa_chọn chiếc nào 3,Cuộc đọ sức bất_phân_thắng_bại giữa chiếc iphone_6s và 6 Plus
1, Just for fun Không biết trong tương_lai iphone có được trang_bị tính_năng này không nhỉ Nếu có thì quá là tuyệt_vời,chả bao_giờ phải sợ rơi vỡ màn nữa D 3,Just for fun Không biết trong tương_lai iphone có được trang_bị tính_năng này không nhỉ
1, CÓ_THỂ_BẠN_CHƯA_BIÊT Bạn đã từng gặp tình_huống chiếc iphone i Pad đột_nhiên bị đơ không cảm_ứng không tắt nguồn,hay màn_hình bị tắt không lên,cắm sạc cũng không thấy hiện_tượng gì Mẹo nhỏ cực_kỳ đơn_giản mà không phải người dùng Táo nào cũng biết nha Bạn giữ đồng_thời cả 2 phím Nguồn và phím Home,giữ chặt tầm 10 giây cho_đến khi màn_hình hiện lên quả táo nhé Sau đó máy sẽ tự khởi_động lại như bình_thường nha Share để cho bạn_bè cùng biết nha 3,Bạn nào dùng iphone mà thấy chưa đủ nhanh thì thử mẹo này nhé
1,Ứng_dụng hay cho iphone
1,152 iOnline Khuyến_Mại ngày vàng 150 Tăng_tốc giành chữ chinh_phục iphone_6 không lo cạn GOLD với Khuyến_Mại ngày vàng hấp_dẫn Tặng ngay 150 giá_trị GOLD cho tất_cả hình_thức nạp từ 00h 24h ngày 1522016 Chỉ con 5 ngày chạy_đua quyết_định bạn có sở_hữu iphone_6 đừng bỏ lỡ Nhớ chọn nạp qua Thẻ_Cào để được hưởng tỷ_giá nạp có lợi nhất Chúc bạn may_mắn
2,Lý_do pin iphone không được quá một ngày
3,3 mẫu concept iphone_5 SE Anh_em thích kiểu nào nhất D
3,Ai thích dùng iphone lock thì mua ngay kìa 3
3,Huyền_thoại bao mât may tinh John_Mc Afee vừa có cuộc trò truyện với trang tin MaximumPc xung_quanh vu viêc Apple tư chôi yêu câu mơ khoa iphone cua tên khung bô cho FBI
3,Xuất_hiện ảnh thực_tế iphone_5SE màu xám iphone_5SE có_thể sẽ được giới_thiệu vào ngày 223 tới
3,Vậy_thì các thím sẽ mua 5S hay iphone_se
1,Apple sẽ mang thiết_kế được rất nhiều người yêu_thích của iphone_5S quay trở_lại
3,Bây_giờ các thím thích 1 chiếc iphone Plus hay 1 chiếc iphone nhỏ và 1 cái i Pad
2,Mà cũng phải công nghận iphone chống rung khá kém
3,Ai thích iphone màu đen giống Ad không 3
3,Bảo sao con_gái không đòi mua iphone là chỉ có mua Oppo
3, Người_ta thì chờ iphone_5SE và iphone_7,mình thì ngóng em 5S này thôi 3,Có một nghịch_lí ở đây Khi xưa kia iphone luôn được cho là bảo_mật hơn Android
1,Khi xưa kia iphone luôn được cho là bảo_mật hơn Android
3, Có iphone là một chuyện,làm_sao để sử_dụng hết khả_năng của nó lại là một chuyện khác Bạn có tự_tin rằng mình đã biết hết những điều này 2,Có hại cho iphone lắm đấy
1, Sưa lôi canh bao phat hiên hanh đông trai phep trên samsung galaxy s 4 Sưa lôi canh bao hanh đông trai phep trên samsung galaxy yêu câu khơi đông lai may,xoa xac minh tai khoan google,samsung account,reactive lock,please call me,unlock mang cac dong samsung,lg,htc,iphone,motorola Giai_Phap_Android_Mr Tiên 0907 705 936 3, Giờ vàng sắp đến rồi,mọi người sẵn_sàng để bấm đặt mua iphone_6 nha 2,Người cha xấu_xa thứ 2 thế_giới đây rồi Bán con để mua iphone Không biết anh này nghĩ gì nữa Thật hết_chỗ_nói
2,Bán con để mua iphone
1,Dễ hiểu vì_sao người_ta lại cuống iphone_5S khi nó giảm_giá tới vậy Làm mình nhớ lại thời huy_hoàng của iphone 4
3, Nhiều người khẳng_định,họ đếm được tới 10000 chiếc iphone_5 xuất_hiện trong video 3, Ngày_tháng ăn_chơi đã kếT_Thúc Ngày_tháng nghiêm_túc sắp bắt_đầu Trở_lại với việc học_hành vĩ_đại Vì tương_lai ném chuột bằng iphone,đập ruồi bằng i Pad_Cố lên các bạn 3, Vì tương_lai ném chuột bằng iphone,đập ruồi bằng i Pad 3, John_Mc Afee đãng biến mình thành_tâm điểm của truyền_thông và thế_giới công_nghệ,sau khi tuyên_bố hùng_hồn Tôi sẽ bẻ_khóa chiếc iphone của kẻ sát_nhân tại San_Bernardino một_cách miễn_phí,để Apple không cần tự tay làm điều đó 3, Bạn đã nghe đến đồ_vật tự chuyển_động Bạn thấy ngạc_nhiên Ồ,không_đâu,bạn có_thể trang_bị cho ngôi nhà của mình được như_vậy với hệ_thống điện thông_minh của ASEL Tivi mở,điều_hòa bật,rèm mở ra hay đóng vào đều do bạn có_thể điều_khiển_từ_xa với một phím bấm trên iphone hay i Pad của mình 2, Lỗi đặc_biệt nghiêm_trọng của APPLE Đừng có thánh nào thử nghịch dại nhé Nếu bạn thiết_lập ngày iphone,iPad về 01 tháng 1 năm 1970 sẽ biến thiết_bị của bạn trở_thành cục gạch ngay_lập_tức luôn đó Mà lỡ nghịch dại thì thử 1 trong 2 cách này xem được không nhé Không được thì mang qua trung_tâm apple xử_lý nhé 1 Cách thứ nhất đó là người dùng sẽ chờ cho tới khi máy cạn pin hoàn_toàn Sau đó,cắm sạc và iphone sau khi hết treo táo sẽ tự_động khôi_phục về ngày,giờ hiện_tại 2 Cách thứ_hai là thay một chiếc SIM khác hay iphone tự dùng được sau 5 giờ nhưng những người dùng cũng không quên cho_biết rằng họ không_thể chỉnh lại ngày_giờ như ban_đầu sau khi hết treo táo Về phía Apple họ sẽ sớm cho tung ra 1 bản cập_nhật vá lỗi này nên nếu có nhỡ tay thử 111970 thì làm theo 1 trong 2 cách trên nhé Nếu không được thì đừng thử lại lần 2 2, Nếu bạn thiết_lập ngày iphone,iPad về 01 tháng 1 năm 1970 sẽ biến thiết_bị của bạn trở_thành cục gạch ngay_lập_tức luôn đó 3, Sau đó,cắm sạc và iphone sau khi hết treo táo sẽ tự_động khôi_phục về ngày,giờ hiện_tại 3,2 Cách thứ_hai là thay một chiếc SIM khác hay iphone tự dùng được sau 5 giờ nhưng những người dùng cũng không quên cho_biết rằng họ không_thể chỉnh lại ngày_giờ như ban_đầu sau khi hết treo táo
1,Chả gì bằng tặng iphone cho gấu
3,Test độ bền của Iphone và Samsung_Theo chúng_mày máy nào chịu được lâu hơn
3, Muộn mất 5 năm,nhưng cuối_cùng thì cái ngày mà_cả ba nhà mạng lớn tại Việt_Nam đều phân_phối iphone cũng đã đến 1, Quào,dùng iphone đã lâu nhưng đến giờ mới biết thêm nhiều tùy chỉnh hay_ho như_thế_này 3, Chờ mãi rồi Mình không thích iphone màn_hình to,nên là hóng em iphone 4 inch này nhất 3, Mình không thích iphone màn_hình to,nên là hóng em iphone 4 inch này nhất 3,Đọc và tự mình ngẫm xem tại_sao iphone nhà người_ta vẫn pin trâu trong khi iphone của mình lại chỉ trụ được có vài tiếng đồng_hồ nhé
3,Cái cục đó trên tai_nghe iphone không phải chỉ để chỉnh tonhỏ tiếng đâu nha
2, Để có được 23000 NDT hơn 70 triệu đồng mua iphone và xe_máy,một cặp vợ_chồng trẻ_con ở Phúc_Kiến,Trung_Quốc đã nhẫn_tâm bán đứa con 18 ngày tuổi và phải ra hầu tòa 3,Tự_tạo case cho iphone bằng bong_bóng Nhớ chỉnh_sửa cho ngay_ngắn để có được_một_cái case ưng_ý nhé
3,Tự_tạo case cho iphone bằng bong_bóng
3, Nguyên_mẫu bị rò rĩ được cho là iphone 4 inch,có_thể gọi_là 6c theo tin_đồn Bạn nghĩ thế_nào nếu Apple thực_sự sẽ tung ra mẫu điện_thoại này 3, Nguyên_mẫu bị rò rĩ được cho là iphone 4 inch,có_thể gọi_là 6c theo tin_đồn 3, Samsung vô_tình tiết_lộ iphone_7 sẽ sử_dụng màn AMOLED cong Thương_vụ này sẽ khiến Samsung phải đầu_tư một khoản vốn lên đến 7,47 tỉ USD cho nhà_máy sản_xuất mới có_thể đáp_ứng nhu_cầu Giá_trị của thương_vụ không được công_bố và việc sản_xuất sẽ bắt_đầu_từ quý I 2016 kđéo_dài đến 2017 Dự_tính mỗi tháng Samsung sẽ sản_xuất từ 30000 đến 45000 tấm nền OLED cho apple tại những chiếc iphone vẫn đãng sử_dụng màn_hình LCD apple là thiết_bị đầu_tiên Apple sử_dụng màn_hình OLED cong với mặt màn_hình được vuốt cong xuống 4 phía,cho_nên những thế_hệ tiếp_theo của iphone sử_dụng tấm nền này là điều không ngạc_nhiên cho lắm Samsung từ lâu đã gây tiếng_vang trong mảng màn_hình OLED cong khi mà các sản_phẩm dòng Edge của Samsung liên_tục gây được tiếng_vang Động_thái này của Samsung vô_tình hỗ_trợ đối_thủ chính của họ,khi mà công_ty đãng phải chật_vật trong mảng thiết_bị đi động Sản_xuất chip xử_lí,màn_hình và RAM đãng là nguồn thu chính của Samsung trong mảng này Cho_nên thoả_thuận tưởng_chừng như rất bđéo_bở trên có_thể là mối lo_ngại chính cho họ trong tương_lai Từ genkvn 3,Samsung vô_tình tiết_lộ iphone_7 sẽ sử_dụng màn AMOLED cong
3,Hiện_tại những chiếc iphone vẫn đãng sử_dụng màn_hình LCD
3, apple là thiết_bị đầu_tiên Apple sử_dụng màn_hình OLED cong với mặt màn_hình được vuốt cong xuống 4 phía,cho_nên những thế_hệ tiếp_theo của iphone sử_dụng tấm nền này là điều không ngạc_nhiên cho lắm 3,Dám nhảy xuống hồ sâu hai mét chỉ để cứu_vớt chiếc iphone_5 của mình
3, Concept iphone của tương_lai,ai muốn một em giơ tay lên nào 3, Khi iphone_7 không có viền màn_hình,chuẩn hơn iphone_6s không cả nhà 3, Bạn đãng là tín_đồ và đãng sử_dụng iphone Bạn thường hay trò_chuyện trên Facebook hay nhắn_tin,thường sử_dụng emoji,tức các hình_ảnh với khuôn_mặt biểu_cảm Nhưng bạn đã biết cách tạo ra chúng như_thế_nào chưa Hãy click vào bài viết dưới đây để biết cách tạo như_thế_nào nhé 3,Bạn đãng là tín_đồ và đãng sử_dụng iphone
1, Social_Listening_Thống kê Nóng_Mới nhất về phản_hồi của cộng_đồng mạng về Bphone trong ngày 2605 Hình_ảnh người_người F5 từng phút chỉ để cập_nhật những thông_tin nóng nhất từ ,các streamline với hàng chục_ngàn người theo_dõi trực_tiếp và các feed về Bphone tràn_ngập trên mạng xã_hội đã khiến nhiều người phải thốt lên Tôi có cảm_giác như Bphone chính là hiện_tượng iphone của Việt_Nam younetmedia Bphone bkav 1, 9inspiration Chiến_lược marketing của Apple là chủ_đề của video này Chúng_ta hãy thử để_ý từ đoạn Iphone được unlock và tưởng_tượng khi trình_chiếu,chúng_ta sẽ coi như chiếc Iphone trên màn chiếu cảm_ứng được và thao_tác với nó sao cho khớp với hiệu_ứng đã có trong slide,chắc_hẳn sẽ gây được ấn_tượng rất lớn đối_với người xem phải không Mong rằng qua video này các bạn sẽ có thêm cảm_hứng cho những bài thuyếT_Trình sắp tới của mình Cảm_ơn cảm bạn đã theo_dõi 1, Chúng_ta hãy thử để_ý từ đoạn Iphone được unlock và tưởng_tượng khi trình_chiếu,chúng_ta sẽ coi như chiếc Iphone trên màn chiếu cảm_ứng được và thao_tác với nó sao cho khớp với hiệu_ứng đã có trong slide,chắc_hẳn sẽ gây được ấn_tượng rất lớn đối_với người xem phải không 1,iphone độc_đáo nhất thế_giới
2,Có ai thử làm thế_này chưa Tiếc cái iphone_6s quá TT
2,Tiếc cái iphone_6s quá TT
3, Khi_Matt_Stopera đãng tìm_kiếm một bức ảnh trên chiếc iphone để đăng lên hồi tháng Giêng vừa_qua,anh đã giật_mình khi phát_hiện ra thư_viện ảnh của anh chứa đầy hình_ảnh tự sướng trước một cây quất cảnh của một người đàn_ông Trung_Quốc 2, Apple đã phải khá vất_vả mới được quyền sử_dụng tên gọi này bởi trước đó ios đã được đăng_ký thương_hiệu bởi Cisco_Hai hãng này cũng từng gặp phải một_số lùm_xùm về pháp_lý khi Cisco đệ đơn lên tòa_án Hoa_Kỳ kiện Apple do sử_dụng tên gọi iphone,thương_hiệu cũng thuộc về Cisco 2, Hai hãng này cũng từng gặp phải một_số lùm_xùm về pháp_lý khi Cisco đệ đơn lên tòa_án Hoa_Kỳ kiện Apple do sử_dụng tên gọi iphone,thương_hiệu cũng thuộc về Cisco 3,Tín_đồ của Iphone là đây
3,Tiền thì anh không có Nhưng_Iphone thì anh không thiếu
2, Đây được đánh_giá là một trong những thí_nghiệm tàn_nhẫn và nguy_hiểm nhất đối_với iphone Các bạn đừng bao_giờ làm thế_này với em iphone nhé,đừng bao_giờ 2,Đây được đánh_giá là một trong những thí_nghiệm tàn_nhẫn và nguy_hiểm nhất đối_với iphone
3, Các bạn đừng bao_giờ làm thế_này với em iphone nhé,đừng bao_giờ 3,iphone_6s được dự_kiến sẽ vào đầu tháng 9 tới đây với nhiều cải_tiến vượT_Trội so với người anh_em 6 và 6 Plus_Mức giá thì vẫn luôn là một ẩn_số nhưng AHEAD dự_đoán cũng không dễ xơi đâu Theo fans thì giá bao_nhiêu là hợp_lý để rinh được 1 em về nhỉ
1,iphone_6s được dự_kiến sẽ vào đầu tháng 9 tới đây với nhiều cải_tiến vượT_Trội so với người anh_em 6 và 6 Plus
3, 1 trong 5 câu_chuyện công_nghệ gây sốt cộng_đồng mạng VN 2014 iphone_6 gây sốt với giá ban_đầu từ 5070 triệu đồng Trong ngày 199,ngày đầu_tiên Apple bán ra iphone_6 tại một_số thị_trường trên thế_giới,số_lượng máy mang về Việt_Nam khan_hiếm nên có_giá lên đến 5070 triệu đồng Nhiều chủ cửa_hàng tại TPHCM và Hà_Nội cho_biết có những khách sộp sẵn_sàng chi ra mức giá gấp 34 lần giá thông_thường để sở_hữu chiếc iphone_6 Plus đầu_tiên về Việt_Nam_Mức giá cao kỉ_lục của bộ đôi iphone mới trong ngày đầu đã thu_hút sự chú_ý của những tín_đồ quả táo nói_riêng và cộng_đồng yêu công_nghệ trong nước nói_chung Phần_lớn đều cho rằng những chiếc iphone đầu_tiên về Việt_Nam có giá_trị để làm thương_hiệu cho cửa_hàng hoặc một thứ quà tặng xa_xỉ trong giới thượng_lưu Sau ngày đầu_tiên,mức giá iphone_6 tại Việt_Nam nhanh_chóng hạ nhiệt và giảm mỗi ngày hàng triệu đồng Chỉ trong vòng hai tuần,giá bán của bộ đôi này nhanh_chóng về gần với giá nhập do sức_mua không cao như dự_kiến Nhiều cửa_hàng lỡ ôm iphone_6 xách tay với giá cao than trời vì lỗ khi mặt_bằng giá iphone_6 giảm không phanh 3,iphone_6 gây sốt với giá ban_đầu từ 5070 triệu đồng
2, Trong ngày 199,ngày đầu_tiên Apple bán ra iphone_6 tại một_số thị_trường trên thế_giới,số_lượng máy mang về Việt_Nam khan_hiếm nên có_giá lên đến 5070 triệu đồng 3,Nhiều chủ cửa_hàng tại TPHCM và Hà_Nội cho_biết có những khách sộp sẵn_sàng chi ra mức giá gấp 34 lần giá thông_thường để sở_hữu chiếc iphone_6 Plus đầu_tiên về Việt_Nam
1,Mức giá cao kỉ_lục của bộ đôi iphone mới trong ngày đầu đã thu_hút sự chú_ý của những tín_đồ quả táo nói_riêng và cộng_đồng yêu công_nghệ trong nước nói_chung
3,Phần_lớn đều cho rằng những chiếc iphone đầu_tiên về Việt_Nam có giá_trị để làm thương_hiệu cho cửa_hàng hoặc một thứ quà tặng xa_xỉ trong giới thượng_lưu
1, Sau ngày đầu_tiên,mức giá iphone_6 tại Việt_Nam nhanh_chóng hạ nhiệt và giảm mỗi ngày hàng triệu đồng 2,Nhiều cửa_hàng lỡ ôm iphone_6 xách tay với giá cao than trời vì lỗ khi mặt_bằng giá iphone_6 giảm không phanh
3,iphone_6s có gì mới
3, iphone_7 đãng dần lộ_diện,fan nhà Táo có thấy hài_lòng không 1, mi 5 hẳn 4 càng cũng chưa chắc_ăn được iphone_6s Plus_Nhưng cũng khá khen cho Xiaomi,vì giá rẻ,mà chất_lượng không thua_kém nhiều là quá nỗ_lực rồi Tất_nhiên,qua đây mới thấy,hàng Nokia nó bền và tốt tới dường nào Nokia vô_địch 2,mi 5 hẳn 4 càng cũng chưa chắc_ăn được iphone_6s Plus
3, Cách hướng_dẫn cài_đặt số điện_thoại báo khẩn_cấp trên iphone phòng khi_không may bị tai_nạn thì người đi đường còn gọi cho người_nhà được lúc điện_thoại người bị nạn cài pass Ai dùng iphone vào app Health_Sức_Khoẻ nếu ai dùng giao_diện tiếng Việt có phần khai_báo thông_tin người_thân,chọn số tên số điện_thoại người đó trong danh_bạ Hình_như là được add bao_nhiêu tuỳ_thích Rồi khi máy bị khoá pass thì chọn Emergency_Khẩn cấp góc tay_trái hình 1,chọn Medical ID_ID_Y tế góc dưới tay_trái hình 2,là ra danh_sách người_thân,ấn nút gọi_là có kết_nối hình 3 Mong rằng không ai phải dùng tới chức_năng này 3,Huyền_thoại bao mât may tinh John_Mc Afee vừa có cuộc trò truyện với trang tin MaximumPc xung_quanh vu viêc Apple tư chôi yêu câu mơ khoa iphone cua tên khung bô cho FBI
3, Không biết với iphone thì_sao,chứ mình toàn dùng cách này để chấm công vân tay do hay đi làm muộn 2,Có bạn nào cũng thấy chíu khọ với camera lồi trên iphone_6 không
2,Trinh_sát tiếp_tục kiểm_tra điện_thoại_di_động của 3 nghi phạm này Bất_ngờ trinh_sát phát_hiện chiếc iphone_6 Plus của Khanh đầy nghi_vấn khi chỉ có cuộc_gọi đến nhưng không_thể gọi đi
2,Bất_ngờ trinh_sát phát_hiện chiếc iphone_6 Plus của Khanh đầy nghi_vấn khi chỉ có cuộc_gọi đến nhưng không_thể gọi đi
2, Gã tài_xế ra khỏi xe,việc đầu_tiên là hất tung một chiếc điện_thoại trên tay một nhân_chứng rồi bình_thản móc iphone bấm rồi biến_mất,bỏ mặc sau lưng 3 thân_thể tan_nát vẫn còn nóng ấm 1,Chức_năng mới của iphone_7 đây sao Kiểu này ném máy vô_tư rồi
1,Sảng_khoái cùng DẦU_GỘI_BÙN_KHOÁNG_NIVEA_MEN và có cơ_hội trúng ngay iphone_6 thật sành_điệu tại Lazada
1, Quá đỉnh,ai hậu_đậu thì thích lắm nè,có thanh_niên nào muốn sở_hữu luôn em iphone_7 như_vậy không 2, mẹ em bị hack Facebook rồi nha mọi người Mọi người có thấy nó pm đòi nạp card gì thì đừng nạp nhé Nó nghĩ sao đi inbox cho cô_mình cô_mình cũng ở Mỹ luôn mà kêu cô_mình đi mua card mobiphone cho nó,còn nói bên Mỹ xài Mobifone được lắm chứ 3, Nó nghĩ sao đi inbox cho cô_mình cô_mình cũng ở Mỹ luôn mà kêu cô_mình đi mua card mobiphone cho nó,còn nói bên Mỹ xài Mobifone được lắm chứ 3,trong lúc chưa có iphone_7 thì lấy em 6s Plus ra so tạm vậy
1, Ước_mơ xài Iphone giá rẻ bèo mà chức_năng cực đỉnh đã đến 223 ,các bạn đoán nó có_giá bao_nhiêu 3, Dùng iphone đã lâu nhưng chưa chắc bạn đã biết hết mấy mẹo bàn_phím này,biết xong dùng quá đã luôn 2, Ad đã thấy rất nhiều gia_đình dỗ con_nhỏ bằng i Pad iphone,nếu_không cho nó xài thì khóc ré lên lăn_lộn ăn_vạ đủ kiểu Mốt con của ad mà vậy ad nện nhừ_tử 2, Ngày 262,tập_đoàn Apple đâm_đơn phản_đối việc Bộ Tư pháp Mỹ và Cục Điều tra liên_bang FBI ép tập_đoàn này mở khóa chiếc iphone do kẻ khủng_bố gây cuộc thảm_sát ở San_Bernardino sử_dụng 2, Chị H hoảng_sợ vùng dậy bỏ chạy,Ánh lại lấy xe_máy chị H nổ máy rồi bỏ đi Trong cốp xe của chị H có điện_thoại Iphone,7 triệu đồng và nhiều giấy_tờ khác Cướp xong,H đi nhậu và thuê khách_sạn ngủ 3, Trong cốp xe của chị H có điện_thoại Iphone,7 triệu đồng và nhiều giấy_tờ khác 1,iphone_7 thế_này thì_có mà cháy hàng à
