3, mini game ĐÁP_ÁN_LÀ_GÌ wwwdamchonthachthuccomvn Vị_trí dấu_chấm_hỏi sẽ là gì Number 1 Chanh,điện_thoại Iphone hay Samsung_Comment ngay nhé,10 bạn có câu trả_lời đúng và may_mắn nhất sẽ nhận được 10 card điện_thoại trị_giá 50K nha Mạnh_tay like và share post để có cơ_hội nhận quà nhe Number1Chanh Damchonthachthuc 3, Number 1 Chanh,điện_thoại Iphone hay Samsung 1, Thật tuyệt nếu được đi chơi Tết,trong tay là chiếc smartphone iphone_6s hay i Pad_mini vô_cùng sang chảnh phải không các fans 3, Các game thủ nhà mình tranh tài tại OSLA League tới đâu rồi Kiểm_tra thử xem mình đã lọt vào top BXH chưa nhé Đừng quên những phần quà khủng iphone_6s,iPad mini và áo đấu của HAGL vẫn còn đãng chờ những fans xuất_sắc nhất OSLA League,dễ chơi,dễ trúng Tham_gia ngay wwwkhatvongchienthangcom Osla_Khat VongChienThang 1, Đừng quên những phần quà khủng iphone_6s,iPad mini và áo đấu của HAGL vẫn còn đãng chờ những fans xuất_sắc nhất 1, News_App hay mỗi ngày Game mang bạn đến với những đường đua dài bấT_Tận và cực_kì khốc_liệt,cảm_giác lái_xe chân_thực 100 và những vòng đua thú_vị ngay trên iphone,iPad,iPod Touch_Thông tin chi_tiết và tải về tại đây Xem thêm các app hay khác tại AppstoreChamVn Tải miễn_phí mọi game,mọi ứng_dụng dù tính phí hay không tính phí trên ios bằng cách cài_đặt và sử_dụng Appvn tại 2, Nếu_như bạn đãng sở_hữu một chiếc iphone,hẳn bạn sẽ biết rằng gần_như không có cách nào để xóa_bỏ các ứng_dụng mặc_định của ios 2, Nếu chỉ biết nghe,gọi và chụp ảnh thì phí iphone lắm đó 1,Gần đây nhất ngôi_sao Galaxy S7 và S7 Edge đã được Samsung giới_thiệu trên thị_trường Thế các fan của Táo khuyết mong_đợi gì cho siêu phẩm iphone_7 7 Plus nào Nhiều tin_đồn cho rằng bộ đôi iphone_7 7 Plus sẽ là sản_phẩm cho cuộc cách_mạng về thiết_kế cũng_như cấu_hình mạnh_mẽ từ ông trùm apple phá ngay
3, ios Vũ_khí giúp Apple biến iphone sống khác đi so với đối_thủ cạnh_tranh Bắt_đầu_từ những thứ đơn_giản nhất,ios trên iphone đã chuyển_hoá như_thế_nào 1, Vô_vàn phần_thưởng outgame cực khủng như iphone_6 Plus,Samsung_Galaxy S6 Edge,Màn_Hình_Máy_Tính_Asus 27,Bàn_Phím_Razer_Chroma,Chuột_Razer_Naga_Hex,Tai_Nghe_Sades_Gaming đãng chờ đón các vũ_công trong những vòng quay số của game Cửu_Tinh_Vô_Song_Tham gia ngay tại 3, TIN_HOT Xe SH,iphone_6 sẽ thuộc về ai Chương_trình RINH_SH_DU_XUÂN_ẤT_MÙI sẽ kếT_Thúc lúc 23h59 ngày 1003 Rất nhiều giải_thưởng giá_trị cực Khủng như XE_SH 125,5 chiếc iphone_6,1 IPAD_miNI 3 Retina,2 TV_LED SamSung 32 vẫn chưa tìm được chủ_nhân may_mắn Tham_gia ngay kẻo lỡ các tình_yêu ơi Tham_gia chương_trình tại đây 1, Từ ngày 0902 đến 1003 tham_gia chương_trình RINH_SH_DU_XUÂN_ẤT_MÙI các bạn sẽ có cơ_hội nhận được xe SH 125,iphone_6 cùng rất nhiều phần_thưởng đặc_biệt giá_trị cả trong game lẫn ngoài game HOÀN_TOÀN_miỄN_PHÍ Chi_tiết xem tại 3,MWC 2016 cho thấy các đối_thủ của Apple dường_như không còn đưa ra những tính_năng gần giống trên iphone như những năm trước_đây
3, Kiểu_dáng của iphone_5SE về cơ_bản không thay_đổi so với iphone_5S,nhưng nút nguồn được dời về cạnh bên giống iphone_6 và 6S 2, Apple là ví_dụ cho sự đi xuống của làng điện_thoại khi iphone_6s bị chê là không có gì mới_mẻ so với iphone_6,trong khi Samsung,hãng điện_thoại lớn nhất thế_giới,cũng giảm lợi_nhuận 7,3 3, VÕ_LÂM_CHI_MỘNG_TRI_ÂN_NHÂN_SĨ iphone_6S,tượng vàng,iPad 4,bàn_phím,chuộtđãng chờ chủ_nhân Mùa quà tặng cuối năm,anh_em mau vào chiến nhé Rinh quà tại 3,Đăng_ký ngay Quà liền_tay Chơi game Thương_Khung_Chi_Mộng 3D Mobile cùng midu rinh ngay iphone_6s Plus_Link TKCM miduTrởLại
3, Bạn có biết,chỉ cần đặt 2 ngón_tay vào giữa bàn_phím,rồi kđéo sang 2 bên thì bàn_phím sẽ chia thành 2 nửa 3, Sau_Docs và Sheets,Google tiếp_tục cho ứng_dụng Slides dành cho người dùng iphone và i Pad_Slides là ứng_dụng giúp khởi tạo,xem và chỉnh_sửa bài thuyếT_Trình ngay trên các thiết_bị di_động Link tải 3, Ứng_dụng bàn_phím không thể bỏ lỡ cho iphone,iPad 1, Moborobo không_chỉ là ứng_dụng quản_lý thiết_bị Android,iphone,iPad miễn_phí,mà_còn cho_phép bạn download và cài_đặt ứng_dụng,gửi và đọc tin nhắn SMS từ máy_tính của mình x Có_thể chuyển danh_bạ từ điện_thoại thông_minh này sang điện_thoại thông_minh khác,sao lưu và phục_hồi danh_bạ nữa nhé 1, Moborobo không_chỉ là ứng_dụng quản_lý thiết_bị Android,iphone,iPad miễn_phí,mà_còn cho_phép bạn download và cài_đặt ứng_dụng,gửi và đọc tin nhắn SMS từ máy_tính của mình x 1, Với ios 8,lần đầu_tiên Apple cung_cấp khả_năng chụp hẹn giờ cho những thiết_bị di_động của hãng với lựa_chọn 3 hoặc 10 giây Ngoài_ra,bạn cũng có_thể quay clip Timelapse dễ_dàng chỉ với 1 chiếc iphone trong khi nhiếp_ảnh Timelapse trước_đây thường được thực_hiện bởi các thiết_bị chuyên_dụng và qua nhiều công_đoạn ghép mới đạt được một đoạn video hoàn_chỉnh 1, Ngoài_ra,bạn cũng có_thể quay clip Timelapse dễ_dàng chỉ với 1 chiếc iphone 3, Ứng_dụng chia_sẻ hình_ảnh và video tốc_độ cao,trực_tiếp từ iphone,iPad WeTransfer là ứng_dụng giúp người sử_dụng iphone,iPad chia_sẻ hình_ảnh và video với tốc_độ cao mà không cần kết_nối máy_tính Ứng_dụng tích_hợp nhiều cử_chỉ điều_khiển thay_vì nút bấm thông_thường Bạn chỉ cần vuốt tay để tìm tệp_tin hình_ảnh,video muốn chia_sẻ,lựa_chọn và nhấn nút gửi WeTransfer sẽ tải lên tệp_tin được chọn và gửi tới người nhận dưới dạng một email có kèm đường link tải Hiện_tại,bạn có_thể tải WeTransfer miễn_phí từ kho ứng_dụng AppStore Tuy_nhiên,nếu chịu chi 10 USDtháng,bạn sẽ sở_hữu tài_khoản Plus có dung_lượng lưu_trữ tăng lên 50GB so với 10GB mặc_định Link tải 1, Ứng_dụng chia_sẻ hình_ảnh và video tốc_độ cao,trực_tiếp từ iphone,iPad WeTransfer là ứng_dụng giúp người sử_dụng iphone,iPad chia_sẻ hình_ảnh và video với tốc_độ cao mà không cần kết_nối máy_tính 3, iphone_6 đãng giảm_giá,đập vài cái cũng không sao mà Hổng biết thật hay giả mà ngó xót của quá Coi_Hoài_Linh bị đập Iphone không thương_tiếc nè popsmusic changhexuquang TruongGiang HoaiLinh DamVinhHung CamLy 1, iphone_6 đãng giảm_giá,đập vài cái cũng không sao mà 3,Coi_Hoài_Linh bị đập Iphone không thương_tiếc nè
3,Cách mở khóa iphone không cần mật_khẩu
3, iphone_5se sẽ có vỏ 5s,ruột 6s Chuân bi mua điên thoai mơi cac ban ơi Mới_đây,một hãng sản_xuất case cho iphone đã tiết_lộ bản_vẽ thiết_kế cho thấy iphone_5se sẽ có thiết_kế và kích_thước không khác nhiều so với iphone_5s Theo bản thiết_kế này,iphone_5se sẽ có thiết_kế khá vuông_vức,chỉ bo tròn ở các góc mà không bo tròn ở hai cạnh bên như iphone_6 Chính vì_vậy mà chúng_ta có_thể thấy thiết_kế này giống với iphone_5s trước_đây Một thay_đổi khác dễ nhận thấy là các phím âm_lượng được thiết_kế theo hình_tròn và phím nguồn cũng được đặt ở cạnh bên của máy Bên_cạnh đó,nguồn tin này cũng cho_biết phần đường viền của mặt kính cũng được làm cong hơn một_chút so với iphone_5s,để giúp thao_tác vuốt không bị vướng và thoải_mái hơn Tư genkvn 3, iphone_5se sẽ có vỏ 5s,ruột 6s 3, Mới_đây,một hãng sản_xuất case cho iphone đã tiết_lộ bản_vẽ thiết_kế cho thấy iphone_5se sẽ có thiết_kế và kích_thước không khác nhiều so với iphone_5s 3, Theo bản thiết_kế này,iphone_5se sẽ có thiết_kế khá vuông_vức,chỉ bo tròn ở các góc mà không bo tròn ở hai cạnh bên như iphone_6 3,Chính vì_vậy mà chúng_ta có_thể thấy thiết_kế này giống với iphone_5s trước_đây
1, Bên_cạnh đó,nguồn tin này cũng cho_biết phần đường viền của mặt kính cũng được làm cong hơn một_chút so với iphone_5s,để giúp thao_tác vuốt không bị vướng và thoải_mái hơn 2, Tim_Cook lên sóng truyền_hình nói rằng FBI đãng dồn họ đến chân tường Hôm thứ 4 vừa_qua,CEO Tim_Cook đã có cuộc phỏng_vấn trên sóng truyền_hình của kênh ABC News về cuộc_chiến giữa Apple và FBI đãng gây xôn_xao dư_luận trong thời_gian vừa_qua Đây cũng là lần đầu_tiên Tim_Cook có một cuộc trả_lời phỏng_vấn chính_thức,sau khi FBI yêu_cầu Apple phải mở khóa chiếc iphone của kẻ sát_nhân tại San_Bernardino_Trong cuộc phỏng_vấn này,Tim_Cook đã khẳng_định lại quan_điểm của mình về việc mở khóa iphone Ông cho rằng lệnh của tòa_án bắt Apple giúp_đỡ FBI để mở khóa chiếc iphone là điều tồi_tệ của nước Mỹ,nó giống như căn_bệnh ung_thư và sẽ thiết_lập một tiền_lệ xấu xúc_phạm nhiều đến người Mỹ_Sau khi được hỏi liệu Apple có chuẩn_bị gì để chống lại yêu_cầu của FBI tại Tòa_án Tối_cao Hoa_Kỳ,Tim_Cook cho_biết Chúng_tôi sẽ chuẩn_bị tất_cả các biện_pháp để chống lại Apple cũng cho_biết họ sẽ chống lại lệnh của tòa_án và yêu_cầu của FBI Tư genkvn 3, Đây cũng là lần đầu_tiên Tim_Cook có một cuộc trả_lời phỏng_vấn chính_thức,sau khi FBI yêu_cầu Apple phải mở khóa chiếc iphone của kẻ sát_nhân tại San_Bernardino 3, Trong cuộc phỏng_vấn này,Tim_Cook đã khẳng_định lại quan_điểm của mình về việc mở khóa iphone 2, Ông cho rằng lệnh của tòa_án bắt Apple giúp_đỡ FBI để mở khóa chiếc iphone là điều tồi_tệ của nước Mỹ,nó giống như căn_bệnh ung_thư và sẽ thiết_lập một tiền_lệ xấu xúc_phạm nhiều đến người Mỹ 2, Ứng_cử_viên tổng_thống Donald_Trump kêu_gọi tẩy_chay apple tẩy_chay Apple là những gì mà ứng_cử_viên tổng_thống Donald_Trump phát_biểu trong một buổi gặp_mặt cử chi diễn ra tại Nam_Carolina ngày hôm_qua Lời kêu_gọi này được ông đưa ra sau vụ_việc đãng gây tranh_cãi giữa Apple và FBI,liên_quan đến việc bẻ_khóa và lấy dữ_liệu bên trong một chiếc iphone của kẻ sát_nhân Bộ tư_pháp cũng vừa_mới đệ đơn kiến_nghị lên tòa_án,để ra_lệnh buộc Apple phải hợp_tác với FBI Theo đó,Apple sẽ phải giúp FBI bẻ_khóa các mật_mã của chiếc iphone_5c mà tên sát_nhân tại San_Bernardino từng sử_dụng trước khi bị bắt Tuyên_bố này của vị ứng_cử_viên tổng_thống Mỹ càng làm dấy lên những tranh_cãi xung_quanh vụ_việc này Trước đó,một vị ứng_cử_viên thổng thống khác là John_Mc Afee cũng đã trở thành_tâm điểm chú_ý của giới truyền_thông Sau khi ông tuyên_bố sẽ giúp FBI bẻ_khóa chiếc iphone này,nếu_không làm được trong vòng 3 tuần ông sẽ tự ăn chiếc giày của mình trên sóng truyền_hình Fox_News_Cả 2 vị ứng_cử_viên tổng_thống đều có cách của mình để giúp Chính_phủ Mỹ trong vụ_việc này Ông Donald_Trump kêu_gọi tẩy_chay Apple cho_đến khi nào công_ty này chịu giúp_đỡ FBI và bẻ_khóa chiếc iphone của kẻ sát_nhân Tư genkvn 2, ĐƯNG chỉnh iphone của bạn hay bât ki ai về ngày 111970 nêu không muôn no thanh cuc gach Đây là lỗi phần_mềm được ghi_nhận bởi một người dùng Youtube_Khi người này chỉnh ngày trên chiếc iphone của mình về 111970,nó chính_thức biến thành cục gạch và không có cách cứu_chữa,dù đã liên_tục khởi_động lại máy Thậm_chí,sử_dụng i Tunes hay DFU để khôi_phục lại iphone cũng không ăn thu 1,Những con_số chứng_tỏ Apple vẫn là gã khổng_lồ Dù hạ dự_báo tăng_trưởng doanh_số bán iphone trong năm nay nhưng những thống_kê dưới đây chứng_minh Apple vẫn ở đỉnh_cao phong_độ xem hình Từ genkvn
1,Dù hạ dự_báo tăng_trưởng doanh_số bán iphone trong năm nay nhưng những thống_kê dưới đây chứng_minh Apple vẫn ở đỉnh_cao phong_độ xem hình Từ genkvn
1, Apple TV và apple có_lẽ là cú hit lớn nhất của Apple trong Q12016 Apple vừa công_bố báo_cáo tài_chính Q12016 và mọi người chỉ để_ý tới doanh_thu,lợi_nhuận và doanh_số bán hàng của iphone Trong khi đó,có một mảng kinh_doanh được xem là thứ_yếu,được đặt vào trong vị_trí others của Apple có_vẻ như lại là cú hit lớn nhất của quý vừa_qua Trong khi chúng_ta có_thể dễ_dàng biết được doanh_số của iphone là 74,8 triệu chiếc trong Q12016,thì lại rất khó để có_thể biết chính_xác số_lượng Apple TV và apple đã được bán ra Bởi_Apple vẫn gom tất_cả các sản_phẩm này và gộp chung vào mục Others_Tuy nhiên từ báo_cáo của mục các sản_phẩm khác này,chúng_ta phần_nào cũng có_thể đoán được sự tăng_trưởng của Apple TV và apple doanh_thu 4,35 tỷ USD trong Q1 năm tài_khóa 2016,đó không_chỉ là mức tăng_trưởng 62 so với cùng kỳ năm_ngoái,mà_còn tăng 43 so với quý cuối_cùng của năm 2015 Từ genkvn 3, Apple vừa công_bố báo_cáo tài_chính Q12016 và mọi người chỉ để_ý tới doanh_thu,lợi_nhuận và doanh_số bán hàng của iphone 3, Trong khi chúng_ta có_thể dễ_dàng biết được doanh_số của iphone là 74,8 triệu chiếc trong Q12016,thì lại rất khó để có_thể biết chính_xác số_lượng Apple TV và apple đã được bán ra 2,Vậy_là người_người tiêu_dùng Việt_Nam đãng phải mua iphone chính hãng với giá khá đắt Từ genkvn
3, Vượt qua apple trở_thành công_ty giá_trị nhất thế_giới Theo báo_cáo mới nhất từ Financial_Times,Apple đã chính_thức đánh mất ngôi_vị công_ty giá_trị nhất thế_giới vào tay Alphabet,sau nhiều năm nắm giữ vị_trí này Cụ_thể,giá_trị doanh_nghiệp mới_đây của Alphabet đã chạm ngưỡng 420 tỷ USD,vượt qua Apple là 393 tỷ USD Cần phải nhấn_mạnh,trước khi Alphabet trở_thành công_ty có giá_trị doanh_nghiệp lớn nhất thế_giới,Apple đã nắm giữ vị_trí này trong khoảng 15 năm liên_tiếp Còn ở khía_cạnh giá_trị vốn hóa,Apple hiện vẫn đãng là công_ty có giá_trị vốn hóa thị_trường lớn nhất thế_giới với khoảng 535 tỷ USD Trong đó,lý_do chủ_yếu khiến Apple mất đi ngôi_vị cao_quý là bởi,Cupertino đãng phụ_thuộc quá nhiều vào iphone Khi nhu_cầu smartphone trên thế_giới đãng giảm,phong_độ của Apple cũng bị giảm theo Do_đó,các nhà_đầu_tư đãng mất dần kỳ_vọng vào apple xu_hướng thoái vốn Ngoài_ra,một lý_do khác khiến Apple mất đi ngôi_vị bấy_lâu,là do hãng đãng nắm giữ quá nhiều tiền_mặt Một công_ty càng nắm nhiều tiền_mặt trong tay,giá_trị doanh_nghiệp càng bị giảm trừ Theo một_số chuyên_gia,Apple đãng có dấu_hiệu đi xuống tương_tự những Nokia,BlackBerry trước_đây Từ genkvn 2, Trong đó,lý_do chủ_yếu khiến Apple mất đi ngôi_vị cao_quý là bởi,Cupertino đãng phụ_thuộc quá nhiều vào iphone 3, Lộ_diện bằng_sáng_chế về thiết_bị màn_hình cong của apple thế_hệ iphone thứ 8,tức_là iphone_6 trở đi,Apple đã có thay_đổi trong việc chế_tạo màn_hình của thiết_bị,với 3D Touch và màn_hình được bo ở các cạnh Các thay_đổi này tuy không quá lớn,nhưng đem lại một sự tiện_dụng không nhỏ cho người sử_dụng Màn_hình cong đãng dần được sử_dụng nhiều trên các thiết_bị gần đây như TV,điện_thoại,đồng_hồ Tuy_nhiên Apple có_vẻ khá im hơi lặng tiếng với vấn_đề này và trung_thành với màn hình_phẳng truyền_thống Mặc_dù vậy,một bằng_sáng_chế rò_rỉ của Apple đã gợi_ý về màn_hình cong sẽ được sử_dụng trong tương_lai Nhìn vào hình_ảnh trên,chúng_ta có_thể thấy một thiết_bị dạng thanh,với màn_hình được uốn cong thành_hình ống Ngoài_ra thiết_bị còn có một cổng âm_thanh 35,nút gạt im_lặng đặc_trưng của các sản_phẩm apple 2 bộ_phận khác có_thể là nút bấm của thiết_bị Với những đặc_điểm như_vậy,rất có_thể màn_hình cong sẽ được áp_dụng vào iphone sau_này Từ techzvn 3, Từ thế_hệ iphone thứ 8,tức_là iphone_6 trở đi,Apple đã có thay_đổi trong việc chế_tạo màn_hình của thiết_bị,với 3D Touch và màn_hình được bo ở các cạnh 3, Với những đặc_điểm như_vậy,rất có_thể màn_hình cong sẽ được áp_dụng vào iphone sau_này Từ techzvn 3, Google trả 1 tỷ USD mỗi năm để được là công_cụ tìm_kiếm trên iphone Với những người sử_dụng iphone hay các sản_phẩm của apple sẽ thấy rằng khi gõ một ký_tự bất_kỳ vào đường_dẫn trên trình_duyệt,ngay_lập_tức màn_hình sẽ hiển_thị những kết_quả tìm_kiếm Google liên_quan đến ký_tự này Nhiều người coi đó là điều đương_nhiên khi cho rằng,đơn_giản là bởi Google là công_cụ tìm_kiếm số 1 thế_giới Tuy_nhiên thực_tế thì lại không phải như_vậy Trang tin Bloomberg vừa phát_hiện ra rằng,có_vẻ như Google đã phải bỏ 1 số tiền không nhỏ mỗi năm cho Apple để được là công_cụ tìm_kiếm mặc_định trên các sản_phẩm i Device_Thông tin này đã được phát_giác khi các luật_sư công_khai một_số tài_liệu trong vụ kiện_tụng đã kđéo_dài 6 năm giữa Oracle và Google_Số tiền cụ_thể mà Google phải trả cho Táo khuyết tính riêng trong năm 2014 là 1 tỷ USD Bên_cạnh số tiền khổng_lồ trên,Apple và Google cũng đã có những thoả_thuận về việc ăn_chia lợi_nhuận mà gã khổng_lồ kiếm được từ các thiết_bị ios của Táo khuyết Từ techzvn 3,Google trả 1 tỷ USD mỗi năm để được là công_cụ tìm_kiếm trên iphone
3, Với những người sử_dụng iphone hay các sản_phẩm của apple sẽ thấy rằng khi gõ một ký_tự bất_kỳ vào đường_dẫn trên trình_duyệt,ngay_lập_tức màn_hình sẽ hiển_thị những kết_quả tìm_kiếm Google liên_quan đến ký_tự này 1, TIN_HOT Uống_Phúc_Long_Rinh ngay iphone_6 và hàng trăm giải_thưởng giá_trị khác Phuc_Long_Coffee_Tea_House tưng_bừng chào_đón mùa Giáng_Sinh 2015 bằng một chương_trình quay số thật hấp_dẫn nè cả nhà ơi Thật đơn_giản,chỉ cần click vào đường link bên dưới tham_gia vòng quay may_mắn của chương_trình là bạn đã có cơ_hội nhận liền_tay 50 chiếc ly sứ xinh_xắn cùng 500 voucher Phúc_Long cực hấp_dẫn nha Đặc_biệt,bạn nào có tài tiên_đoán chính_xác số_lượng người tham_gia chương_trình còn có cơ_hội nhận chiếc iphone_6 thời_thượng cực sang chảnh nữa nhé Nào,cùng thử vận may và nhận ngay những phần quà hấp_dẫn thôi Link tham_gia 1,TIN_HOT Uống_Phúc_Long_Rinh ngay iphone_6 và hàng trăm giải_thưởng giá_trị khác
1, Đặc_biệt,bạn nào có tài tiên_đoán chính_xác số_lượng người tham_gia chương_trình còn có cơ_hội nhận chiếc iphone_6 thời_thượng cực sang chảnh nữa nhé 3,Các fan của Hiruscar_Post_Acne đã tham_gia chương_trình Bừng_Sáng_Giáng_Sinh_Rinh iphone_6 chưa Còn lại 7 ngày thôi Chương_trình đã có hơn 4000 bạn tham_gia rồi đó Các bạn còn lại cũng nhanh chân lên nhé Không biết chiếc iphone_6 và 90 giải_thưởng hấp_dẫn từ nhãn hàng sẽ về tay ai Tham_gia ngay
3,Các fan của Hiruscar_Post_Acne đã tham_gia chương_trình Bừng_Sáng_Giáng_Sinh_Rinh iphone_6 chưa
3,Không biết chiếc iphone_6 và 90 giải_thưởng hấp_dẫn từ nhãn hàng sẽ về tay ai
1, Chương_trình chào_mừng giáng_sinh trúng thưởng thật thích của Hiruscar_Post_Acne bắt_đầu rồi đấy các bạn ơi Giải nhất lần này chính là 1 chiếc iphone_6 sang chảnh thời_thượng dành cho người chơi hội_tụ đủ các yếu_tố sau Xem hết clip Bừng sáng giáng_sinh,luông_linh năm mới Trả_lời đúng các câu_hỏi về clip May_mắn được nhãn hàng lựa_chọn Ngoài_ra,còn 90 phần quà hấp_dẫn không kém đãng chờ ban Tham_gia ngay nào 1,Giải nhất lần này chính là 1 chiếc iphone_6 sang chảnh thời_thượng dành cho người chơi hội_tụ đủ các yếu_tố sau
3,Cái cục đó trên tai_nghe iphone không phải chỉ để chỉnh tonhỏ tiếng đâu nha
2,Thời_lượng pin yếu_ớt của iphone luôn là vấn_đề nhức_nhối của chúng_ta Vậy vì_sao lại vậy
1, Vượt qua cả iphone_6s,Samsung S7 đãng mang trong mình chi xử_lý di_động mạnh nhất thế_giới chip sinh_nhậtapdragon 820 1,chiếc iphone mới nhỏ xinh này đãng được bàn_tán sôi_nổi hơn cả Samsung S7 Đơn_giản Nó là iphone và là sản_phẩm của Apple
1,chiếc iphone mới nhỏ xinh này đãng được bàn_tán sôi_nổi hơn cả Samsung S7
3,Đơn_giản Nó là iphone và là sản_phẩm của Apple
3, iphone với ios hơi bị nhiều rồi,giờ là thông_tin dành cho anh_em Android 1, Nếu iphone của bạn có màn_hình cảm_ứng lực,bạn sẽ có_thể dùng những tính_năng cực_kì tiện_dụng này 3 3,Cũng là iphone nhưng có sự khác_biệt đấy nhé
1, Apple xây_dựng chiến_lược quảng_bá sản_phẩm rất tài_tình,và họ đã thành_công khi khiến bạn phát cuồng với iphone 1,Thời_cơ mua_sắm tới rồi iphone_5s khóa mạng đã rẻ như mốc 5c khóa mạng năm_ngoái
1,iphone_5s khóa mạng đã rẻ như mốc 5c khóa mạng năm_ngoái
1,Mách bạn cách bán iphone cũ vừa được_giá vừa an_toàn cho bản_thân không bị lộ thông_tin nhạy_cảm
1, Kết_quả cho thấy,iphone_6S vẫn là smartphone nhất hiện_nay 3,Những thứ mà chúng_ta vốn chỉ thấy ở iphone thì_giờ đãng xuất_hiện ở rất nhiều thương_hiệu khác 3 Vậy chiếc iphone tiếp_theo nên trang_bị cái gì để trở_nên khác_biệt
3,Những thứ mà chúng_ta vốn chỉ thấy ở iphone thì_giờ đãng xuất_hiện ở rất nhiều thương_hiệu khác 3
3,Vậy chiếc iphone tiếp_theo nên trang_bị cái gì để trở_nên khác_biệt
1,Camera không lồi mà con Kép nữa iphone_7 được như trong bài thì hết xẩy quá
1,Chiếc tai_nghe iphone nó còn nhiều tính_năng ẩn mà chúng_ta không để_ý
3, Có iphone là một chuyện,làm_sao để sử_dụng hết khả_năng của nó lại là một chuyện khác 3 Bạn có tự_tin rằng mình đã biết hết những điều này 3,Mình đãng cần tậu một cái bao cho iphone_6 và một cái cho iphone_5 mà có_thể gắn lên ghi_đông xe và chống nước như trong hình Chủ_yếu là để dùng iphone làm định_vị Bạn nào biết ở VN mình chổ nào có thì hướng_dẫn dùm mình nhe Cảm_ơn các bạn
3,Mình đãng cần tậu một cái bao cho iphone_6 và một cái cho iphone_5 mà có_thể gắn lên ghi_đông xe và chống nước như trong hình
3,Chủ_yếu là để dùng iphone làm định_vị
2, Ôi trời,Iphone sắp xoá_sổ Ipad luôn rồi 1,Tiếp phần 2 iphone năm nào cũng có ảnh chế Cười từ sáng tới giờ
3, Dính ngay cái đầu_tiên Đó giờ cứ tưởng là chỉ có sạc zin iphone mới là hàng xịn,hóa_ra không phải 1,Quá đẹp ngay từ cái nhìn đầu_tiên 3 3 3 Giá_Sale cho 30 khách_hàng đầu_tiên còn 250k giá chưa Sale 320k Nhận đặt_hàng ngay hôm_nay DUY_NHẤT tại IPhoneDep
