3, HOT_NHẤT_QUẢ_ĐẤT Hàng nóng vừa ra_lò vừa thổi vừa ăn,anh_em dùng iphone vào đọc hướng_dẫn ngay để fix lỗi sản_phẩm nhé Ad sẽ theo_dõi liên_tục,có gì không hiểu anh_em cứ để lại ý_kiến nhé 2, Vì vội_vàng đi dự đám_tang người_thân ở quê vợ,vị khách vô_tình làm rớt chiếc Iphone của mình trên chiếc taxi Trong lúc hoang_mang vi chẳng thấy điện_thoại đâu Tích tốc bà_xã của vị khách liền gọi cho đầu dây bên kia để tìm lại của mất thì một giọng nói cất lên và nói 2, Vì vội_vàng đi dự đám_tang người_thân ở quê vợ,vị khách vô_tình làm rớt chiếc Iphone của mình trên chiếc taxi 1, Just for fun Không biết trong tương_lai iphone có được trang_bị tính_năng này không nhỉ Nếu có thì quá là tuyệt_vời,chả bao_giờ phải sợ rơi vỡ màn nữa 3,Choáng với hiệu_ứng domino từ 10 nghìn chiếc iphone
3, Khi bạn mua một chiếc Iphone 4 Người khác mua được một chiếc máy_giặt Khi bạn mua 1 cái iphone 4s Người khác mua được_một_cái tủ_lạnh Khi bạn mua 1 chiếc iphone_5 Người khác lại mua được_một_cái điều_hòa cùng một_số đồ gia_dụng trong nhà Khi bạn mua một chiếc iphone_5S Người khác mua được_một_cái Laptop_Khi bạn mua một chiếc iphone_6 Người khác mua được_một_cái Tivi LCD màn_hình có kích thức 55 inch Khi bạn mua một chiếc iphone_6S Người khác lại mua được một bộ Sofa kiểu Tây_Khi những chiếc điện_thoại cũ của bạn đổi thành những chiếc chậu rửa mặt Inox_Thì người khác đã có nhà_riêng của mình rồi Với những người trẻ tuổi đãng phấn_đấu lập_nghiệp Thay_vì mua iphone,hãy dùng tiền để làm những việc khác có ý_nghĩa hơn Với con_trai thì hãy đầu_tư vào kinh_doanh,với con_gái thì hãy tiết_kiệm để chăm_sóc cho bản_thân mình,không nên quá chạy theo thời_đại mà bỏ lỡ nhiều việc lớn khác 2, Tính_năng chống trộm của iphone và Macbook quá kém Vào đêm_ngày 133 mới_đây,nhóm cán_bộ của FPT_IS khi đi công_tác tại Nghệ_An đã bị kẻ_gian đột_nhập trong lúc đãng ngủ và lấy đi một laptop Macbook,một iphone_5s,một iphone_6 Điều đáng chú_ý là ở hiện_trường thời_điểm đó còn có cả một điện_thoại bàn,một máy_tính_để_bàn có màn_hình 14 inch,dày khoảng hai gang tay,chạy Win98,cùng một con Nokia 1110i màn_hình đen_trắng,âm_thanh nổi,phím cao_su Tại_sao kẻ_trộm không lấy cả những thứ đó mà_lại chỉ lấy Macbook và iphone Lý_do rất dễ hiểu vì tính_năng chống trộm của Macbook và iphone quá kém,nên kẻ_trộm mới dễ_dàng lấy đi như_vậy Đây sẽ là gáo nước_lạnh giội vào niềm tự_hào của Apple khi mà cái tính_năng chống trộm trên Macbook,iphone được họ ca_ngợi hết_lời thực_ra còn thua cả điện_thoại bàn,thua cả máy_tính cổ_lỗ_sĩ đời_đầu,và thua cả một con Nokia cục gạch 2,Tính_năng chống trộm của iphone và Macbook quá kém
2, Vào đêm_ngày 133 mới_đây,nhóm cán_bộ của FPT_IS khi đi công_tác tại Nghệ_An đã bị kẻ_gian đột_nhập trong lúc đãng ngủ và lấy đi một laptop Macbook,một iphone_5s,một iphone_6 3,Tại_sao kẻ_trộm không lấy cả những thứ đó mà_lại chỉ lấy Macbook và iphone
2, Lý_do rất dễ hiểu vì tính_năng chống trộm của Macbook và iphone quá kém,nên kẻ_trộm mới dễ_dàng lấy đi như_vậy 2, Đây sẽ là gáo nước_lạnh giội vào niềm tự_hào của Apple khi mà cái tính_năng chống trộm trên Macbook,iphone được họ ca_ngợi hết_lời thực_ra còn thua cả điện_thoại bàn,thua cả máy_tính cổ_lỗ_sĩ đời_đầu,và thua cả một con Nokia cục gạch 3,iphone_5SE được tìm thấy tại 1 khu chợ Trung_Quốc_Ngạc nhiên chưa iphone_5SE
3,Rất có_thể dải nhựa anten trên iphone_7 sẽ trông như_thế_này
1,Một trong những tính_năng bá nhất của iphone_7 đây rồi
1,Hình_ảnh iphone_7 dựa theo các thông_tin bị rò_rỉ từ hôm_qua quá đẹp
3,Hình_ảnh iphone_7 dựa theo các thông_tin bị rò_rỉ từ hôm_qua
2,Khách thích iphone Khách không thích trả tiền Khách bày nhân_viên ăn_cắp máy để đem cho khách aevl đừng như khách
3, apple các ứng_dụng đãng chạy trong ios không giúp tiết_kiệm pin và đỡ lag hơn Rất nhiều người tin rằng việc sử_dụng tính_năng multitasking của ios,để ép đóng các ứng_dụng đãng chạy sẽ giúp thiết_bị của họ tiết_kiệm pin hơn hoặc cải_thiện tốc_độ khi mà chiếc iphone bỗng_dưng trở_nên chậm hoặc lag Tuy_nhiên sự_thật có_vẻ không phải như_vậy Phó_chủ_tịch cấp cao quản_lý công_nghệ_phần_mềm của apple Craig_Federighi cho_biết ios sẽ tự_động đóng các ứng_dụng khi nó cần nhiều bộ_nhớ hơn để chạy các ứng_dụng khác Và sự_thật là các ứng_dụng chạy đã_nhiệm của bạn không hề được chạy ở chế_độ nền,mà ios đã đóng_băng ngay từ khi bạn rời khỏi ứng_dụng đó và chỉ được kích_hoạt khi bạn quay trở_lại Chỉ trừ các ứng_dụng như nghe nhạc,ghi_âm,định_vị hay Skype_Tất cả các ứng_dụng được phép chạy nền,sau_này sẽ được đặt một biểu_tượng bên_cạnh biểu_tượng pin để bạn có_thể biết ứng_dụng nào đãng trong chế_độ chạy nền Thậm_chí việc tắt các ứng_dụng đãng chạy nền còn có_thể khiến cho thiết_bị của bạn tiêu_hao nhiều pin hơn Vì khi đã tắt các ứng_dụng đó,việc khởi chạy lại sẽ làm cho hệ_thống phải load lại dữ_liệu vào RAM Bạn sẽ mất nhiều thời_gian hơn và tốn pin hơn Apple cũng cung_cấp cho bạn một công_cụ để có_thể biết được ứng_dụng nào tiêu tốn nhiều pin nhất Bạn có_thể vào Settings_Battery và kđéo xuống mục Battery_Usage_Tại đây sẽ có danh_sách các ứng_dụng ngốn pin nhất được thống_kê theo 24 giờ hoặc 7 ngày Nếu là các ứng_dụng không cần_thiết,bạn có_thể hạn_chế bằng cách không cho_phép nó xuất_hiện trong Background_App_Refresh đây là các ứng_dụng được phép chạy ngay cả khi bạn đã thoát ra khỏi ứng_dụng đó Tính_năng multitasking dùng để force quit một ứng_dụng nào_đó đãng chạy,chỉ nên được sử_dụng khi bạn muốn tắt một ứng_dụng khi bị treo hoặc bị lỗi Tham_khảo macrumors 3, Rất nhiều người tin rằng việc sử_dụng tính_năng multitasking của ios,để ép đóng các ứng_dụng đãng chạy sẽ giúp thiết_bị của họ tiết_kiệm pin hơn hoặc cải_thiện tốc_độ khi mà chiếc iphone bỗng_dưng trở_nên chậm hoặc lag 3,Đệt iphone_7 plus thật các mẹ ạ
1, Khó tin nhưng chắc sẽ có thật,iphone_7 có camera kép 3,Xin_lỗi anh chỉ là thằng bán iphone yêu nghề kkk
3, Trò_đùa cũ_rích mà vẫn rất nhiều người bị lừa,làm_gì có chuyện tặng 100 iphone_6s,xe_máy,ô_tô đắt tiền dễ thế được Dù_sao thì cũng tạo thành trào_lưu troll ăn_theo khá vui 2, Trò_đùa cũ_rích mà vẫn rất nhiều người bị lừa,làm_gì có chuyện tặng 100 iphone_6s,xe_máy,ô_tô đắt tiền dễ thế được 2, Đầu_tiên là 5 cái mẹc,và giờ là 20 cái SH và 100 cái iphone_6s Plus_Mấy ngày này rất nhiều người ăn quả_lừa 3, Đầu_tiên là 5 cái mẹc,và giờ là 20 cái SH và 100 cái iphone_6s Plus 1,Nói không phải ngoa chứ gái nào dùng iphone cũng xinh
3,Ai đủ bình_tĩnh cho Ad hỏi Đây là Iphone gì mà to quá vậy
2,Các thanh_niên đừng có dại mà tự so_sánh mình với iphone nhé
2, Trong những ngày gần đây,xôn_xao khắp mạng xã_hội Facebook_Việt_Nam là những dòng chia_sẻ về chương_trình tặng miễn_phí xe ô_tô Mercedes_Benz hay iphone_6S Thế_nhưng,ít ai nghĩ rằng,đằng sau đó lại là màn dàn_dựng tinh_vi và mang đầy tính_chất lừa_đảo 3, Trong những ngày gần đây,xôn_xao khắp mạng xã_hội Facebook_Việt_Nam là những dòng chia_sẻ về chương_trình tặng miễn_phí xe ô_tô Mercedes_Benz hay iphone_6S 3, Có nên đợi mua iphone_se Dự_kiến Apple sẽ công_bố iphone_se vào ngày 213 hoặc 223,thiết_bị màn_hình 4 inch giá có_thể từ 9 triệu đồng chưa xac thưc Vậy liệu với mức giá ấy,đây có phải là một chiếc điện_thoại đáng để mọi người phải chờ_đợi để mua Hay xem qua nhưng điêm đãng chu y vê chiêc iphone mơi theo như nhưng thông_tin ro ri trươc đây nhe Về kích_thước màn_hình iphone_se sẽ có màn_hình 4inch là sản_phẩm nhắm đến đối_tượng là những khách_hàng muốn một thiết_bị iphone nhỏ gọn và dễ_dàng sử_dụng với một tay Về kiểu_dáng Hiện kiểu_dáng của iphone_se còn gây nhiều tranh_cãi,trong đó đáng chú_ý là trang 9to5mac cho rằng sản_phẩm sẽ có thiết_kế giống iphone_55S,còn tài_khoản Onleaks trên Twitter và trang công_nghệ Curved thì tin máy kế_thừa thiết_kế của iphone_6 Về cấu_hình Chiêc iphone mơi cua Apple đươc ky vong trang bi chip A9,RAM 1GB,bô nhơ lưu trư tich hơp 1664GB,may anh chinh 12 megapixel va tich hơp NFC,apple giữ ở mức dung_lượng khoảng 1642 mAh Tư didongvietvn 3,Có nên đợi mua iphone_se
3, Dự_kiến Apple sẽ công_bố iphone_se vào ngày 213 hoặc 223,thiết_bị màn_hình 4 inch giá có_thể từ 9 triệu đồng chưa xac thưc 3,Hay xem qua nhưng điêm đãng chu y vê chiêc iphone mơi theo như nhưng thông_tin ro ri trươc đây nhe
3,Về kích_thước màn_hình iphone_se sẽ có màn_hình 4inch là sản_phẩm nhắm đến đối_tượng là những khách_hàng muốn một thiết_bị iphone nhỏ gọn và dễ_dàng sử_dụng với một tay
3, Về kiểu_dáng Hiện kiểu_dáng của iphone_se còn gây nhiều tranh_cãi,trong đó đáng chú_ý là trang 9to5mac cho rằng sản_phẩm sẽ có thiết_kế giống iphone_55S,còn tài_khoản Onleaks trên Twitter và trang công_nghệ Curved thì tin máy kế_thừa thiết_kế của iphone_6 3, Về cấu_hình Chiêc iphone mơi cua Apple đươc ky vong trang bi chip A9,RAM 1GB,bô nhơ lưu trư tich hơp 1664GB,may anh chinh 12 megapixel va tich hơp NFC,apple 2, Vì_sao Bill_Gates cấm vợ_con ông sử_dụng sản_phẩm của apple 2009,vợ Bill_Gates bà Melinda_Gates đã tiết_lộ với báo_giới rằng bà và 3 đứa con không được phép sử_dụng các sản_phẩm của apple rất ít thứ bị cấm trong gia_đình tôi,trong đó i Pod và iphone là thứ các con chúng_tôi không được phép sử_dụng Tuy_nhiên tôi nhìn các bạn tôi sử_dụng iphone thì tôi thấy cũng hay đấy chứ Melinda_Gates chia_sẻ Năm 2012,trong một cuộc phỏng_vấn bà cho_biết rằng luật cấm vẫn còn hiệu_lực tuy các con của ông_bà đã hỏi sử_dụng sản_phẩm của apple chúng được cung_cấp các sản_phẩm của microsoft thay_thế Tuy_nhiên trong năm 2014,người_ta đã phát_hiện Bill_Gates đãng sử_dụng một chiếc iphone_5s màu trắng có gắn case màu đỏ,sau đó ông xác_nhận rằng đó chỉ để phục_vụ việc thử_nghiệm hiệu_năng của đối_thủ Lí_giải cho điều này,Bill_Gates và gia_đình ông được coi là gương_mặt đại_diện cho microsoft_Apple đã từng kiện microsoft ra toà cho_nên sự căng_thẳng giữa hai công_ty lớn dần,nếu Bill_Gates hay bất_kì ai trong gia_đình ông sử_dụng sản_phẩm từ đối_thủ sẽ gây tiếng xấu cho cả công_ty và có_thể ông không còn được các nhân_viên coi_trọng Vậy nên việc cấm gia_đình ông sử_dụng sản_phẩm của đối_thủ là điều hợp_lí 2, Có rất ít thứ bị cấm trong gia_đình tôi,trong đó i Pod và iphone là thứ các con chúng_tôi không được phép sử_dụng 1,Tuy_nhiên tôi nhìn các bạn tôi sử_dụng iphone thì tôi thấy cũng hay đấy chứ Melinda_Gates chia_sẻ
3, Tuy_nhiên trong năm 2014,người_ta đã phát_hiện Bill_Gates đãng sử_dụng một chiếc iphone_5s màu trắng có gắn case màu đỏ,sau đó ông xác_nhận rằng đó chỉ để phục_vụ việc thử_nghiệm hiệu_năng của đối_thủ 3,Tiếp_tục giải_quyết vấn_đề đầy bộ_nhớ trên iphone nào
1,Cảm_ơn những khách_hàng thân_thiết đã ủng_hộ Iphonedep thời_gian qua ạ
1, Sau nhiều vụ_việc liên_quan đến FBI và các yêu_cầu bảo_mật,Apple đã chính_thức tuyên_bố sẽ tiếp_tục pháT_Triển để iphone trở_thành một trong những chiếc điện_thoại thông_minh an_toàn nhất thế_giới Đây là phát_biểu được đại diên Apple trả_lời tờ New_York_Times trong một bài phỏng_vấn gần đây Các fan của trái táo cắn dở có tin_tưởng vào mức_độ bảo_mật của em dế cưng không 1, Sau nhiều vụ_việc liên_quan đến FBI và các yêu_cầu bảo_mật,Apple đã chính_thức tuyên_bố sẽ tiếp_tục pháT_Triển để iphone trở_thành một trong những chiếc điện_thoại thông_minh an_toàn nhất thế_giới 1, Có tin_đồn cho rằng năm sau Apple sẽ iphone 4 với chip A9 và vỏ kim_loại với giá rẻ hơn cả 6S hiện_nay Cá_nhân ad vẫn thích mẫu thiết_kế của iphone 4,việc pháT_Triển lại mẫu này chắc_chắn sẽ khiến nhiều ifan thích_thú,còn các bạn thì_sao 1,Có tin_đồn cho rằng năm sau Apple sẽ iphone 4 với chip A9 và vỏ kim_loại với giá rẻ hơn cả 6S hiện_nay
1, Cá_nhân ad vẫn thích mẫu thiết_kế của iphone 4,việc pháT_Triển lại mẫu này chắc_chắn sẽ khiến nhiều ifan thích_thú,còn các bạn thì_sao 3,Sự khác_nhau giữa Android và Iphone
1, Anshuman một nghệ_sĩ thuộc trường_phái thị_giác tại Nam_Phi mới_đây đã đăng_tải lên trang cá_nhân của mình những bức hình ngộ_nghĩnh và đầy sáng_tạo với chiếc điện_thoại iphone Mời cả nhà cùng xem nhé,Ad phải xem đi xem_lại mấy lần rồi download ảnh về luôn,cực_kỳ sáng_tạo FPTArena 1,Anshuman một nghệ_sĩ thuộc trường_phái thị_giác tại Nam_Phi mới_đây đã đăng_tải lên trang cá_nhân của mình những bức hình ngộ_nghĩnh và đầy sáng_tạo với chiếc điện_thoại iphone
1, Hạnh_phúc là được thể_hiện phong_cách bản_thân,được theo_đuổi niềm đãm_mê riêng,được quyết_định làm điều mình muốn Đấy là thông_điệp mà cuộc_thi Chụp ảnh cùng Attila_Passing EFI muốn gửi đến cộng_đồng BTC hi_vọng cuộc_thi sẽ khơi nguồn cảm_hứng,giúp cho tất_cả các bạn tham_gia cuộc_thi nói_riêng cũng_như cộng_đồng Attila_Passing EFI dám tự_tin thể_hiện bản_thân,theo_đuổi những mơ_ước ấp_ủ và tìm được niềm hạnh_phúc thật_sự khi làm được điều mình mong_muốn Cuối_cùng,cuộc_thi đã khép lại và cũng đã tìm được chủ_nhân của giải chung_cuộc là siêu phẩm iphone_5,đó chính là bạn Liem_Nguyen_Hoang_Xin chúc_mừng bạn đã nhận được giải_thưởng Mong bạn sẽ luôn thành_công và dám tự_tin theo_đuổi niềm đãm_mê của mình trong cuộc_sống bạn nhé Hạnh_phúc của bạn là gì Hãy chia sẽ với cộng_đồng Attila_Passing EFI 3, Cuối_cùng,cuộc_thi đã khép lại và cũng đã tìm được chủ_nhân của giải chung_cuộc là siêu phẩm iphone_5,đó chính là bạn Liem_Nguyen_Hoang 3, Thông_báo người chiến_thắng chung_cuộc Các bạn ơi Cuối_cùng thì cuộc_thi Chụp Ảnh Cùng_Attila_Passing EFI đã khép lại sau 6 tuần tranh_đua hấp_dẫn Và giải_thưởng chung_cuộc là siêu phẩm công_nghệ iphone_5 đã thuộc về bạn Liem_Nguyen_Hoang_Xin chúc_mừng BTC xin gửi lời cảm_ơn đến các thí_sinh đã tham_gia cuộc_thi cũng_như cộng_đồng SYM Attila_Passing EFI đã theo_dõi và ủng_hộ chương_trình suốt thời_gian qua BTC sẽ cải_thiện hệ_thống để tránh các sự_việc gian_lận và tạo công_bằng cho tất_cả các bạn tham_gia ở chương_trình kể tiếp Hỏi_nhỏ nhé,các bạn muốn du_lịch cùng Attila_Passing EFI không,hãy theo_dõi thông_báo tiếp_theo từ Admin các bạn nhé 3,Và giải_thưởng chung_cuộc là siêu phẩm công_nghệ iphone_5 đã thuộc về bạn Liem_Nguyen_Hoang
1, CHƯƠNG_TRÌNH_KHÁCH_HÀNG_THÂN_THIẾT Tất_cả giao_dịch của bạn với Sacombank đều sẽ được tích điểm để được đổi những phần quà vô_cùng hấp_dẫn như Laptop,Iphone,tranh_phong thủy,phiếu mua_sắm du_lịch,chơi golf đấy nhé Đặc_biệt,bạn còn có cơ_hội trở_thành khách_hàng VIP của Sacombank dựa trên điểm tích_lũy giao_dịch Tham_gia Khách_hàng thân_thiết,bạn còn được ưu_tiên giao_dịch tại quầy,nhận hoa và quà nhân ngày sinh_nhật hay ngày thành_lập doanh_nghiệp Hãy giao_dịch với Sacombank để tận_hưởng nhiều ưu_đãi hấp_dẫn bạn nhé Liên_hệ 1900 5555 88 hoặc truy_cập để biết thông_tin chi_tiết Chương_trình này ngay thôi 1, Tất_cả giao_dịch của bạn với Sacombank đều sẽ được tích điểm để được đổi những phần quà vô_cùng hấp_dẫn như Laptop,Iphone,tranh_phong thủy,phiếu mua_sắm du_lịch,chơi golf đấy nhé 1, Đọc nhiều hơn,chi_phí rẻ hơn Trên cả ipad,iphone,android,và trình_duyệt 3, Trên cả ipad,iphone,android,và trình_duyệt 1, Chưa nơi nào nhân_viên có nhiều quyền tự_do cá_nhân như ở FSOFT Đây là khẳng_định của Nguyễn_Ích_Hoàn FSU11BU8 Hoàn cũng là chủ_nhân may_mắn của chiếc iphone_6s trong chương_trình RUF Offline quý IV do Trung_tâm tuyển_dụng REC tổ_chức vào đầu tháng 1 vừa_qua Có bạn nào muốn nhận iphone_6S như bạn Hoàn không Gia_nhập đại_gia_đình FSOFT và Tham_gia ngay Chương_trình Giới_thiệu ứng_viên RUF nhé Bên_cạnh mức thưởng hiện_kim hấp_dẫn,những chiếc iphone_6S,Surface_Pro hay những chuyến du_lịch Nhật_Bản và xa hơn_nữa đãng chờ đón các bạn FSOFTer nhé RUFFSOFTCOMVN TuyenDungFSOFT 1,Hoàn cũng là chủ_nhân may_mắn của chiếc iphone_6s trong chương_trình RUF Offline quý IV do Trung_tâm tuyển_dụng REC tổ_chức vào đầu tháng 1 vừa_qua
3,Có bạn nào muốn nhận iphone_6S như bạn Hoàn không 1, Bên_cạnh mức thưởng hiện_kim hấp_dẫn,những chiếc iphone_6S,Surface_Pro hay những chuyến du_lịch Nhật_Bản và xa hơn_nữa đãng chờ đón các bạn FSOFTer nhé RUFFSOFTCOMVN TuyenDungFSOFT 3,Ai thích dùng iphone lock thì mua ngay kìa
3,Nếu nâng_cấp máy mới anh_em sẽ chọn GalaxyS7 hay iphone_6s
3,Rất có_thể năm sau thế_hệ iphone mới sẽ trang_bị màn_hình OLED
1,Nhiều thông_tin thú_vị được bật_mí quanh vụ_việc FBI yêu_cầu Apple unlock iphone
3,S7Edge cùng bơi nước với iphone_6s xem ai lặn nước lâu hơn
3, BẠN_CÓ_BIẾT Ford_Focus cũng nằm trong bộ sưu_tập xe của nhiều người nổi_tiếng 1 Bill_Gates đã từng đi làm trên một chiếc Focus 2 Đức_Giáo hoàng Francis cũng từ_bỏ chiếc xe đắt tiền khác để chọn Ford_Focus làm_công xa của mình 3 Vợ_chồng nữ diễn_viên từng đoạt giải Oscar_Reese_Witherspoon sở_hữu chiếc Ford_Focus màu bạc 4 Ca_sĩ người Anh Lily_Allen sắm cho mình một chiếc Ford_Focus RS xanh lá độc_đáo Bạn đã sở_hữu dòng xe hot này chưa Hãy tham_gia lái thử Focus vào cuối tuần này để trải_nghiệm và có cơ_hội trúng một chiếc Focus_Mới và 26 chiếc iphone_6S Hà_Nội_Ngày 23,241 tại TTTM Vincom_Long_Biên TP_HCM Ngày 23,241 tại KCX Tân_Thuận,Q7 Đường 24 3, LÁI_THỬ_FOCUS_MỚI_TRÚNG_FOCUS_MỚI Bạn muốn thử cảm_giác sau tay_lái Ford_Focus tuyệt_vời như_thế_nào Bạn muốn có cơ_hội trúng một chiếc Focus_Mới và hàng chục chiếc iphone_6S sành_điệu Hãy đăng_ký lái thử xe để có tất_cả những cơ_hội ngay hôm_nay Nhấp chuột để đăng_ký Thời_gian và địa_điểm các buổi lái thử như sau Hà_Nội 16 171 Sân_vận_động Mỹ_Đình 23 241 Vincom_Long_Biên TP_HCM 16171 và 23241 Khu_chế_xuất Tân_Thuận,P_Tân_Thuận_Đông,Q7,HCM 3,Bạn muốn có cơ_hội trúng một chiếc Focus_Mới và hàng chục chiếc iphone_6S sành_điệu
3, Thời_buổi này Chưa cưới thì ở với nhau như đã cưới rồi Còn cưới rồi thì nằm chia giường như chưa hề đưa nhau ra phường đăng_ký Vật_nuôi thì áo quấn như con_người Người thì nude không khác_gì con vật Còn trẻ thì già_đời triết_lí như ông_cụ Trong khi người_lớn thì lại suy_nghĩ ấu_trĩ như trẻ_con Gái thì nam_tính hùng_hổ không khác_gì đàn_ông Trai thì ẻo_lả không khác_gì phụ_nữ Thằng không có_của thì tiêu tiền như rác,tỏ ra không khác_gì đại_gia Người giàu thật thì giả nghèo giả khổ Đứa có hình xăm thì y_như không chịu được nóng Người dùng iphone thì quần chả bao_giờ có túi Kẻ đeo đồng_hồ thì thường hay vỗ đùi Thằng bọc răng vàng thì hay cười nhếch mép Lâu dần chợt nhận ra Kẻ đeo đồng_hồ 500 hay 5 triệu cũng đều như nhau Hút bao thuốc 20k hay 100k cũng đều mắc bệnh lao_phổi Ở nhà 30m2 hay 300m2 khi cô_đơn cũng chỉ cùng 1 tên gọi Ngồi ghế thương_gia hay ghế siêu tiết_kiệm thì khi máy_bay mấT_Tích cũng chẳng còn đường mà quay về Đôi_khi nếu biết hài_lòng với cuộc_sống thì sẽ bình_yên cả thôi Các học_sinh ở Trường_Đời hãy đọc và suy_ngẫm Cóc 3, TẠO_ẤN_TƯỢNG_ĐẦU_NĂM_CÙNG_NƯỚC_HOA_THƠM_PHỨC_TẶNG 2 USD_MAY_MẮN_CAM_KẾT mang tới cho bạn mùi hương thật TUYỆT khi đi chơi đầu năm Chỉ 350k,có ngay hương nước_hoa quyến_rũ của riêng bạn Xuất_xứ Singapore,chuẩn Code đáy chai check dễ trên iphone,lưu hương 6 giờ đảm_bảo Giá 350000 VNĐ 100ml 1,LOA_LOA_LOA_ĐÃ_TÌM_RA_NGƯỜI_CHIẾN_THẮNG Chúc_mừng bạn Nguyễn_Trâm đã trở_thành người chiến_thắng chung_cuộc cuộc_thi Dám chọn thách_thức để nhận được 1 chiếc điện_thoại iphone_6 Plus_Chính vì những nỗ_lực vượt qua bản_thân để học_tập một môn thể_thao hoàn_toàn mới đã nhận được sự bình_chọn từ BTC chương_trình và cả lượt vote nhiệT_Tình của người tham_gia Nhanh_nhanh liên_hệ với BTC để hoàn_thành thủ_tục nhận giải_thưởng trước Tết nhé Nguyễn_Trâm_Dù chương_trình đã có người chiến_thắng chung_cuộc nhưng chúng_ta vẫn còn cơ_hội để tham_gia trở_thành người may_mắn nhận được 10 card điện_thoại 50K mỗi ngày đấy Tham_gia ngay đi chương_trình chỉ kđéo_dài đến ngày 31012016 thôi
1,Chúc_mừng bạn Nguyễn_Trâm đã trở_thành người chiến_thắng chung_cuộc cuộc_thi Dám chọn thách_thức để nhận được 1 chiếc điện_thoại iphone_6 Plus
