1, tq là công_xưởng thế_giới,iphone còn được sản_xuất tại đó cơ_mà 1,tin siêu nóng đủ làm tan chảy trái_tim của các fan iphone_6 đây ạ
3, Video_Quên mật_khẩu,đây là cách mở khóa iphone trong một nốt_nhạc 1,e chỉ thích iphone 3
3,Khi đãng cần copy một tập_tin sang một máy_tính khác mà_lại không có gì ngoài chiếc iphone thân_thuộc của mình Bạn hoàn_toàn có_thể thực_hiện việc chuyển tập_tin đó bằng chính chiếc iphone của này Sau đây Hoàng_Kiên sẽ hướng_dẫn các bạn làm_sao để chiếc iphone của mình làm một thiết_bị lưu_trữ di_động
2,dùng iphone đã lâu mới phát_hiện ra một sự_thật khó chấp_nhận
3, Cẩn_thận chiêu lừa bỏ ngải bỏ thuốc_mê Chiều nay mình đãng đứng ở công_viên Tao_Đàn thì_có cô kia bán vé_số tiến đến mời mình Mình lắc_đầu không mua thì cổ mới nói_nhỏ cháu ơi,cô lượm được cái điện_thoại này đẹp lắm,cháu mua không cô để rẻ cho_rồi hé giỏ cho mình xem cái iphone_6s màu hồng rõ_ràng Đúng lúc này đầu_óc mình đột_nhiên xoay mòng mòng,cảm_giác thoáng qua này làm mình biết ngay là mình đãng đói Bài_học rút ra là đói mà nhịn ăn là rất nguy_hiểm,chứ đách có ai bỏ thuốc_mê mình được hết Cô bán vé_số thấy mình không xi nhê nên có_vẻ em dè,tới lúc mình hỏi ủa ngải là sao cô,tính bỏ ngải con hả cho con coi với cổ ú_ớ không nói được gì hết y_như bị trúng ngải vậy,quả_thực bùa ngải đáng_sợ quá Tới đây thì do đã đọc nhiều về thủ_đoạn bỏ bùa bỏ ngải thuốc_mê trên mạng nên mình vô_cùng cảnh_giác,ngay_lập_tức giật phắt cái phone đó chạy thật xa trước khi ngải của cổ có tác_dụng Bây_giờ mình đãng viết status từ cái phone đó_đây nè,còn cổ thì chạy theo không kịp nên mình đách quan_tâm Bài_học rút ra cho mọi người là đi lừa người khác thì cẩn_thận coi_chừng bị giựt phone nhe,chứ bùa ngải đéo có đâubùabùacáicụckít 1,Dép lông xinh_xinh sociu đi cực hợp mùa_đông luôn nhé mix đồ tha_hồ Mặc nhà hay dạo phố vất style ngây_ngất ạ 2 màu siêu xinh luôn ghi và đen nhé Sz từ 35 đến 38 Add 51 Nguyễn_Trường_Tộ_Phone có sd imess và viber cho iphone nhé
1,thay kính iphone_6 tại maxmobilecare uy_tín chất_lượng
1, Chả có con trang_điểm nào như tôi Được em Linh_miu coi như chị,như người_thân,tặng xe,điện_thoại iphone,tặng cốp mới không dùng nên bán rồi tặng cho 1 đống tiền tiền cho thường_xuyên luôn Ps mang tính_chất khoe,ai nghĩ gì kệ,thấy Mình là con make_up may_mắn nhất Thành_công lớn nhất của 1 người_làm nghề Không cần 1 nghìn khách đến_cùng 1 lúc,chỉ cần 1 khách nhưng quay lại 1 nghìn lần 1, được em linh miu coi như chị,như người_thân,tặng xe,điện_thoại iphone,tặng cốp mới không dùng nên bán rồi tặng cho 1 đống tiền tiền cho thường_xuyên luôn 3, 11146 Bước vào năm_học đại_học đầu_tiên,mẹ mua cho em một cái Iphone màu trắng,trông nó thật xinh_xắn dễ_thương với cái tai_nghe màu trắng đi kèm Nó dài khoảng một gang tay,thân nó dài và mỏng Iphone có một chiếc tai_nghe khá dài,nhìn như tai_nghe bình_thường,màu trắng tinh_khôi Đầu tai_nghe là hai cục tròn tròn dùng để nhét vào tai Nó mang tên tai_nghe của iphone_5s Em cắm tai_nghe vào Iphone,mở ZingMP3,âm_thanh rộn_ràng và sinh_động vang lên Cảm_giác cuộc_sống của em tuyệt_vời hơn bao_giờ hết,làm em cảm_thấy bớt lạc_lõng và cô_đơn hơn bao_giờ hết Không biết từ lúc_nào,tai_nghe và Iphone đã trở_thành người bạn thân_thiết của em trên mọi nẻo đường Khi dùng để nghe,gọi,lướt face,xem phim,khi để cho mượn Mỗi khi dùng xong,em đều cẩn_thận cất vào balo để khỏi bị hỏng_hóc Tđn sáng nay em lại để quên ở phòng P305 nhà A3,chắc là bàn thứ 45 dãy thứ_ba đối_diện bàn giáo_viên Bạnanhchị nào nhặt được thì vui_lòng cho em xin lại TT Em sẽ hậu_tạ 1, bước vào năm_học đại_học đầu_tiên,mẹ mua cho em một cái iphone màu trắng,trông nó thật xinh_xắn dễ_thương với cái tai_nghe màu trắng đi kèm 3,nó mang tên tai_nghe của iphone_5s
1, em cắm tai_nghe vào iphone,mở zingmp 3,âm_thanh rộn_ràng và sinh_động vang lên 1, không biết từ lúc_nào,tai_nghe và iphone đã trở_thành người bạn thân_thiết của em trên mọi nẻo đường 1, may_mà mình không dùng iphone,sẽ chỉ chung thành với android cùng samsung 2, mấy anh ơi,cho em hỏi iphone_5 của em tự_nhiên màn_hình nó bị loạn,hình_ảnh bị phân_thân,lúc lại bình_thường,cảm_ứng thì không bị gì 1, Đôi_lúc tình_yêu nó mù_quáng lắm Yêu_Sony như ta yêu một cô_gái đẹp và khác_biệt Điện_thoại Sony không hoàn_hảo,có những thứ chưa tốt,có những lỗi vặt khiến ta bực_bội Nhưng ta vẫn yêu,vẫn bỏ_qua và chấp_nhận Vì_sao ư Vì nàng không như bao cô_gái khác bắt_mắt,da trắng,môi chảy_máu trong thời_đại hot girl,iphone đầy_rẫy Nàng khác_biệt Vô_cùng cá_tính nhưng điều mà hiếm ai có được,nàng bền bĩ,chịu_thương_chịu_khó,dãi_nắng_dầm_mưa chống nước Nàng nổi_bật nhưng không diêm_dúa,nàng bóng_bẩy nhưng rất gợi_cảm,nàng sang_trọng mà đầy mạnh_mẽ Và vì nàng là đứa con_gái cưng của Họ một Sony sáng_tạo một Nhật_Bản siêu_phàm Đơn_giản là yêu là đãm_mê Một thanh_niên yêu màu tím cuồng Xperia chia_sẻ Hãy giữ niềm_tin vào Sony,lửa vào Xperia,và đừng quên mua phụ_kiện ở Xperiashop ạ 3, vì nàng không như bao cô_gái khác bắt_mắt,da trắng,môi chảy_máu trong thời_đại hot girl,iphone đầy_rẫy 3,Chuẩn_bị như thé này cho đêm nay đã đủ chưa nhỉ 3 3 chỉ còn 1 tiếng nữa thôi_thì chúng_ta sẽ được tận_mắt thấy phiên_bản iphone mới_rồi 3 3 Link xem online ad sẽ cập_nhật sau nhé
1,chỉ còn 1 tiếng nữa thôi_thì chúng_ta sẽ được tận_mắt thấy phiên_bản iphone mới_rồi
3,trường thuật trực_tiếp iphone mới mời bạn xem tại đây
3,dân_chơi iphone bơi hết vào đây mà xem nhé
1, Behind the scence phim RẤT ngắn Mãi_Mãi_Bên_Nhau_Thấy người_ta quay mình cũng quay 3 máy như_ai mà là máy Iphone_Hehe Không còn gì hạnh_phúc bằng đi làm mà vui như đi chơi Làm nhiều,có ngày làm cả 24 tiếng nhưng cười còn nhiều hơn Cám_ơn đại_gia_đình đã cho Kd một kinh_nghiệm đặc_biệt có_một_không_hai trong đời và những kỷ_niệm sẽ không_bao_giờ quên 2, bạn mình cứ_thế ra về,về đến nhà một lúc lâu mới nhận ra mình bị lừa,điện_thoại thì iphone_6 2,iphone_6s có_vẻ mờ_nhạt so với mấy em kia quá tội_nghiệp các bạn thấy camera của siêu phẩm nào đỉnh nhất nhỉ 3
3, Thời_tiết ngày_càng lạnh đấy nên các nàng nhớ sắm áo dạ nhé Áo dạ vân măng_tô Màu ghi sáng,ghi đậm mix đồ kiểu gì cũng ok í,mặc jean hay váy vóc bên trong đều ok nhé Áo_len tay rộng mặc trong Màu xanh tím_than,nâu,ghiQuần skinny tua_rua gấu Màu đen,xanh jean Add 51 Nguyễn_Trường_Tộ_Phone có sd imess và viber cho iphone nhé 2, Xin_lỗi,mọi người cho mình hỏi một_chút,Hiện_tại mình đãng dùng iphone_6 và mình không_thể_nào cài được Appvn_Thông thường,mình hay vào Safari,truy_cập vào Appvncom,chọn phần appvn cho máy nonjailbreak Nhưng gần mấy tháng nay,lần nào mình click vào phần nonjailbreak thì đều được hiện thông_báo Coming soon Khổ_tâm cực Mình học tiếng anh chuyên_ngành,rất cần sử_dụng các từ_điển Oxford ở app Giờ mình chẳng biết làm thế_nào Ad và mọi người giúp mình với 2, xin_lỗi,mọi người cho mình hỏi một_chút,hiện_tại mình đãng dùng iphone_6 và mình không_thể_nào cài được appvn 3,iphone_7 mà như video thì quá giống Android rồi
3,Xã_hội hiện_nay nhà_nhà iphone nhà_nhà ipad Nhà các bạn có vậy không 1, Cài_đặt ngay ứng_dụng Kiếm tiền,săn xu và nhập mã APPSTONE nhé để nhận iphone_6S 3, giáng_sinh này con chỉ ước một chiếc iphone,một chiếc ipad thôi,con rất ngoan,mỗi bữa chỉ ăn 2 bát cơm và thi_thoảng đòi ăn bánh thôi ạ 3,mình ở yên bái mình muốn mua 1 cái ốp iphone_5 được không 2,có ai thấy iphone_7 giống htc không
2,hôm_qua bị trộm mất iphone tức quá
3, ĐỜI_KHÔNG_NHƯ_LÀ_MƠ v Vào ngày sinh_nhật của cô_gái,chàng_trai che mắt cô_gái,rồi nói Cưng à,đi theo anh nào Đi suốt nửa tiếng đồng_hồ,chàng_trai mới nói tiếp Nào,giờ thì mở_mắt ra Cô_gái nhìn mọi cảnh_vật xa_lạ hoang_vắng xung_quanh,cõi_lòng tràn_đầy chờ_mong Rồi sao anh Chàng_trai không trả_lời,chỉ rút một con iphone_6 ra đưa cho cô_gái Cô_gái kích_động kêu lên Yêu anh chết mất,món quà này tuyệt quá Chàng_trai lạnh_lùng Gọi điện cho bố_mẹ em,200 triệu,nói em nằm trong tay tôi Share_Nhi_Nhi 3, chàng_trai không trả_lời,chỉ rút một con iphone_6 ra đưa cho cô_gái 3,hnam cho mình hỏi mình muốn mua iphone_6s plus 12 giá_cả như_thế_nào
3,bà tưng đã trở_lại với điệu nhảy remix trên nền nhạc chuông của iphone_6
3,MÌNH muốn mua máy này Smartphone iphone_5 32GB quốc_tế tại ShopDunk
3,smartphone iphone_5 32gb quốc_tế tại shopdunk
2,kiểu này hết dám mua iphone_xài rồi
2,mình dung iphone_5s mà mãi không sử_dụng được imessage
3,sau khi iphone_6s chính_thức lên kệ với phiên_bản màu hồng và ngưng sản_xuất phiên_bản màu gold thì dự là thời_gian tới iphone_6 gold sẽ là hàng hiếm
1, sau hơn một tuần phát_hành,iphone_6s và 6s plus được bán ra,phá vỡ mọi kỷ_lục bán hàng từ trước đến nay của apple 3,ad đã thấy iphone trên tay anh_ấy
3,tôi cần 1 con iphone_5s cũ cũng được
1, Chào tháng 10,chào sáng mùa thu Sài_Gòn với khí trời thật mát_mẻ,em sắm áo mới cho dế iu đi chơi thôi Ốp hường kiểu_dáng iphone_6s và 6s plus mang tới cảm_giác nhẹ_nhàng cho buổi_sáng thứ 7 đẹp trời Giành cho ip 44s55s66s6plus6s plus Giá siêu 160k2 chiếc 1,ốp hường kiểu_dáng iphone_6s và 6s plus mang tới cảm_giác nhẹ_nhàng cho buổi_sáng thứ 7 đẹp trời
2,Thỉnh_thoảng em cắm sạc vào lại bị lỗi này rồi không vào điện là sao vậy các anh_chị trong shop Em mới mua con iphone_5lock ở shop hôm 110 xong
3,em mới mua con iphone_5lock ở shop hôm 110 xong
3,nhà mình có ốp này cho iphone_6 plus không nhỉ
2,đừng tưởng có tiền mới được xài iphone nhé các con giời
3,iphone_6 Plus của mình cần thay main mới bên bạn có không
3,Cộng_đồng mạng đãng xôn_xao tìm cô_gái trộm iphone trong clip này Có ai biết cô ta không
3, mình muốn mua kính thực_tế ảo dùng cả cho iphone_5 và ip 6,thì mua loại nào 3,biết đại_hàn nên cả nhà qua táo mua iphone tránh rét hết rồi
2,về đến nhà thì không thấy iphone của mình đâu cả
3, 8478 Cúi chào các trym ạ Vừa tròn 8 tiếng thẩm du à nhầm mộng_du em lật mình trở dậy_thì con Iphone 1280 của em báo là trời lạnh 9 độ thưa là gấu em nhắn_tin cho trym nào mê công_nghệ v Em giật cả mình nhưng buồn ái đéo nhịn được nên bất_đắc_dĩ thò trym ra khỏi chăn Ôi mẹ ơi em phát_hiện ra một sự_việc khủng_khiếp Em đoán là thằng bạn cùng phòng đêm qua đã làm_gì đó trong lúc em ngủ Chắc_chắn như_vậy thì mới ngắn thế_này chứ Em đo đúng còn bằng ngón_tay cái tức_là dài 3cm Em nhớ hôm_qua nó hẳn 3,5 cm cơ_mà Em tức lắm,định gọi cho bố_mẹ nhưng em sợ bố_mẹ mắng không chịu học lại cứ đua_đòi nên thôi Bây_giờ em đãng rất rối_bời Các chị nào đã có kinh_nguyệt,à nhầm kinh_nghiệm cho em hỏi là em phải xử_lí sao bây_giờ ạ Sắp tới sinh_nhật gấu em mà gấu em bảo là tổ_chức chỉ có em và gấu Nếu cứ như_thế_này em làm_gì còn mặt_mũi đi gặp gấu nữa Các chị giúp em với Có loại son nào mà dài 3cm không để em còn nói_phét với gấu 3, Xếp đội_hình Thưa với anh_em là toàn_bộ hình_ảnh nón bửa giờ là hình sản_phẩm thật em chụp tại shop nhé Cái nền đen là cái ghế salon trong shop,còn cái tường gỗ thực_ra là chổ treo đồ mà em đã dọn đồ đi để làm nền cho hình Hình em chụp bằng điện_thoại iphone chứ chẳng có cái máy nào xịn cả Và em là thằng chụp luôn chứ chả có thợ chụp nào cả Cây_nhà_lá_vườn hết,đồ có sao_chụp vậy,làm_ăn nhỏ lấy đâu ra tiền mà đầu_tư hình_ảnh chuyên_nghiệp Có vài chế cứ đòi hình sản_phẩm thật,em bí quá,không biết phải làm_sao cho hình nó là sản_phẩm thật hơn được nữa 3,hình em chụp bằng điện_thoại iphone chứ chẳng có cái máy nào xịn cả
3,e mới đọc zingvn xong biết điện_thoại iphone giảm quá không biết bên mình bản lock iphone_6 có giảm không để em còn biết tuần sau sang rước 1 em
3,vn xong biết điện_thoại iphone giảm quá không biết bên mình bản lock iphone_6 có giảm không
1, 3 Viết ra những điều đã đạt được trong năm cũ Không cần quá to_tát Đó có_thể là mua được ái tivi mới,mua được chiếc xe yêu_thích,sắm được_cái iphone_6s hay đơn_giản là bỏ được thói_quen ngủ nướng mỗi ngày Đó là một_cách động_viên tuyệt_vời nhất Nó sẽ giúp bạn có thêm nhiều động_lực cho năm mới 1,Èo èo Tin hot đây Em giày sinh_nhậteaker độn đế khoá nhũ đã túc tiệp về thêm đủ sz cho các khách iêu tha_hồ sắm_sửa diện rùi nhé Trời rét đi em này cũng ấm luôn ạ Độn đế tôn dáng mà chạy nhảy đi_lại vẫn thoải_mái lắm nhé Mau mau sắm ngay kẻo em nó hết mau lắm nha Sz từ 35 đến 38Add 51 Nguyễn_Trường_Tộ_Phone có sd imess và viber cho iphone nhé
3,4 mẹo sạc nhanh cho iphone không phải ai cũng biết
2,Các bạn cho mình hỏi minh đãng dùng chiếc iphone_6 mấy hôm_nay minh lên ios 921 thì_có hiện_tượng pin ảo Đang báo còn 20 pin tụt xuống 5 vậy_là bị làm_sao vậy
1, Chốt nốt tin_vui cuối ngày đây ạ Em áo_len cổ thuyền hết như 1 cơn gió nay đã quay trở_lại tạo Hot cho những ngày rét_mướt này nha đợt này cũng về trăm em thôi nên ai thích nhích luôn chứ mấy đợt trước về 1 2 hôm bay không còn chiếc nào r đấy ạ Màu nào cũng tây và dễ mặc lắm luôn mix với chân_váy hay quần skinny đều ok nhé Điệu_đà nhẹ_nhàng đúng chuẩn kiểu các chị_em đều mê Màu hồng,đen,ghiAdd 51 Nguyễn_Trường_Tộ_Phone có sd imess và viber cho iphone nhé 1, Thật không_thể tin được,đã có_thể đổi iphone lấy Bphone 3,Giả_dụ iphone_7 nó như_thế_này Thì_có ai cùng ad nhịn ăn sáng để mua không Mà rõ_ràng là samsung hay_sao ý nhỉ Nguồn_Internet
1, Xúc_Động 9h20 mở_cửa vào Chị ơi em lạnh quá,em vừa phi từ Văn_Điển đến đây Cho em cốc nước nóng và xem iphone_6 Plus với ạ Niềm_vui với chúng tớ chỉ đơn_giản như_vậy thôi,chỉ cần tin_tưởng và iu thương là đủ để xua_tan đi mọi giá_lạnh và mệt_mỏi của Táo rồi Một mùa_đông không lạnh bên các khách iu nào 3,cho em cốc nước nóng và xem iphone_6 plus với ạ
2,thế_này có_khi iphone lại bị tăng_giá
3, Lúc tháng 6 em có mua 1 iphone_5 lock tại cửa_hàng của mình,trong thời_gian bả hành bên mình có hỗ_trợ dịch_vụ nâng_cấp hệ_điều_hành và fix lỗi sim miễn không ạ 3,Mãi về sau cô mới nói là cô đi mua điện_thoại iphone
2, Vào_khoảng 9h40p mình đi từ cổng kcn tiên sơn xuống lim,vừa đi được 1 đoạn qua cổng kcn thì mình thấy 1 xe_máy đi chậm phía sau xe mình,thấy vậy nên mình cũng cảnh_giác rồi quay lại phía nhau nhìn thì thấy 1 nam thanh_niên khoảng ngoài 20t to_bđéo,mặt_mũi bảnh_bao,mặc áo somi cộc trắng Đi được 1 tí thì thấy hắn ta tiến lên ngang xe mình và giật chiếc iphone trong túi quần mình ra Lúc đó mình hoảng quá nên chỉ kêu AAAAlên,lúc ấy phía bên đường cùng chiều mình lại vắng_tanh mà chẳng có ai,do bị tên đó áp sát ng và giật điện_thoại nên t đã bị ngã ra đường Cả người và xe đều nằm dưới đất May_mà cái thai không bị sao,chứ hôm_nay mà mình bị sảy thai thì cái thằng mặt lồn tâm_hồn chó dại ấy sẽ ăn ngủ không yên CON_TAO_SẼ_VỀ_BÓP_CỔ_MÀY_CHO_ĐẾN_CHẾT đùa chứ dm nhìn cái mặt đâu đến_nỗi nào,đi xe ablade rõ oai mà ra đường cướp_giật Cái loại mày nốc cứt ăn mà sống qua_ngày thân gửi thằng mặt lồn nhé Mọi người đi đường cẩn_thận nhé Nhất_là túi_xách và điện_thoại Thằng mặt lồn tâm_hồn chó dại Tao gặp mày kiểu gì tao cũng nhận ra đấy con ạ Thành_viên hội Em_Đã_Khác chia_sẻ 2, Đi được 1 tí thì thấy hắn ta tiến lên ngang xe mình và giật chiếc iphone trong túi quần mình ra Lúc đó mình hoảng quá nên chỉ kêu AAAAlên,lúc ấy phía bên đường cùng chiều mình lại vắng_tanh mà chẳng có ai,do bị tên đó áp sát ng và giật điện_thoại nên t đã bị ngã ra đường 3, Mình ở nin bình muốn mua 1cay iphone_5s,cho hỏi tình_trạng may,bảo_hành,thanh_toán 3,cho mình hỏi Iphone 4 cũ giá bao_nhiêu ạ
2,Xin_phép adm Có bạn nào bị như mình không trả_lời giúp mình vs mình cảm_ơn nhiều Mình đãng sử_dụng iphone_5 máy từ ngày mua mới_tinh chưa qua sửa_chữa Hôm_nay tự dung cảm_ứng bị sao không biếtcứ dùng được tí lại bị đơ màn_hình Khoá xong trượt mở vẫn dùng được xong tí lại đơ Máy mình không dơi không dính nước Có ai bị như này không mách mình vs
3,Mình đãng sử_dụng iphone_5 máy từ ngày mua mới_tinh chưa qua sửa_chữa
2, Admin cho hỏi Mình mới mua iphone_5c lock tại Nam_Thủy 10 ngày Hiện_tại,sạc pin rất lâu khoảng hơn 3h và 1 bên tại nghe đã hỏng sau 10 ngày sử_dụng cho mình hỏi chính_sách chăm_sóc khách_hàng ra_sao và chất_lượng sản_phẩm thế_là sao 3,Admin cho hỏi Mình mới mua iphone_5c lock tại Nam_Thủy 10 ngày
3, iphone_5 anh có bán không ạ,và giá của nó là bao_nhiêu vậy anh 2, Anh ơi cho em hỏi,iphone5s của em giờ tắt nguồn quên mật_khẩu không mở được,giờ làm cách nào đây anh 3, Bạn cảm_thấy nhàm_chán với những tấm ảnh đại_diện thông_thường Bạn muốn một điều gì đó khác_biệt nhưng vẫn mang nét vui_tươi Không cần lo_lắng nữa,ứng_dụng i MadeFace sẽ giúp bạn giải_quyết được toàn_bộ những vấn_đề đó Ứng_dụng này đã có_mặt trên ios rồifan_Apple điểm_danh nào Xem thêm tại 1, Nhà_sản_xuất bắt_đầu nhá hàng thông_tin về iphone_7 rồi này Không biết lần này Apple sẽ đem tới bất_ngờ gì cho chúng_ta đây nhỉ Ad bắt_đầu háo_hức rồi đấy,các bạn thì_sao Xem thêm tại 3,Nhà_sản_xuất bắt_đầu nhá hàng thông_tin về iphone_7 rồi này
2,Vỏ thì Iphone mà phần_mềm lại là Android v v
1,iphone_7 thế_này thì bá_đạo quá 1,iphone Pro mang quá nhiều công_nghệ mới 1, iphone_7 hoàn_hảo quá,chỉ là không biết khi nào p 1, Ngoài iphone_6s,trong tháng 3,chào_đón cửa_hàng thứ 300 trên toàn_quốc,khách_hàng mua điện_thoại,laptop,máy_tính bảng tại FPT Shop sẽ được hoàn tiền đến 10 triệu đồng,mua trả_góp nhiều sản_phẩm mới với lãi_suất 0 2, Cảnh_báo lừa_đảo hàng dựng Đã xác_thực là iphone_5S nâng_cấp thay vỏ và gắn màn_hình lô to và hiển_thị như iphone_6S Main và pin và tất_cả đồ linh_kiện thì vẫn xài ip 5s China nó độ luôn cả màn_hình Kinh_khủng quá Ps video này là video rõ nhất,ace bấm vô chữ HD sẽ rỏ hơn từ_từ mà xem 3,Đã xác_thực là iphone_5S nâng_cấp thay vỏ và gắn màn_hình lô to và hiển_thị như iphone_6S
1,iphone6s giá này hấp_dẫn không anh_em D
3,Trước nhiều áp_lực thì Apple vẫn giữ quyết_định không unlock iphone theo yêu_cầu FBI Vì nếu mở được lần 1 sẽ có tiền_lệ lần 2 và nhiều lần tương_tự tiếp_theo tinhte
3, Qua nhiều hình_ảnh rò_rỉ gần đây cho thấy jack 35mm sẽ không còn trên iphone_7,phần ốp khu_vực camera to quá có_khi nào Apple trang_bị camera kép không anh_em D 3,Anh_em nghĩ sao nếu Apple iphone mới với màn_hình lớn 58 inch tinhte
1,Cả 2 em đều là một trong những smartphone xuất_sắc hiện_nay Nếu nâng_cấp máy mới anh_em sẽ chọn GalaxyS7 hay iphone_6s D tinhte
3,Nếu nâng_cấp máy mới anh_em sẽ chọn GalaxyS7 hay iphone_6s D
3,Rất có_thể năm sau thế_hệ iphone mới sẽ trang_bị màn_hình OLED
1,Nhiều thông_tin thú_vị được bật_mí quanh vụ_việc FBI yêu_cầu Apple unlock iphone
3,S7Edge cùng bơi nước với iphone_6s xem ai lặn nước lâu hơn D
1, Kết_quả thả rơi Galaxy S7Edge và iphone_6sPlus khá ấn_tượng,có_thể thất độ bền smartphone ngày được nâng lên 3,iphone giờ cũng pháT_Tướng dần v
1,iphone_7 sẽ đẹp luông_linh như một vật_phẩm đến từ_thiên đương Bạn sẽ điêu_đứng từ lần đầu_tiên khi nhìn thấy nó
3, Bên mình chuẩn_bị làm tại Đà_Nẵng,cần tuyển khoảng 20 khách đi dự Event từ 18h21h ngày 30 3122016 tại Hyatt_Regency_Đà_Nẵng,mọi chi_phí di chuyến Hà_Nội_Đà_Nẵng,SGĐ à Nẵng,chi_phí ăn_ở ks bên mình lo hết,mỗi khách tham_gia có cơ_hội được tặng iphone_6S Plus 128GB,ai tham_gia được inbox mình nhé vì mình cần gấp,các bạn chia_sẻ hộ mình Thanks 3,Cái này chắc là iphone_70
2,Đừng ai chơi dại mà chỉnh ngày_giờ về 111970 nhé iphone thành cục gạch đấy Apple sẽ cấp_tốc sửa lỗi này
2,iphone thành cục gạch đấy
1,iphone_7 thế_này thì bá_đạo quá 3,Đây la cach tao ra môt ưng dung iphone
1,Cảm_giác lần đầu nhìn thấy iphone_7 nó hồi_hộp làm_sao các bác ạ
3,Đắng lòng thanh_niên đăng bán iphone có tâm nhất hệ mặT_Trời
3, Phần nhựa dùng làm ăng ten mặt sau iphone_7 sẽ không mất đi,mà di_chuyển vị_trí mới,anh_em thấy sao có bớt xấu hơn chưa 1,Samsung_Galaxy S7 cho thấy họ đã cách_mạng mạnh_mẽ sản_phẩm của mình như_thế_nào Liên_tục so_kè với iphone những tính_năng đỉnh_cao độc_quyền trên sản_phẩm của mình
1,Liên_tục so_kè với iphone những tính_năng đỉnh_cao độc_quyền trên sản_phẩm của mình
3,Hãy để anh dẫn em về phía cuối đường ốp lưng PC 3D rất yêu cho người ấy nhé các nàng Có nhiều màu để chọn iphone_5 giá 90kem
2, Có bao_nhiêu chiếc iphone trong hình,99 các bạn trả_lời sai 3,Bạn có biết 1 sự_thật rằng Cứ khi nào một em bé chào_đời thì Apple bán được hẳn 2 chiếc iphone
2,8 dấu_hiệu cho thấy bạn đãng sử_dụng Iphone sai cách Chiếc iphone yêu_quý của bạn có_thể chết bất_đắc_kỳ_tử chỉ vì những thói_quen sai_lầm và đơn_giản này
2,8 dấu_hiệu cho thấy bạn đãng sử_dụng Iphone sai cách
2,Chiếc iphone yêu_quý của bạn có_thể chết bất_đắc_kỳ_tử chỉ vì những thói_quen sai_lầm và đơn_giản này
3,Ông nào bảo iphone là vô đối thì bơi vào đây
