1, Cả newfeed ngập_tràn iphone_x x , apple đại đế 1, iphone_8 vừa , mùa mang tới rồi anh_em gom lúa xem được bao_nhiêu , đê rước em nó về 1,cứ siêng_năng đi tiền và niềm_vui tự đến với mình Nhận sửa thay độ tất_cả các dòng iphone liên_hệ 1,Dự là sẽ có bản iphone_seX Có SE giờ có cả X
1, A nghĩ là sau tất_cả , em đừng sắm iphone_x Vì khi đêm xuống , điện_thoại của em sẽ bị block vì mđéo mở khóa được sau khi chiếc mặt_nạ kia được tháo 1,iphone_x sinh_nhật này The8 sẽ có
1,video giới_thiệu về siêu phẩm kỉ_niệm 10 năm Iphone của apple cho các mem nhé Chuẩn_bị gom lúa thóc rồi
1,Cpi về đội Cận_cảnh trọn_vẹn vẻ đẹp Thần_thánh đến từng milimet của Iphone thế_hệ mới điện_thoại của tương_lai Click để xem video và tham_gia chém gió
1, usb 32gb chuẩn usb 30 tốc_độ cao , có 1 đầu cắm iphone ipad backup data , hàng xt usa giá 3xe 1,Thật đơn_giản để chúng_ta có_thể sở hưu iphone_x
1, Cai meo gicung muôn chi thiêu môi tiên Đại_Kỷ_Nguyên iphone_8 thị_trường , tính_năng mới độc_quyền và mạnh_mẽ 1, Trước khi iphone_x có_giá thấy Note8 22tr mắc vãi_linh_hồn , sau hôm_qua cái thấy nó rẻ ghê trời 1,Huhu iphone_x đẹp đẹp đẹpđẹđượcótiền
1,tụi m hiểu ý tao chứ Đừng quan_tâm từ iphone
1,Nhìn_Note 8 vẫn phê hơn Ip X với tôi thì iphone_se là đẹp nhất thôi ps đãng xài
1, Đại_Kỷ_Nguyên iphone_8 thị_trường , tính_năng mới độc_quyền và mạnh_mẽ 1,iphone_8 cũng không sang bằng vẻ đẹp của emm
1,Hot iphone_x và những tính_năng thời_thượng HOT nhất Vietsub iphone_x nổi_bật với màn_hình vô_cực và tính_năng FaceID nhận_diện khuôn_mặt mới của Apple
1,Vụ này hay nha D_Mỹ sẽ thả 25 triệu iphone_xuống Triều_Tiên để hạ nhiệt căng_thẳng Một cựu đặc_nhiệm hải_quân Mỹ đưa ra sáng_kiến bất_ngờ để giải_quyết khủng_hoảng Triều_Tiên_Jocko
1,sao vẫn thấy sam sung galaxy S8 Note 8 vẫn đẹp hơn iphone_x nhỉ
1,rất nhiều lựa_chọn cho anh_em nhé thế_giới có ip 8 iphone_x tôi có iphone 3
1, Ước gì mình được sở_hữu em nà Đại_Kỷ_Nguyên iphone_8 thị_trường , tính_năng mới độc_quyền và mạnh_mẽ 1,iphone_8 mơi rachăc chăn 1 điêu se rât nhiêu cac em gai se đãu hang lăm
1,Chia_sẻ với các bạn cách quay_phim màn_hình iphone lại 1 cách dễ_dàng với phiên_bản ios mới Chúc các bạn thành_công video bên dứoi mình đã tắt tiếng và lông tiếng hướng_dẫn
1,Hướng_dẫn unlock iphone ATT miễn_phí cho máy clean imei Chủ thớt check giúp mình Thank ạ
1,iphone_x iphone_8 là Qq gì mà rần_rần vậy mấy má Coi_chừng t à nha
1, Ủng_hộ quỹ vì người nghèo nào bà_con Đại_Kỷ_Nguyên iphone_8 thị_trường , tính_năng mới độc_quyền và mạnh_mẽ 1, rồi đợi về Việt nam là quất thơi iphone_10
1, Chị hai yêu_dấu đẹp tuyệT_Trần Sắp sinh_nhật rồi , có thể_nào tặng em trai ngoan_ngoãn một cái iphone_x kg nà Trinh_Dang 1, Dự tầm 22259 iphone_8 Plus sẽ về , hi_vọng thuận_lợi 1, Nể lăm nhưng cô nang ca năm chi thây up anh đi du lich , đi ăn đi uống , không thây lam ăn gi , share mây cai bai iphone_x nao la em se vê vơi chi , chi se co em băng đượccác kiểu Nguồn COPY 1,Quá đẹp cho một siêu phẩm iphone_x
1, Anh_em đại_gia nào hốt iphone_8 không , em rinh về dùm cho đẹp mê Điện_máy xanh ChưPrông Ai thích em nó thì điểm_danh nào đẹp mê_ly
1,Đa_số người muốn sỡ hữu IPHONE_X nhưng vẫn còn 1 lý_do đáng quan_ngại chắc_chắn là không có tiền
1,Những cách thanh_toán để sỡ hữu dòng Iphone vừa 1,Ông_tổ của iphone_x và em đã có
1,Cứ chịu_khó dạng háng đi có iphone_x nhé v
1,Sau khi iphone_x các nhà_sản_xuất quyết_định không lấy hình quả táo để làm thương_hiệu nữa mà sẽ đổi thành_quả thận
1,Những cách thanh_toán để sỡ hữu dòng Iphone vừa 1,Một là iphone_8 còn 2 là iphone_x tao hứa sẽ sở_hữu 1 in 2 cái trong năm 2018
1,iphone_x sẽ làm cho những vụ đánh_ghen lột chuồng tăng lên
1, Thấy mn share nên em góp vui thôi chứ em không thèm v cho thì lấy thôi Apple iphone_x có_giá khởi_điểm 999 USD , đắt nhất lịch_sử iphone 0151 13092017 iphone_x có_giá khởi_điểm 999 USD , đắt nhất l 1,Cần mian iphone_6 có vân Tây thì tốt không vân cũng được ai có chia lại với nhé
1,Kết_hợp hoàn_hảo vl Để xúc iphone LH Tuyet_Nhung_Do_Timeline_Photos
1,Khoe ảnh chụp đi mọi người ảnh này được chụp bởi iphone_6s
1,haha iphone_x ra rồi mừng quá tèn ơi
1,Rất nhiều sự lựa_chọn cho những_ai muốn sở hưu iphone_x
1,Ai tặng tôi iphone 2x Đi
1, Fb giờ toàn tin về Iphone , không có gì vui hết chơn Tối nay chơi mini game cho vui nha cả nhà ơi HẤP_DẪN và DỄ_TRÚNG hơn đợt trước nhiều nhé anh_chị_em 1,6s plus hường cần giao_lưu iphone_x bù_trừ hợp_lí v
1,Cần tìm cao_nhân hướng_dẫn cách lấy nhạc từ app nhaccuatôi trên iphone ra máy_tính Có cảm_ơn và hậu_tạ
1,Thế_hệ X_iphone_x_Phiên bản quốc_tế iphone_x_Phiên bản_quốc tê
1,Đứa nào tốt_bụng tặng tao cái iphone_x đi Ghiền quá sao giờ
1,Cần ra_đi quả thận lên iphone_x thận to hoạt_động tốt có_thể lọc được 10lon bia vô_tư
1,iphone_x đẹp mê_hồn
1,Mấy hôm nữa đến tháng 8 âm_lịch rồi Ai cũng có_thể xài iphone nhé Qua gốc đã 200m 1,Vẫn thích iphone_x hơn
1,Thiếu_sót cực lớn của iphone_x là không tích_hợp được touch id để chị_em sử_dụng lúc tẩy_trang
1,Samsung_Galaxy S đãng đẹp xinh thì bày ra màn_hình cong Ip 5 đãng đẹp xinh thì bo tròn Đến giờ iphone_x trông chả khác_gì SS_S5
1,Em sắm iphone_x lâu rồi mà giờ mn mới rần_rần vậy
1,1 tiếng để nâng i OS 11 chính_thức cho iphone_se
1,Siêu phẩm iphone_x siêu phẩm gần 50 củ đây
1,Iphone các mã đầy_đủ tại didong Bin209 Máy bảo_hành 3 năm kể_cả rơi vỡ Chỉ có tại duy_nhất Bin209
1,Những cách thanh_toán nhanh để sỡ hữu iphone_x vừa 1,5SE mà đi cặp với iphone_x thì đúng là tuyệt các ông ạ
1,Sắp hết tháng 7 rồi Mà em đãng cần tiền Nên sang_nhượng lại cho bác nào cần Ai đặt iphone_8 hay X thì cmt họ tên ngày_tháng năm sinh em đốt gửi luôn 1 thể
1,Ninja nói không với iphone_x_Timeline_Photos
1,Cảnh_báo các bạn nữ nào thích make_up thì không nên nghĩ tới iphone_x nhé
1,Chim_Cút đã sử_dụng cụm_từ One more thing của bác Steve_Jobs như một sự tưởng_nhớ để giới_thiệu sản_phẩm hút máu fan apple iphone_x
1, Đặt_hàng iphone_8 , giảm ngay 800k và thật nhiều ưu_đãi Phạm_Trung_Quân recommended Viettel_Store_Số 160 Hà_Huy_Tập TP Hà_Tĩnh 1, Giá_mà đãng bơi đụng được_cái iphone_x , đời sẽ vui lắm 1, iphone_8 , iphone_x là cái gì vậy , này củng còn ổn mà 1,iphone_5s 16g 99 zin nguyên con có hàng nhe anh_chị của em 1,iphone giá cực tốt
1,iphone_x đẹp vcl
1,iphone_6 với ip 7 chuẩn_bị rẻ như mớ rau_muống rồi
1,Sau khi iphone_x các nhà_sản_xuất quyết_định không lấy hình quả táo để làm thương_hiệu nữa mà sẽ đổi thành_quả thận
1,ú ù iphone_x sử_dụng bảo_mật Face ID
1,Sau khi iphone_x các nhà_sản_xuất không lấy hình quả táo làm biểu_tượng thương_hiệu nữa mà sẽ đổi thành_quả thận
1,iphone_x cách_mạng mới trong làng smartphone
1, Chờ ngày em nó đến là quất thôi Đại_Kỷ_Nguyên iphone_8 thị_trường , tính_năng mới độc_quyền và mạnh_mẽ 1,ĐIỆN_THOẠI_IPHONE Các danh_mục sản_phẩm
1,Mình hợp nhau đến như_vậy thế_nhưng không phải là yêu 1,Vất_vả xếp_hàng từ đêm qua cuối_cùng cũng rinh được siêu phẩm IPHONE_X này Chúc_mừng em đã về đội của a
1,Iphone giờ mở khó ghê nhỡ các bạn_gái sáng không make_up thì điện_thoại có nhận ra không nhỉ
1,Nghe_nói iphone_x có nhận_diện 3D bằng gương mặtvậy tẩy_trang r sao mở dt được nhỉ Con_gái không nên xài nha Ahaha
1,Co ve sg không phu hop voi iphone_x
1,Thu iphone_6 6s 6plus ai có quăng cho em nhé giá cực tốt 1, ToNy cuối năm lm con Đại_Kỷ_Nguyên iphone_8 thị_trường , tính_năng mới độc_quyền và mạnh_mẽ 1,iphone_8 có gì hot không để biết đường tính coi
1,Tại_sao iu nhau không đến được zới nhau 1,iphone_5 SE và iphone_x sự kết_hợp hoàn_hảo thành iphone_seX
1,E đã về với đội của a iphone_x
1,Dùng_Face ID của IphoneX xong make_up Thế_là mãi đéo mở khoá được
1,iphone_se vs iphone_x sự kết_hợp hoàn_hảo iphone_se X
1,Kết_hợp hoàn_hảo vl Để xúc iphone LH Tuyet_Nhung_Do_Timeline_Photos
1,Nay em tập_tành kinh_doanh iphone_x_Ôm hàng về nhiều quá zồi Mọi người ủng_hộ em nhé Giá iu thương hết chịu nổi
1,Nên ôm không ôm xong lên 1 phát là đủ em iphone_x cmnr
1, Em có nhận in ốp theo yêu_cầu Có đủ loại dòng iphone , htc , oppo Thứ5 em chốt bill , ibx em để đặt_hàng nào 1, Chỉ là trúng thưởng iphone_7 PLUS thôi mà _ Hennessy_Artistry với Khắc_Việt_Rain_Nightclub_Dalat Một trong những party đặc_biệt nhất , được chờ_đợi nhất của năm HENNESSY_ARTISTRY Với khách mời đặc_biệt KHẮC_VIỆT Không_chỉ là một bữa tiệc tưng_bừng 1, Đại_Kỷ_Nguyên iphone_8 thị_trường , tính_năng mới độc_quyền và mạnh_mẽ 1, Đại_Kỷ_Nguyên iphone_8 thị_trường , tính_năng mới độc_quyền và mạnh_mẽ 1, Mình nhận oder iphone_8,8 Plus , iphone_x về Việt_Nam sớm nhất có_thể Ai có nhu_cầu ib 1,Sau khi theo_dõi IPHONE_X đêm qua từ 1 Fan_Táo giờ_đây mình chính_thức là Fan của SamSung
1, sinh_nhật G đừng ai tặng gì bự quá G hong thích , tặng cái gì nhỏ nhỏ như iphone_x đủ bỏ_túi thoi được rồi 1,Không cần xếp_hàng tôi cũng Săn được iphone_8 nhanh_nhất hệ mặT_Trời
1, Nếu_Apple là 1 động gái thì iphone_8 chính là con phò được nhiều đại_gia săn_đón nhất mấy ngày_nay Bọn m cứ quảng_cáo đi , hơi chật NF t rồi đấy 1,Thấy mọi người rầm_rộ iphone_x quá nên em tiện tay mừng thôi_nôi sắm hẳn 2 con vertu X
1, Cựu đặc_nhiệm Mỹ đề_xuất thả 25 triệu iphone_xuống Triều_Tiên Quote Originally_Posted by bahai 88v1 Tốt quá Hi_vọng việt mình sẽ có hàng_xách tay like new , lướt đến từ triều tiên Giá chắc thơm lắm đây Sent from DMTLAC using voz FApp Hóng thôi 1,Bố mất niềm_tin vào iporn lắm rồi iporn x thiết_kế giống ss vcc Nếu không phải chúng_mày không cho update ios thì_giờ bố vẫn còn yêu_thương em 3gs đấy nhé New feed cứ tràn_ngập iphone mệt mõiii emotional
1, iphone_x lỡ đãng chạy xe móc ra xem sms thì_phải giơ lên_mặt , gỡ khẩu_trang và nón bảo_hiểm ra hả các bác 1,Trên tay iphone_8 và iphone_8 Plus trong đêm được mong_chờ nhất sao em không thấy đẹp lắm nhỉ
1, 229 em sang nhật xách iphone_8 , các bác có nhu_cầu inbox , 279 hàng về VN 1,Đó h toàn được mẹ cho điện_thoại Nên_iphone_x có ra cũng ek quan_trọng Ráng qua tháng cô_hồn đi rồi nói chiện ahihi
1,iphone_x doesinh_nhậtt look good Its cool but it doesinh_nhậtt look good
1,iphone_x đẹp vch
1,Thế thôi cứ xài iphone_7 cho lành
1,Hàng về sớm nay anh_em nào cần liên_hệ sớm nhất để có_giá tốt nhất ạ iphone_8X nhé Ps 1 cái đầu_tiên đã theo anh Bí THƠ_TH Thiều_Quang_Lâm rồi ạ 1, iphone_x thu_hút nhiều người vì có chữ X_Cái gì mà liên_quan đến X , như con_gái ba X chẳng_hạn , đều được quan_tâm 1, Cầu_cứu những_ai ở gần khu_vực quận 5 gần chợ lớn có_thể cho bạn mượn dây sạc iphone , bạn hứa sẽ hoàn_trả trong hôm_nay kèm một chầu coffee nhẹ_nhàng Mọi người đi ngang hãy giúp_đỡ bạn chứ đừng hờ_hững như mấy bạn auto thả tim nha , tổn_thương bạn lắm 1,iphone_8 hay X có cân nổi không Lúc làm apple không nghĩ cho Việt_Nam tí nào Hận ông Tim yêu màu tím
1,Nge tin iphone_8 hôm_nay ra em lên A_Đổi_Thay trả_góp gì 7 dùng
1,Cường_lực iphone_x em có rồi nhé cả nhà Timeline_Photos
1,Cường_lực iphone_x em có rồi nhé cả nhà
1,Thế_nào con iphone_8 nó luông_linh nhì
1, Phấn_đấu Apple iphone_x có_giá khởi_điểm 999 USD , đắt nhất lịch_sử iphone 0151 13092017 iphone_x có_giá khởi_điểm 999 USD , đắt nhất l 1, Mấy_Má cứ rần_rần iphone_8 , nhận_diện bằng ánh mắttừ Tối_qua ts h Cubi thì chỉ đủ tiền uống Dingte là vui òi nèk 1, Cường_lực 6D loại cao_cấp nhất thị_trường hiện_nay , dành cho iphone_6,6 s , 6,6 s , 7 , 7 Giá rẻ nhất chỉ 119k 1, Đại_Kỷ_Nguyên iphone_8 thị_trường , tính_năng mới độc_quyền và mạnh_mẽ 1, iphone_x là cái đách gì thế , bình_thường vậy_mà cũng rần_rần lên Lên_Google bấm 3 chữ X_x Nó sẽ ra cái điện_thoại Iphone khủng_hoảng hơn nhiều , giá_trị hơn nhiều , cuốn_hút hơn nhiều , đủ kiểu đủ mẫu cho mà chọn_lựa 1,Đắng lòng cho các thanh_niên vừa trả_góp xong con ip 7 thì iphone_8 ra_đời
1, em muốn thay chân sạc iphone_5 ở đây có bác nào thay ở đây chưa ạ , cho em hỏi uy_tín không và có chỗ nào có_thể rẻ hơn_nữa không 1,Sau khi iphone_x các nhà_sản_xuất quyết_định không lấy hình quả táo để làm thương_hiệu nữa mà sẽ đổi thành_quả thận Hạ tèo
1, Iphone mới ra , mọi người đã tìm được giải_pháp chưa Timeline_Photos 1,Hk ước gì nhiều Chỉ mún có cái iphone_x
1, Đại_Kỷ_Nguyên iphone_8 thị_trường , tính_năng mới độc_quyền và mạnh_mẽ 1,Giá iphone_8 plus bao_nhiêu hả mọi người Ai biết cho em xin được và giá luôn chứ thấy bác goole báo là 699usd khó tin quá curious
1, Có lô gear fit 2 hàng mới full box chưa kích_hoạt bảo_hành , có đủ mã màu giá cực_kì yêu_thương , tương_thích kết_nối cả samsung và iphone , ace nào yêu alo em e ib giá nhé 1,Apple kĩ niệm iphone tôi hóng
1,iphone_x ra tháng 11 và mình nghĩ mình muốn quà sinh_nhật là gì rồi
1,iphone_8 xấu vcl 7puls còn đẹp hơn
1,Tướng nào vui vui hỗ_trợ quả iphone_x chụp ảnh cho thần sầu cái nhể
1,E_Nhận đẻ thuê dưới mọi hình_thức nhé Bùi T_Hiền_Trang was watching iphone_x
1,Shop nhận đổi iphone_x lấy các bộ_phận trên cơ_thể nhé
1,Hình_như iphone_x có mở khoá bằng face ID hả quý zị Vậy mấy em_gái tẩy_trang xong nó mở khoá được không ta
1,Shop nhận đổi iphone_x lấy các bộ_phận trên cơ_thể nhé
1, iphone_x là cái đách gì thế , bình_thường vậy_mà cũng rần_rần lên Lên_Google bấm 3 chữ X_x Nó sẽ ra cái điện_thoại Iphone khủng_hoảng hơn nhiều , giá_trị hơn nhiều , cuốn_hút hơn nhiều , đủ kiểu đủ mẫu cho mà chọn_lựa to the group Dọn nhà cho đỡ chật Phan tv Ôi iphone_8 đã rồi kìa đẹp mê_hồn
1, Hiện_tại đã có_giá của iphone_x vs giá nội_tạng anh_em nghiên_cứu , chúc anh_em sớm có iphone_x , thôi mình đi trước đây 1,Vì 1 thế_giới không có 7S em ra_đi nhanh em iphone_6S 64Gb Gold Giá đẹp 9t Alo 1,Sau khi iphone_x các nhà_sản_xuất quyết_định không lấy hình quả táo để làm thương_hiệu nữa mà sẽ đổi thành_quả thận
1, Thích thật 農 鳳 Đại_Kỷ_Nguyên iphone_8 thị_trường , tính_năng mới độc_quyền và mạnh_mẽ 1,Đang có nguồn lấy iphone_7plus đỏ với iphone_x bản Mỹ ngon quá
1, HP làm mới dòng Envy 13 Thiết_kế tinh_xảo , viền màn_hình siêu mỏng , giá 19,9 triệu đồng Viền_Mỏng 35 mm thật không chứ thế hơn đứt cả iphone_x à Mà nhìn hình đâu mỏng đến mức đó 1, iphone_8 với chả iphone_x , đây vẫn dùng 5s được 3 năm rồi , nghe gọi bình_thường có sao đâu không sao thật mà , không sao thật đấy , thề 1,Vợ có thích iphone_8 không cái 23tr ck có dư đấy An_Vân_An p
1,iphone_se thì kết_hợp giữa iphone_6 và 5s Không biết mai_mốt Apple có_khi nào kết_hợp giữa iphone_se và iphone_x mới ra không tak
1, Mấy em chuẩn_bị đập mặt xây lại , mấy thím hay trang_điểm má nhìn hổng ra , mấy cô hay bị chồng quánh chớ có dại xài iphone_10 1,Rất nhìu sự lựa_chọn cho anh_em để có được iphone_8 vs iphone_x
1,Khi thấy siêu phẩm iphone_x mà mình không có máu
1, Thư mời iphone_8 chính_thức Mong_chờ mãi mà buổi làm thất_vọng quá , haiz 1, Thị_trường iphone_x từ 1000 USD , thiết_kế toàn màn_hình , loại_bỏ nút Home và Touch ID , nhận_diện khuôn_mặt sao lại bỏ nút home Nhận_diện khuôn_mặt có_vẻ rất bấT_Tiện , công_nhận là thông_minh thật Hơi thất_vọng về con này 1,Ae có lòng hảo_tâm quyên_góp cho em ít tiền làm con iphone_x cái
1, Trên tay đãng là iphone_x , quay_phim chất_lượng tràn HD không che Timeline_Photos 1, Trên tay đãng là iphone_x , quay_phim chất_lượng tràn HD không che 1, Nay lướt fb nó rần_rần iphone_8 , iphone_x za trời 1,Ae_Mộc chuẩn_bị những gì cho siêu phẩm mới iphone_x rồi nhỉ Timeline_Photos
1,Mình đãng dùng iphone_6 nhưng nút home lúc nhấn được lúc lại không Vân tay thì vẫn dùng bình_thường laixoanroi đã nói Nút bóc máy 100k bác ơi thế còn như đứt cáp khôi_phục lại nút home thì lấy công bn lúa ạ
1,Nơi khác TQ_DAP_AK 320120II100II120100JR tai IE800 DAC_AMP tai_nghe cỏ các loại iphone_6s7Pluss uppppppppppppppppppppp
1,iphone_x ra_đời làm tim Như đãu nhóicần lắm sự an_ủi để có_thể vượt qa cám_dỗ Xin bình_yên qa đây hurt
1,Ck tặng iphone_8 44
1,Chưa có_giá iphone_8 chính_thức đâu ạ Mà thật_ra em định năm nay chỉ nhận iphone_x thôi Nên chắc tầm 311 em mới xuất_hiện nhé
1, Tram_Nguyen iphone_x_Smartphone tương_lai của Apple Và cuối_cùng Apple đã cho mắt iphone_x với nhiều sự thay_đổi về thiết_kế , nâng_cấp camera để phù_hợp với công_nghệ AR , cũng_như loại_bỏ hoàn_toàn cảm_biến vâ 1,iphone_x có rồi mà mình vẫn đãng dùng con 4s này các bác ạ
1, Hoàng_Mạnh_Trung_Apple iphone_x có_giá khởi_điểm 999 USD , đắt nhất lịch_sử iphone 0151 13092017 iphone_x có_giá khởi_điểm 999 USD , đắt nhất l 1,Mình đãng dùng iphone_6 nhưng nút home lúc nhấn được lúc lại không Vân tay thì vẫn dùng bình_thường Long_Cong laixoanroi bác tận Hà_Nội à xa quá bác ạ
1,Cần tìm gấp 1 con iphone_6s qt màu gold hoặc trắng 32gb trở_lên giá rẻ rẻ thôi ạ yêu_cầu máy zin và mới không lỗi_lầm
1, Anh không thích iphone_x , anh thích em 1,Mình nhận oder iphone_x iphone_8 8 plus giá cực tốt anh_em quan_tâm không nhỉ
1,cho ai có nhu_cầu hốt iphone_x
1,Bạn có_thể đặt iphone_x mới nhất ở đâu Bạn có_thể đặt iphone_x mới nhất ở đâu Tin_tức mọi mặt Ô_tô Đông_Hà_Quảng_Trị
1, Trên tay đãng là iphone_x , quay_phim chất_lượng tràn HD không che 1,Làm_ơn đi các bạn đừng share iphone lên tường mình nữa Đất_nước mình còn nhiều tượng_đài chưa xây lắm
1,iphone_8x bắt_đầu hot face rồi
1,Ai nhận quy_đổi iphone_x thận inbox em nhé
1,Kính cường_lực giá rẻ cho tất_cả các dòng điện_thoại iphone Giá 15k 20 không 1 miếng Nhận đến tận nơi dán Ai có nhi cầu liên_hệ mình 1,iphone_x ra_đời như một sự nối_tiếp hoàn_hảo cho dòng iphone_se Chúng_ta tạm hiểu đó là thế_hệ iphone_seX
1,Ae nên suy_nghĩ cho kỹ vào 10 năm mới có 1 lần iphone_x thôi
1,Vương_Nhật_Lâm posted an item for sale at Lâm_Thương_Store_Iphone_Ipad uy_tín ĐN 35435 Trần_Cao_Vân
1,Cựu đặc_nhiệm Mỹ đề_xuất thả 25 triệu iphone_xuống Triều_Tiên không có mạng thì_sao active được nhỉ Quan ngai sâu_sắc
1, iphone_8 ra rồi mình phân_vân quá không biết iphone 4s đã hạ nhiệt chưa , sắm cho vợ 1 con mới được 1,Nghe đồn iphone_8 sẽ có tính_năng nhận_diện bê đê thông_qua khuôn_mặt ps Chắc phải chịu_khó làm thêm ca khuya thôi excited
1, iphone_x sẽ nói không với những người giải_phẫu thẩm_mĩ quá nhiều Hoặc với các chị bên các nước Ả Rập , các thành_phần đánh bom khủng_bố IS nhá 1,iphone_x có nên hôggggg lost with Ngọc_Trinh
1,bạn muốn sở hưu iphone_8 và iphone_x tất_cả đều nằm ở bạn kaka
1,Cựu đặc_nhiệm Mỹ đề_xuất thả 25 triệu iphone_xuống Triều_Tiên hóng hàng triều tiên xách tay
1,Thấy không thích_thú với sự của iphone lần này lắm Ip8 thì không khác lắm so với 7 Còm ip x thì không full được toàn_bộ màn_hình Camera dọc và cam vẫn lồi không thấy thoả_mãn cho lắm
1, iphone_x có face ID để mở khoá , không biết chị_em khi trang_điểm và khi tẩy_trang máy nó có nhận ra_mặt để mở khoá không nữa 1,Chạy top để có iphone_x thôi mọi người 1,Mình đãng dùng iphone_6 nhưng nút home lúc nhấn được lúc lại không Vân tay thì vẫn dùng bình_thường laixoanroi Long_Cong_Nút bóc máy 100k bác ơi
1,Tinmoi24h Vẻ đẹp huyền_ảo hút_hồn của siêu phẩm iphone_x khiến giới công_nghệ mê_mẩn Bấm vào để đọc và bình_luận
1, Lễ iphone mới Lễ iphone mới của Apple Apple có_thể trình_làng tới ba mẫu iphone , trong đó có một phiên_bản đặc_biệt kỷ_niệm 10 năm dòng sản_phẩm này 1,Không_Tin là iphone_8 nó đẹp vậy luôn á trời
1,iphone_x mở khóa nhận_diện khuôn_mặt Có_vẻ không hợp với nữ vì đã có trườg hợp tẩy trag ra điện_thoại không nhận dạg được mặt chủ và đã bị block
1,Đu theo iphone_x 3 thời_thượng vc
1,Nhân_dịp ra iphone_x_Mình quyếT_Tâm thêm tiền đổi từ gì 7 prime sang ip 6s Ai hứng_thú đổi không
1,Đúng với cái tên iphone_x siêu phẩm của nó Giá thận dạo này không biết thế_nào rồi nhỉ
1, Nhiều bạn thắc_mắc vì_sao Apple lại quyết_định cho ra iphone_x để đì chết iphone_8 sao Nhưng cái gì cũng có lý_do của nó , , , X ra_đời như một sự nối_tiếp hoàn_hảo cho dòng iphone_se , , , Chúng tạm hiểu đó là thế_hệ iphone_seX 3 Đại_Kỷ_Nguyên Một cựu đặc_nhiệm hải_quân Mỹ đưa ra sáng_kiến bất_ngờ để giải_quyết khủng_hoảng Triều_Tiên
1,Chả_là em có 2 quả thận khỏe ai có nhu_cầu ib em Phạm_Thu_Diệu is watching iphone_x
1,iphone_8 ra rồi cặc sai iphone 4 đỡ đi
1,tao bắt_đầu gom lúa gói gạo nghe cái tên đã bồ_kết r iphone_xoạc
1, iphone_x nhìn phê đừng hỏi iphone_x_Smartphone tương_lai của Apple Và cuối_cùng Apple đã cho mắt iphone_x với nhiều sự thay_đổi về thiết_kế , nâng_cấp camera để phù_hợp với công_nghệ AR , cũng_như loại_bỏ hoàn_toàn cảm_biến vâ 1,Đập_hộp iphone cung ngon ha thèm qua xa kkk
1,Tôy nghĩ Apple nên ghi thêm 1 dòng feature nhỏ cho iphone_x là minh_chứng hoàn_hảo cho sự giàu_có
1,Trên tay là iphone_8 và đã được loại_bỏ nút home
1,Ai đãng sở_hữu iphone_se rồi thì ráng dành_dụm tiền chiêu_mộ thêm iphone_x Khi đó ta sẽ có sự kết_hợp hoàn_hảo iphone_seX
1, mấy anh Tàu ơi , nhái gấp dùm em cái iphone_x hàng cao_cấp xong báo_giá em bít luôn nhé 1,Điện_thoại em hư rồi hãy tặng em cái iphone_x đi Linh_Huynh_Quyen_Huynh em se iu no suốt đời kkk
1,lần này iphone_x ra nhận_diện khuôn_mặt là sai cmn lầm rồi đối_với mấy mẹ trước khi trang_điểm và sau khi trang_điểm thì nhận tđn được mà nhận
1,Mình thấy iphone_8 cũng đẹp đấy chứ
