2, Những thay_đổi lớn trên iphone_x đủ để bạn phải thốt lên rằng nó quá đẹp 2, Quy_Hanh_Thi_Nguyen Những thay_đổi lớn trên iphone_x đủ để bạn phải thốt lên rằng nó quá đẹp 2,iphone_7 gold rose 32gb bản LLA còn bh 122017 Máy đầy_đủ pk sạc cáp Bao test 10 ngày Nhận ship cod toàn_quốc 9800000 2, Face ID của Iphone có nhận_diện , phân_biệt mặt mộc và mặt sau make_up không nhỉ 2,FAN iphone đâu hết dồi 3 3 3
2, Mộc_miên Những thay_đổi lớn trên iphone_x đủ để bạn phải thốt lên rằng nó quá đẹp 2,iphone_7 gold rose 32gb bản LLA còn bh 122017 Máy đầy_đủ pk sạc cáp Bao test 10 ngày Nhận ship cod toàn_quốc 9800000 2, Chờ_đợi iphone_8 , nhưng giá_cả và thiết_kế không được như mong_đợi Giá 999 tại nhà_sản_xuất Đã lỡ yêu iphone_x rồi thì cứ yêu đi đừng sợ 2, Có ace nào đặt gạch 8 plus không nè hàng_xách tay nhé , giá lúc_nào củng mềm hơn với thị_trường vn và tgdd , còn iphone_x thì sau 2 tháng nữa mới lên kệ nhé 2, Những thay_đổi lớn trên iphone_x đủ để bạn phải thốt lên rằng nó quá đẹp 2,What the iphone_x_Beautiful 2, Cho mình hỏi có ace nào ở bệnh_viện đã_khoa tỉnh Vĩnh phúc không Mình mượn cái sạc điện_thoại iphone với nhé , cạn pin rồi 2, iphone_x Màn_hình siêu nét , mất phím Home , sạc không dây Đúng như dự_đoán , iphone_x được Apple giới_thiệu đêm 129 có hình_dáng giống với những tin_đồn trước đó 2, Những thay_đổi lớn trên iphone_x đủ để bạn phải thốt lên rằng nó quá đẹp 2, iphone_x_Unlock bằng Face ID , thế nếu mặt bị đấm sưng_vù mở kiểu gì đây nhỉ 2,Dạo này ads đắt nên thấy iphone_x không đẹp lắm
2,E nhận dịch_vụ đẻ thuê nhé Như_Quỳnh was watching iphone_x
2, Apple iphone_x thiết_kế mới , màn_hình OLED 5 8 , nhận_dạng khuôn_mặt 3D , không còn Touch ID Ôi sony của tôi sẽ làm thế_nào để cạnh_tranh vs ss và apple đây 2, Mama tặng con_cái Những thay_đổi lớn trên iphone_x đủ để bạn phải thốt lên rằng nó quá đẹp 2,ối dồi ôi có iphone_10 à
2, Yên_An Những thay_đổi lớn trên iphone_x đủ để bạn phải thốt lên rằng nó quá đẹp 2, Hoa_Quỳnh Những thay_đổi lớn trên iphone_x đủ để bạn phải thốt lên rằng nó quá đẹp 2,iphone_x làm con tim tôi đãu quá man iphone đã ra_đi cùng_với Steve rồi
2,Nhiều lúc đợi iphone ra như đợi người_yêu vậy Phải đúng người đúng thời_điểm Rất tiếc iphone_x với iphone_8 chưa phải_cái em muốn
2, Nguyễn_Đình_Khánh_Hà Những thay_đổi lớn trên iphone_x đủ để bạn phải thốt lên rằng nó quá đẹp 2, Khởi_đầu ở mức 599 USD cho model 2007 , điện_thoại của Apple được đẩy giá lên 999 USD cho sản_phẩm mới nhất , iphone_x NguônVnExpress 2, Đỗ_Việt_Hà Những thay_đổi lớn trên iphone_x đủ để bạn phải thốt lên rằng nó quá đẹp 2, Chắc chớt qá trời qơi Những thay_đổi lớn trên iphone_x đủ để bạn phải thốt lên rằng nó quá đẹp 2,iphone_x vừa ra giá nội_tạng cũng có_giá luôn Dzồi v
2, Những thay_đổi lớn trên iphone_x đủ để bạn phải thốt lên rằng nó quá đẹp 2,việc bây_giờ là đợi iphone_x về thôimà tháng 11 lận amused
2,Định gom_góp đủ tháng 11 làm em iphone_x_Mà vãi lồn quên mất là về Việt_Nam nó còn đánh thuế Chắc tận 40tr Thôi cắn_răng chờ em nó ổn_định vậy to the group An_Bằng_Hội_Tụ_Bach 500 anh_em cho hỏi zí zụ mềnh sài iphone_x mà nhắn_tin zới gái mà ngủ quên zồi zợ lấy máy áp zô mặt mình là mở khoá hả Bỏ ý_định
2,iphone_x de im va không noi zi
2,iphone_x quá đã
2, Iphone iphone , iphone everywhere cặc đéo có tiền 2, tôi còn xài cái đập đá , khi nào mới được xài iphone_x lên_đời 2,Tin_buồn dành cho các bạn nữ Các bạn nữ sẽ không thích_hợp để dùng iphone_x đâu Vì nếu tẩy_trang đi rồi nó không nhận_diện được khuân mặt bạn nữa đâu wonderful
2, Nghia_Le Những thay_đổi lớn trên iphone_x đủ để bạn phải thốt lên rằng nó quá đẹp 2,iphone_x iphone_8 cũng thường thôi chơi lớn lún lấy 1 cặp sáng zờ không mún khoe mà thấy up hoài bực_bội ghê
2, Duyên_Mỹ Những thay_đổi lớn trên iphone_x đủ để bạn phải thốt lên rằng nó quá đẹp 2, Hihi Những thay_đổi lớn trên iphone_x đủ để bạn phải thốt lên rằng nó quá đẹp 2, Moon_Hunter shared Trung_tâm Tin_tức VTV24s video Trung_tâm Tin_tức VTV24 Chiến_lược maketing của Apple , không quảng_cáo , không tiếp_thị nhưng Iphone vẫn được cả thế_giới biết đến Tại_sao họ làm được như_vậy 2, Nguyễn_Vy Những thay_đổi lớn trên iphone_x đủ để bạn phải thốt lên rằng nó quá đẹp 2,Đau_lòng thật iphone_8 ra vẫn chưa thấy iphone_7 rớt_giá 2,Vãi cả công_bố iphone_10 Sự đột_phá lớn
2, iphone_8 _
2, Chế đi chết đây đẹp quá mức Những thay_đổi lớn trên iphone_x đủ để bạn phải thốt lên rằng nó quá đẹp 2,500 anh_em cho hỏi zí zụ mềnh sài iphone_x mà nhắn_tin zới gái mà ngủ quên zồi zợ lấy máy áp zô mặt mình là mở khoá hả Bỏ ý_định
2,Biết nói_gì bây_giờ T muốn rước ẻm về 2017 at iphone_8 2017
2, Những thay_đổi lớn trên iphone_x đủ để bạn phải thốt lên rằng nó quá đẹp 2, Xĩuuuu Những thay_đổi lớn trên iphone_x đủ để bạn phải thốt lên rằng nó quá đẹp 2,iphone_se và bây_giờ là iphone_x có chủ_ý hay gì 2,Lại thao_thức giấc_mơ có tên là iphone_x
2, Ahihi được ý Những thay_đổi lớn trên iphone_x đủ để bạn phải thốt lên rằng nó quá đẹp 2,Mình không thích iphone_x lắm Thật đấy Là thật đấy Chắc_như_đinh_đóng_cột đây là lời_nói thật đấy không dám chê sợ bị chửi
2, Nguyễn_Thùy Những thay_đổi lớn trên iphone_x đủ để bạn phải thốt lên rằng nó quá đẹp 2,Ngất_ngây với iphone_x siêu phẩm của những siêu phẩm Không phải là iphone_8 hay 8 plus mà chính iphone_x mới là sản_phẩm được trông_đợi nhất ở buổi vào rạng sáng nay
2,chết mất iphone_x_Introducing iphone_x_Apple Its all screen Face ID lets you unlock with a look Portrait_Lighting lets you define the light in a scene Wireless charging Augmented reality A11 Bioni
2, Những thay_đổi lớn trên iphone_x đủ để bạn phải thốt lên rằng nó quá đẹp 2, Những thay_đổi lớn trên iphone_x đủ để bạn phải thốt lên rằng nó quá đẹp 2, Apple iphone_x thiết_kế mới , màn_hình OLED 5 8 , nhận_dạng khuôn_mặt 3D , không còn Touch ID Chắc_chắn IPhone vẫn là điện_thoại thoại hoàn_thiện nhất , không một ai qua_mặt nó 2, Apple iphone_x thiết_kế mới , màn_hình OLED 5 8 , nhận_dạng khuôn_mặt 3D , không còn Touch ID Khánh_Bee đã nói Cả 1 dòng máy quan_trọng còn nổ hàng_loạt được chứ unlock lỗi 1 lần đã là gì , trùm tổ lái cút 2, Sau iphone_se thì_có iphone_x , ghép lại là 2, Hương_Trần Những thay_đổi lớn trên iphone_x đủ để bạn phải thốt lên rằng nó quá đẹp 2, Cả facebook rần_rần vụ iphone_x , mình thì chỉ mong tích_góp sao cho_đến cuối năm có được con Macbook đểu đểu thôi huhuhu máy_tính đơ lắm lắm rồi Nhưng_mà với cái tình_hình tiêu tiền thế_này không biết cuối năm là cuối năm nào nữa 2,iphone_x thấT_Thủ
2, Phan_Trường_Phương Những thay_đổi lớn trên iphone_x đủ để bạn phải thốt lên rằng nó quá đẹp 2, Giang_Anh Những thay_đổi lớn trên iphone_x đủ để bạn phải thốt lên rằng nó quá đẹp 2, Quỳnh_Lee Những thay_đổi lớn trên iphone_x đủ để bạn phải thốt lên rằng nó quá đẹp 2,Mấy mẹ cho em hỏi ngu cái hôm qa coi live quên để_ý iphone_x nhỏ hơn plus hả Thoi tan trường nhé
2, Lưu_Quỳnh_Chi Những thay_đổi lớn trên iphone_x đủ để bạn phải thốt lên rằng nó quá đẹp 2,Thế_giới đãng phát cuồng vì iphone_8 x 2, Yêu_Em nhưng không vớ tới Những thay_đổi lớn trên iphone_x đủ để bạn phải thốt lên rằng nó quá đẹp 2, Chắc tao là đứa duy_nhất trên hành_tinh này đéo quan_tâm đến công_nghệ , đặc_biệt là cái iphone_x gì đó lại càng đlq 2,iphone_88 thất_vọng
2,Hết_Samsung vs S8 giờ thì Apple vs iphone_x_Cứ đà này niềm_tin vào Sony của tôi bị luông_lay mất confused
2,Em thèm iphone_x_Nó đã trở_lại mặt lưng kính như xưa Full màn_hình 2,đã đã đợi đợi Thịnh_Bảo_Trịnh shared advertges video advertge Introducing iphone_x
2,Dkm hôm_qua iphone mà mất điện mới đãu chứ
2, Châu_Thanh_Hằng Những thay_đổi lớn trên iphone_x đủ để bạn phải thốt lên rằng nó quá đẹp 2,Hóng con iphone_8 vs iphone_x ghê không biết nó như_thế_nào ta
2,Quàoooo_Ngất ngây với iphone_x siêu phẩm của những siêu phẩm Không phải là iphone_8 hay 8 plus mà chính iphone_x mới là sản_phẩm được trông_đợi nhất ở buổi vào rạng sáng nay
2,Bgio mới ra đến iphone_xl nhỉ Bđéo quá sợ size x không hạp
2, Apple iphone_x thiết_kế mới , màn_hình OLED 5 8 , nhận_dạng khuôn_mặt 3D , không còn Touch ID Không thấy đề_cập tới dung_lượng Pin nhỉ 2, Apple iphone_x thiết_kế mới , màn_hình OLED 5 8 , nhận_dạng khuôn_mặt 3D , không còn Touch ID Faterminator đã nói Thật_sự là không nhặt được mồm Bro ạ dia ợp đì sai v haiz 2,Đang định lên iphone_x mà không biết chỗ mô bánai biết chỉ em với 2, đẹp vaiz Những thay_đổi lớn trên iphone_x đủ để bạn phải thốt lên rằng nó quá đẹp 2, nhiều thằng chửi iphone mà không suy_nghĩ nhỉ đãng xài còn 6s , kì này không biết nên lên 8 hay lên x đây 2, không phải đợi 8pl đâu mẹ ạ Nhixhianh_Hà Những thay_đổi lớn trên iphone_x đủ để bạn phải thốt lên rằng nó quá đẹp 2, Apple iphone_x thiết_kế mới , màn_hình OLED 5 8 , nhận_dạng khuôn_mặt 3D , không còn Touch ID Azkan đã nói cãi không lại lặn luôn rồi bạn ơi Vẫn chưa hiểu ra vấn_đề à 2, Apple iphone_x thiết_kế mới , màn_hình OLED 5 8 , nhận_dạng khuôn_mặt 3D , không còn Touch ID Từ nay muốn đọc tin nhắn khi điện_thoại đặt trên bàn thì 1 nhấc máy đưa lên_mặt 2 đưa mặt lên trước máy Thích touchid hơn , chạm cái là xong 2, Apple iphone_x thiết_kế mới , màn_hình OLED 5 8 , nhận_dạng khuôn_mặt 3D , không còn Touch ID dinhchitaicanh đã nói Ăn được hay_sao mà noi ngonphán như thánh Ngôn_ngữ là để con_người hiểu nhau chứ không phải để làm_khó nhau 2,Bọn m biết tin gì chưa iphone_8 như CĂX
2, Tuưởng không đẹp mà đẹp không_tưởng Những thay_đổi lớn trên iphone_x đủ để bạn phải thốt lên rằng nó quá đẹp 2,23 triệu kìa anh_em phí quá mất bao_nhiêu con iphone rồi
2, Hôm_nay ngày hội iphone_x , mở fb kđéo từ trên xuống chỉ có cái chủ_đề này thôi , mùa này lúa em đầu_tư cho thằng ku rồi , hết mơ_mộng rồi mọi ng đừng làm em tổn_thương đêm nào em cũng mất_ngủ vì thằng ku là đủ rồi , đừng bắt em ráng ngủ để thấy iphone_x nữa nhe confused 2,Nghe_nói camera iphone_x xấu hơn iphone_8 hả mng
2, Iphone ấy , mỗi đợt Hà_Anh chỉ xin_phép nhận tổng là 10 bé thôi Hải_quan VN khó_tính lắm Hiện mình còn dư 4 slots , haha 2, Bichhop_Nguyen Những thay_đổi lớn trên iphone_x đủ để bạn phải thốt lên rằng nó quá đẹp 2,Đua theo Iphone là chớt đói thật lost
2,iphone 人 臉 辨 識 會 不 會 導 致 很 多 人 無 法 解 鎖
2,iphone_7plus nó xoá phông kiểu gì ấy nhỷ anh_em 2, Chờ đó Những thay_đổi lớn trên iphone_x đủ để bạn phải thốt lên rằng nó quá đẹp 2, hix Những thay_đổi lớn trên iphone_x đủ để bạn phải thốt lên rằng nó quá đẹp 2,tự_nhiên muốn x quá đi iphone_x cơ
2,ôi chu choa mama ơi iphone_x đẹp quá mạ
2,iphone_x về Việt_Nam chắc mắc dữ
2,Đứa thì nói iphone_8 đứa thì bảo iphone_xcũng đọc báo thôi cuối_cùng Apple nó ra luôn 8X 2,Chờ hoài cuối_cùng iphone_8 đã ra_lò Thế_là mình chuẩn_bị lên ip 6 được rồi D
2, Tuan_Nguyen Những thay_đổi lớn trên iphone_x đủ để bạn phải thốt lên rằng nó quá đẹp 2,99 người việt đọc sai tên iphone_x
2, đẹp nhưng không koa tiền pt làm_sao Những thay_đổi lớn trên iphone_x đủ để bạn phải thốt lên rằng nó quá đẹp 2, Chết chết Những thay_đổi lớn trên iphone_x đủ để bạn phải thốt lên rằng nó quá đẹp 2,Iphone trong tầm tay rồi
2, đẹp vãi iphone_x và bộ đôi iphone_8iphone_8 Plus đã chính_thức được Apple trình_làng Những thay_đổi lớn trên iphone_x đủ để bạn phải thốt lên rằng nó quá đẹp 2,Ngắm đỡ buồn thôi iphone_x_Meet iphone_x
2, Bùi_Hằng Những thay_đổi lớn trên iphone_x đủ để bạn phải thốt lên rằng nó quá đẹp 2,iphone_8 vs x ra rồi gôm lúa đi man
2,sao iphone_8 thấy không đẹp bằng samsung Galaxy s 8 vay ta
2,_ Đề_tài về iphone là chưa bao_giờ hết HOT
2,Còn vài cái ai lay giao luôn chieu nay a chi 40k 1c co gì 2 j5 j7 prime neo 7 f1s iphone_55s 6 nhanh tay queo lua keo het a 2, Chết cười với ai phôn ích iphone_x vừa ra đã bị chế dồn_dập Nút_Home biến_mất , nhận_diện khuôn_mặt và mức giá là những đặc_điểm được người dùng đem ra chế ảnh hài_hước nhiều nhất 2, Apple iphone_x thiết_kế mới , màn_hình OLED 5 8 , nhận_dạng khuôn_mặt 3D , không còn Touch ID chờ người xài comments 2, Apple iphone_x thiết_kế mới , màn_hình OLED 5 8 , nhận_dạng khuôn_mặt 3D , không còn Touch ID không có gì để chê ngoài cái giá 2, Apple iphone_x thiết_kế mới , màn_hình OLED 5 8 , nhận_dạng khuôn_mặt 3D , không còn Touch ID anh523110 đã nói Thế you có hiểu tiếng anh không đấy Hiểu hay không liên_quan gì đến việc Face ID fail vậy 2, Trần_Thu_Hiền Những thay_đổi lớn trên iphone_x đủ để bạn phải thốt lên rằng nó quá đẹp 2, Lương_Kim_Ngân Những thay_đổi lớn trên iphone_x đủ để bạn phải thốt lên rằng nó quá đẹp 2,Thêm 1 đại_dịch SỐT ở Thanh_Hoá Dịch theo tiếng VN là Đặt trước iphone_8 đến FStudio by FPT
2, Nguyệt_Mun Những thay_đổi lớn trên iphone_x đủ để bạn phải thốt lên rằng nó quá đẹp 2, Gom thóc Những thay_đổi lớn trên iphone_x đủ để bạn phải thốt lên rằng nó quá đẹp 2,Các cụ nhà em dùng iphone_x từ hôm rằm rồi
2, Met moi Những thay_đổi lớn trên iphone_x đủ để bạn phải thốt lên rằng nó quá đẹp 2,Người_người rần_rần với Iphone mới còn tôi thì loay_hoay tiền học sắp tới Ngủ trong nước_mắt
2,Chạy theo công_nghệ không nổi rồi iphone_x 49 lost
2, Bích_Thảo Những thay_đổi lớn trên iphone_x đủ để bạn phải thốt lên rằng nó quá đẹp 2, Trần_Thị_Mỹ_Duyên Những thay_đổi lớn trên iphone_x đủ để bạn phải thốt lên rằng nó quá đẹp 2,Các tín_đồ cuồng iphone_8 đâu r
2, Xuat sac qua Những thay_đổi lớn trên iphone_x đủ để bạn phải thốt lên rằng nó quá đẹp 2, sao lại bóng thế_này Đen mờ như 7plus mới thích Những thay_đổi lớn trên iphone_x đủ để bạn phải thốt lên rằng nó quá đẹp 2,Sáng giờ newfeed ngập_tràn iphone Ước gì có ai đó đem cái iphone_x đập vô trong mặt mình kêu mình xài đi không xài nó bỏ_mình vô thùng xốp Được vậy_thì hay biết_mấy he
2,Ê thế iphone_x bỏ Touch ID tức_là không_thể mở máy từ trong túi quần được nữa à quay_cóp hay làm điều khuấT_Tất như xoá lịch_sử cuộc_gọi trở_nên khó_khăn nhỉ Cái cụm camera trước không biết có làm cho phim của tôi trở_nên censored không
2,Theo các tín_đồ của iphone thì năm nay Apple có một sự khác_biệt chưa từng có trong tiền_lệ khi cho các dòng iphone_8 8 plus X là gì Ai trả_lời đúng có thưởng
2, Cố cho đỗ cái đại_học TT iphone_x và bộ đôi iphone_8iphone_8 Plus đã chính_thức được Apple trình_làng Những thay_đổi lớn trên iphone_x đủ để bạn phải thốt lên rằng nó quá đẹp 2, Mỹ_Dung Những thay_đổi lớn trên iphone_x đủ để bạn phải thốt lên rằng nó quá đẹp 2,iphone_x đẹp vãi
2, Apple iphone_x thiết_kế mới , màn_hình OLED 5 8 , nhận_dạng khuôn_mặt 3D , không còn Touch ID RobinRo đã nói Thế có xem livestream không đấy ifan Tim cục ba_hoa 1 hồi rồi thử faceid đéo nhận nhé Thế you có hiểu tiếng anh không đấy 2, Dạo này thận có được_giá không nhỉ Những thay_đổi lớn trên iphone_x đủ để bạn phải thốt lên rằng nó quá đẹp 2,các bác muốn iphone_7 xuống bao_nhiêu v v v
2,iphone_x làm con tim tôi đãu quá man đãu quá man nghĩa_là gì vậy
2,Giá_iphone_x_Note 8 iphone_6s quá phí tiền
2, huhu Những thay_đổi lớn trên iphone_x đủ để bạn phải thốt lên rằng nó quá đẹp 2, đẹp không_tưởng Những thay_đổi lớn trên iphone_x đủ để bạn phải thốt lên rằng nó quá đẹp 2,iphone_8 hnay là ngày iphone_8 hảk tiền cũng đói thý mợnãn
2, iphone_x mới ra quá đẹp , nhiều chị_em lại phải đãu háng rồi 2, Tuan_Ho_minh Những thay_đổi lớn trên iphone_x đủ để bạn phải thốt lên rằng nó quá đẹp 2, Apple iphone_x thiết_kế mới , màn_hình OLED 5 8 , nhận_dạng khuôn_mặt 3D , không còn Touch ID ORANGE đã nói thế_mà Apple từng kiện cái đó thật đấy mời bác xem trả lên phía tên của mình luôn_thể 2, Tình_hình là_hơi bị kết em iphone_x nên quyết_định lên_đời chuyển qua dùng IOS , anh_em nào nhập hàng iphone_x thì ib mình báo_giá giúp mình con iphone_5 luôn nhé 2,Ừ Cuối_cùng cũng ra iphone_8 iphone_x gì đấy Tích_cóp bao_nhiêu năm cuối_cùng a cũng sắp lấy_được em iphone 4 gọi_là thoả_mãn
2, Hại não Chin qá anh X ơi Những thay_đổi lớn trên iphone_x đủ để bạn phải thốt lên rằng nó quá đẹp 2,iphone_x so beautiful
2, Giá thận dạo này không biết thế_nào rồi nhỉ Những thay_đổi lớn trên iphone_x đủ để bạn phải thốt lên rằng nó quá đẹp 2,iphone_x làm con tim tôi đãu quá man Ngu thì chết chứ bệnh_tật gì 2,iphone_x làm con tim tôi đãu quá man Vậy mày có ý_tưởng gì sao không tham_gia góp_ý với lũ apple cho vừa_lòng Nó làm_gì kệ cmn
2,iphone_8 ra_đời mà mình đãng sở_hữu iphone_10 rồi
2, Le_Kim_Nhung Những thay_đổi lớn trên iphone_x đủ để bạn phải thốt lên rằng nó quá đẹp 2, X ơi yêu em mất rùi Những thay_đổi lớn trên iphone_x đủ để bạn phải thốt lên rằng nó quá đẹp 2, Sáng giờ cứ nhức đầu , chóng_mặt , hồi họp sao đó Bác Sỹ nói đợi tháng 11 rước 1 thèn iphone_x gray 256 để trước mặt Bóc sil Active mới hết tình_trạng này luôn đó trời 2,iphone_8 ám_ảnh đời trai Via_Thiên_Ân yeah1kash yeah1network iphone8
2, Ngày_càng luông_linh Những thay_đổi lớn trên iphone_x đủ để bạn phải thốt lên rằng nó quá đẹp 2,Iphone_x em nó đẹp tuyệt_vời không cưới em nó thì phí quá
2, Dặn lòng là phải thật kiềm_chế Những thay_đổi lớn trên iphone_x đủ để bạn phải thốt lên rằng nó quá đẹp 2,Iphone thận Thánh nhọ phân_vân không biết chọn quả bên nào trao tay các anh Trung_Quốc
2, iphone_10 đã ra , anh_em ai hiểu Nguyễn_Thanh_Phúc mình đi trước nhé 2,Gương_mặt này vô apple store có được free iphone_10 không
2,Cách mà Jony_Ive sử_dụng Powerpoint 2010 để sáng_tạo nên iphone_x apple 2010 Timeline_Photos
2,Đệt cộ điên rồi nghe Để đó tháng sau ta hốt iphone_x
2,Cận_cảnh trên tay iphone_x_Tương lai của smartphone 3
2, Những thay_đổi lớn trên iphone_x đủ để bạn phải thốt lên rằng nó quá đẹp 2, Bắt_đầu mài răng Những thay_đổi lớn trên iphone_x đủ để bạn phải thốt lên rằng nó quá đẹp 2,Ai biết chép hình từ usb vô iphone không dạai biết làm dùm đi huhu khổ quá dumb
2,Đề_nghị các má là iphone_8 và iphone_x đều có dây sạc như iphone_67 nha Cái wireless charger mat là 2018 mới ra Suy ra tốn tiền đến 2 lần
2, Huhuhu Những thay_đổi lớn trên iphone_x đủ để bạn phải thốt lên rằng nó quá đẹp 2,Sáng lướt face toàn tin iphone_x_Thật lòng chứ ghét nhất kiểu iphone như_vầy Giá bao xấu
2,iphone_x quá tuyệt_vời Xem tại đây 2, Công_Thành Những thay_đổi lớn trên iphone_x đủ để bạn phải thốt lên rằng nó quá đẹp 2, Địa_điểm ăn_uống Fan nhà Táo đâu chuẩn_bị tiền hốt mí ẻm thôi nè iphone_8 8 Plus , iphone_x IPHONE8 iPHONEX TEAMTAO Nguồn_Kênh 14 2,iphone_8 đã ra thôi mình cũng cố_gắng làm con iphone 4 để được bằng nửa bạn_bè
2, Nguyễn_Ngọc_Thuý Những thay_đổi lớn trên iphone_x đủ để bạn phải thốt lên rằng nó quá đẹp 2,Ip x là gì Đây chuyển hẳn lên iphone z rôi
2, Bao h bộ_đội đán rơi tiền Những thay_đổi lớn trên iphone_x đủ để bạn phải thốt lên rằng nó quá đẹp 2,iphone_8 clq tắt mẹ fb đi
2,Những con iphone_88plus về sớm nhất hệ mặT_Trời Nhanh tay đê bà_con cô_bác kẻo muộn Hui
2,Yên_tâm iphone_xcó thì Chợ_Lớn cũng sẽ có Đợi 1 tuầnBi kêu hãng in gấp Địa_Phủ_Thông hành nha mấy MáGiá 15k
2,nghe_nói iphone_x gì đó mới ra
2, Bao_giờ có ip 10 thì cũng làm 1 con chơi Những thay_đổi lớn trên iphone_x đủ để bạn phải thốt lên rằng nó quá đẹp 2, Những thay_đổi lớn trên iphone_x đủ để bạn phải thốt lên rằng nó quá đẹp 2,1 chặng đường dài thôi dừng lại ở đây iphone_x 50tr lận không đú được
2,HỎI_ĐÁP_Q_AC ác vấn_đề liên_quan đến iphone Có cách nào ẩn được tin nhắn từ một người được không các bạn Chỉ khi mình muốn mở xem thì cần phải điền pass mới xem được ấy Trên android có mà ios tìm app khó quá Trả phí cũng được ạ Thanks
2, Trang_May May Những thay_đổi lớn trên iphone_x đủ để bạn phải thốt lên rằng nó quá đẹp 2, Đm thề , iphone MƯỜI mặt trước khỏi chê 2, Vầy rồi sao nhận_diện khuôn_mặt , iphone_x thua rồi 2,Đang tự hỏi có thuyết âm_mưu nào đằng sau iphone_se và iphone_x không Năm sau ra iphone_seX
2, Thấy cưng nè Bich_Chi_Trương_Ngọc_Thanh Những thay_đổi lớn trên iphone_x đủ để bạn phải thốt lên rằng nó quá đẹp 2, Có 999 thôiii mà iphone_x và bộ đôi iphone_8iphone_8 Plus đã chính_thức được Apple trình_làng Những thay_đổi lớn trên iphone_x đủ để bạn phải thốt lên rằng nó quá đẹp 2,Sửa điện_thoại và nỗi lo bị luộc đồ Em qua chỗ 4 yết kiêu trung_tâm dịch_vụ APPLE của FPT services nếu iphone_6 còn bảo_hành thì được free còn hết thì mình làm dịch_vụ vừa an_tâm hàng ngon không lo bị luộc Oke
2, nhiều thằng chửi iphone mà không suy_nghĩ nhỉ Ip8 thì không khác_gì ip 6 , ipx thì xấu lạ 2,Ốp vu trong của ip 8 mn ạ to the album Ốp phụ_kiện điện_thoại ipad iphone củ sạc dây sạc tai_nghe 2,Bạn nữ nào_hay make_up kiểu quá_tay Thì không nên dùng iphone_x_Khi tẩy_trang đi sợ 3D face ID nó không nhận ra
