2,hôm_qua đến giờ lướt fb không có cái tin gì ngoài iphone_8 Mắc mệt
2, Người dùng cho rằng iphone_x quá đắt_đỏ Người dùng cho rằng iphone_x quá đắt_đỏ Người dùng cho rằng iphone_x quá đắt_đỏ Thời_sự VTV , Dân_trí , Báo mới , Tin_tức 2,Con_buôn Tim_Cook sẽ dìm chết Apple bằng iphone_x Mình đãng xài iphone chỉ vì cái ios Bởi_vì android chưa thực_sự tốt như ios Nếu 1 ngày nào_đó android tốt như ios lúc đó mình sẽ chuyển qua android Dù gì thì android đã_dạng nên có nhiều lựa_chọn
2, Con_buôn Tim_Cook sẽ dìm chết Apple bằng iphone_x Đang tính múc con mimix đây , nhìn cái máy liền lạc mà thèm vãi 2,Xưa thì_ra iphone_se bây giời lại còn ra thêm ai iphone_x
2,kđéo lên kđéo xuống chỉ toàn thấy iphone T thây nó tính hết cả rồi trước nó ra iphone_se giờ nó làm nốt quả iphone_x ghép lại thử xem rước về hại cả thân
2,iphone_x_Camera xấu mà nhìn cái mặt trước mê quá
2,linkhay Nhiều anh_em lại bảo tuần vừa_rồi cho đi tong mất mấy cái iphone_x rồi Nhiều anh_em lại bảo tuần vừa_rồi cho đi tong mất mấy cái iphone_x rồi
2, Hơi bị mê rồi trải_nghiệm iphone_x , sáT_Thủ nguy_hiểm nhất của Apple F a không em L o v em Có iphone_8 cua gái dễ vậy luôn à D m
2,Rảnh ngồi tìm_hiểu tại_sao không có iphone 9 mà_lại lên thẳng X ten cũng hay có_vẻ bên tây số 9 là số xui thì_phải Hoang_Song_Thai was looking for four leaf clovers
2,dm tao cố lắm chỉ được 3 cuốc chúng_mày ạ 3 thế_này đéo có iphone_x rồi v
2,các bạn nữ mà sài iphone_x chắc mở khoá cũng khó_khăn ấy nhỉ
2,Con_buôn Tim_Cook sẽ dìm chết Apple bằng iphone_x thế mới thấy đẳng_cấp của Steve_Jobs tạo ra 1 sản_phẩm marketing chục năm sau ăn_theo vẫn quá ngon
2,Thật chỉ buồn chút cụm sénor mặt trước iphone mười H có cả hình nền đen_ngòm luônđúng là iphone vẫn nhất Luôn iu iphone ý
2, anh không thích iphone_x , a chỉ thích em thôi 2,ai se la nguoi so huu iphone_x dau tien
2,Điện_thoại kiểu gì mà gần chục tấn thóc toàn đầu_độc người nghèo thôi phải bỏ_tù iphone
2, Con_buôn Tim_Cook sẽ dìm chết Apple bằng iphone_x Nói cũng đúng , trừ đoạn Apple sẽ bị dìm chết 2, Con_buôn Tim_Cook sẽ dìm chết Apple bằng iphone_x Đối_với tôi IPhone của Steve_Jobs đã chết , xuống mồ cùng ông rồi Sent from Samsung SMG950F using voz FApp 2, Jay_Chou Ảnh thực_tế iphone_x Những thay_đổi lớn trên iphone_x đủ để bạn phải thốt lên rằng nó quá đẹp 2,Ủa gì vậy có ip 8 là có tất_cả à F a không em L o v em Có iphone_8 cua gái dễ vậy luôn à D m
2, ối zồ ôi đẹp quá trải_nghiệm iphone_x , sáT_Thủ nguy_hiểm nhất của Apple 2, trải_nghiệm iphone_x , sáT_Thủ nguy_hiểm nhất của Apple 2,Kiểu tóc hot nhất mùa mưa_bão năm nay Sau khi iphone_x iphoneX
2,Fb có biến tòan là iphone_8iphone_x gì tè le
2,Thấy fb rầm_rộ ip 8 với ipx gì gì đó loạn quá Mình post lên khoe cấy iphone_10 Mà dùng ốp nên cũng_như iphone tàu thôi Nên mọi người bớt rầm_rộ đi
2,Sáng giớifan Táo đãng xôn_xao iphone_x nhận_diện bằng khuôn_mặt Chợt nhìn lại mình đãng xài 305Sh hàng thải công_nghệ Nhật cũng nhận_diện khuôn_mặt đây
2, Nóng_bức quá trải_nghiệm iphone_x , sáT_Thủ nguy_hiểm nhất của Apple 2, Thực_chất ra mà nói thì điện_thoại nào mà chả dùng được Cứ nghe gọi , Lên mạng , xem sex , lướt web , online facebook chém gió ầm_ầm là ok rồi iphone_89 làm_gì cho tốn tiền 2,chừng nào ghé sang Việt_Nam nhỉ để kđéo lứoi ra giăng Cười_Ngả_Nghiêng Mỹ chơi được đấy V
2, Hường_Nguyễn shared Thánh nhọ Brians video Thánh nhọ Brian Tổng_quan , tổng_kết một_chút về iphone_x ghi_nhớ ngày 2,Điện_thoại gì cứ điên cả tuần nay mất hết tất_cả dữ_liệu Em chưa có máu đổi iphone_x gì đâu nha bây_giờ muh chia_tay là em ve Nokia 1310 đo nha
2, Lướt fb thấy ai cũng bàn về iphone_8 đồ giàu_có quá , hậm mô gêchúc mừng 2, Mình nhận đổi Iphone máy cũ thành máy mới 100 chưa active máy bạn nào còn bảo_hành là đổi được vỏ xấu , kiếng xấu , móp 2, Nhà_nhà người_người iphone S , iphone_x_Kìm hãm lại , iphone_6s còn chưa đổi lên được Bị sếp đầu_độc muốn bọn chen con iphone_7plus của sếp T_ T 2, Đến giờ đổi điện_thoại mới_rồi , nhưng phải đợi giá nó xuống đã hihi iphone_x_Introducing iphone_x_Apple Its all screen Face ID lets you unlock with a look Portrait_Lighting lets you define the light in a scene Wireless charging Augmented reality A11 Bioni 2,iphone_8 là cái lờn gì nhề v F a không em L o v em Có iphone_8 cua gái dễ vậy luôn à D m
2,Con_buôn Tim_Cook sẽ dìm chết Apple bằng iphone_x Công_nhận bài viết này nói quá chuẩn Từ sau IP5s là Apple xuống_dốc hẳn
2, Ao ướt quá trải_nghiệm iphone_x , sáT_Thủ nguy_hiểm nhất của Apple 2,iphone_x nhận_diện bằng khuôn_mặt vậy làm pttm chung lò bs vậy mặt nào cũng nhận được ha
2,Iphone lại cập bến miếng dán cuong lực ib báo_giá 2,Iphone mới trả IPHỒN_Y con cặc ấy đượcm 12h trưa vừa_mới ép lại kính song Thỳ 9r tối đéo být làm_sao chỉ để 1 chỗ thôi lại vỡ màn_hình tiếp Mà trong khi đó kòn dán kả kính cường_lực nữa mới nhục chứ Đời chó_chết thậ T
2,Nghe_nói iphone_x mới ra
2,Nhìn mấy mẫu iphone mới ra thấy nó xấu thiệt
2,iphone_8 thì chả khác rù 7 mà iphone_10 thì chất vcd wonderful
2, Sáng giờ fb rần_rần vụ iphone , nhưng có_lẽ mình em không để_ý đến nó không tiền awesome 2, Mình thấy nó thiệt là zữ tợn chứ mình hong thấy đẹp Những thay_đổi lớn trên iphone_x đủ để bạn phải thốt lên rằng nó quá đẹp 2,Con_buôn Tim_Cook sẽ dìm chết Apple bằng iphone_x Đúng quy_trình Cơ_mà hơi sớm rồi thằng thớt Sent from my LGF460 using voz Forums
2, Thầy bảo phong_thuỷ mình hợp_số 8 và màu gold Những thay_đổi lớn trên iphone_x đủ để bạn phải thốt lên rằng nó quá đẹp 2,mẹ nói nghỉ nhậu có ngay con iphone_x Nên không anh_em 2,Lấy iphone chống lưng cho ipad với mục_đích xem phim đỡ mỏi tay Hiềnn_Monn
2,Có_khi nào thả nhầm qua Cười_Ngả_Nghiêng Mỹ chơi được đấy V
2,iphone_x đẹp quá nhưng_mà thôi vậy
2, iphone_x nhìn đẹp thế_này thì dự là có nhiều em_gái sẽ đãu háng lắm đây
2,Newsfeed toàn tin về chiếc iphone mới ra đặc_biệt của apple không dành cho con_gái là sao ta 2,iphone_se xoạt iphone_x iphone_seX wonderful
2,Đang định đổi iphone Ai giúp được nt riêng nhe
2,Đang có chút thắc_mắc là những bạn nghiện phẫu_thuật mặt thì mở iphone mới kiểu gì nhỉ haha
2,K phải nghèo mà chê iphone_x xấu vãi
2,không có iphone để tự sướng thì đành vác máy_ảnh ra vậiii
2,iphone_x được chào_giá gần 50 triệu đồng ở Việt_Nam Quote Originally_Posted by daidam 07 Mới à Báo lỗi cho Apple có_khi được nhiều tiền đấy ý mình là nó cài vân tay của nó vào dt mình trong phần cài_đặt ấy
2,Tính ra mình có cũng khoảng 6 cái iphone_x rồi nhẩy
2,Bộ đôi iphone chất lừ là SE và X Công_nhận không
2, trải_nghiệm iphone_x , sáT_Thủ nguy_hiểm nhất của Apple 2,iphone_x nghe đến đã sang con_người rồi motivated
2,iphone_x x nao long ghe luônnn 2,Kiếm cái IPhone sài sao khó quá vậy trời F a không em L o v em Có iphone_8 cua gái dễ vậy luôn à D m
2,Ốp Xi đỏ Táo khoét đã có hàng trở_lại Đủ iphone_566plus7plus đặc_biệt có luôn iphone_10 35 ngèn nha 2,huhuGG trả iphone_x cho tao
2, Apple iphone_x thiết_kế mới , màn_hình OLED 5 8 , nhận_dạng khuôn_mặt 3D , không còn Touch ID Khánh_Bê đê đã nói Con cờ hó Khánh_Bee bảo_vệ chủ đã hiển kinh xuất_hiện rồi Seeder cay_cú ghê vậy Thấy tội em quá , haha 2,iphone_se và iphone_x sắp ra tạo thành_bộ đôi quá CHẤT Các hãng khác tuổi gì sánh_vai
2,iphone_8 đã có Thả thính đánh bả đi các xị em Cũng đáng đồng_tiền bắt gạo lắm ý pumped
2,Nỗi ám_ảnh iphone_x
2,Vl ip 8 F a không em L o v em Có iphone_8 cua gái dễ vậy luôn à D m
2,Có iphone của ai bị giống em không Thỉnh_thoảng ai gọi đến có_tiếng kiểu cháy âm không nghe thấy gì đầu bên kia thì nghe thuê baophải tháo sim ra lau lại mới được mà chỉ plus mới bị thôi
2,Chỉ còn vài tiếng nữa thôi là sẽ cầm trên tay em nó 500 like sáng_mai sẽ trên review iphone_x cho anh_em xem excited with Truc_Linh_Tran in United_States
2, iphone 9x chỉ có 2 triệu rớt không bể kháng nước vô_tư , lướt web bằng giọng nói , tích_hợp mạng 6G , lưu được 200 film cấp 5 Japan_Quánh lộn vũ_khí lợi_hại mà không sợ bị cướp 2, Mai_Phương_Thiên_Ân Những thay_đổi lớn trên iphone_x đủ để bạn phải thốt lên rằng nó quá đẹp 2,Bao_nhiêu chuyện phải suy_nghĩ mệt như chó cắn 2710 mới ra iphone_10
2,Từ lúc iphone_x nó ra không hiểu sao điện_thoại mình thấy pin nó nhanh hết thế
2, trải_nghiệm iphone_x , sáT_Thủ nguy_hiểm nhất của Apple 2, iphone_x , 8 , rồi thì chắc là khá nhiều em_gái đãu háng lắm 2,bác nào có iphone_6 lock còn đẹp thì báo_giá em ạ tầm 3tr đổ lại em sinh_viên không có nhiều tiền ăn mì tích_cóp mấy tháng đấy ạ em ở hà_nội ạ
2,Trong trường_hợp này mà xử dụng iphone_x thì cũng đãu_đầu nhỉ không biết phải làm_sao
2,Muon iphone_x vá trời
2,Yêu với đương cái gì F a không em L o v em Có iphone_8 cua gái dễ vậy luôn à D m
2,Hóng mấy anh đi Sing mang iphone_8 về cho chụp hình sống ảo quá đi
2,Vừa lấy iphone_x về thì bị lock vì không nhận_diện được mặt do da quá đen
2,iphone_x da tren tay
2,sơn_mài 4d nét dã_man iphone_566plus 77plus 80k thôi to the album Hàng mới tháng 9 2, Chắc tuôi chớt vs nó Khi nào đủ money đây Những thay_đổi lớn trên iphone_x đủ để bạn phải thốt lên rằng nó quá đẹp 2,Ai ở gần công_viên trới có sạc iphone cho mình mượn mai sáng trả
2, không còn từ nào để tả Những thay_đổi lớn trên iphone_x đủ để bạn phải thốt lên rằng nó quá đẹp 2,Đi ngủ thôi và mơ về ẻm iphone_8X ở trong tay mình Cả nhà ngủ ngon ạ 大 家 晚 安
2,iphone_x ám_ảnh t quá man Tim t tan_vỡ mất
2,iphone_x là cái ôn_vật gì mà ace thi nhau khoe mất thận thế
2, Khi iphone_x ra , tôi nghĩ ngay đến bê f , sam 8 , xạo li , hơ vú , són nầy tôi nhớ nội tôi 2,Xin_lỗi em Anh không dùng iphone_5s hix
2,Trùng_hợp dữ iphone_x mười Bão số 10 Doksuri Keep calm The storm is comming Le_Tan_Trung_Ba posted 3 photos on 2,iphone_x cũng bó_tay mà
2, Vânn_Annh Những thay_đổi lớn trên iphone_x đủ để bạn phải thốt lên rằng nó quá đẹp 2,Iphone giờ rẻ quá Dùng 1202 thôi
2, Cầm hàng thật trên tay mới cảm_thấy thật đáng đồng_tiền_bát_gạo Video trải_nghiệm iphone_x , sáT_Thủ nguy_hiểm nhất của Apple 2,Tag bạn nữ nào cũng đãng ngắm_nghía iphone_x nhé các bạn nam
2,Tín_đồ iphone_56 ai ưng rước em ấy gia chi 40k mai ship luôn ạ 2, Liên_Liên Những thay_đổi lớn trên iphone_x đủ để bạn phải thốt lên rằng nó quá đẹp 2,dm đéo có tiền sài đen_trắng ol fb toàn iphone_8 với iphone_x là cc gì vậy xa sỉ vl v
2,iphone_x của tôi bị rơi nếu chẳng may Phạm_Băng_Băng nhặt được thì_sao nguy_hiểm quá ahuhu F a không em L o v em Có iphone_8 cua gái dễ vậy luôn à D m F a không em L o v em Có iphone_8 cua gái dễ vậy luôn à D m
2,Anh có 2 chiếc 8s plus Anh F a không em L o v em Có iphone_8 cua gái dễ vậy luôn à D m
2, Dạo này đúng nhà_quê luôn Ra iphone_8 , 8 , lại cả iphone_x thế_mà không hay_biết gì cả , may nhờ thằng em nó up FB mới bik Đúng là tối_ngày quay_cuồng với mấy khúc xương chó ultraracing và pizza đình khang at Cty_Tonys_Team 2,Quên iphone_x đi không phù_hợp với chúng_ta đâu
2,Lương tháng các bạn mình nghĩ chưa chắc đã được 30 củ 1 tháng mở_mắt ra là nói iphone_x
2,Chắc_chắn 1 câu là iphone_x nhiều chị_em sẽ bị đãu háng Bởi_vì iphone_x thiết_kế bằng kim_loại lại to khi chị_em mặc quần_jean bó sẽ gây ra đãu háng
2,Muốn giả_bộ rớt điện_thoại rồi ai đó giả_bộ tặng Linda_iphone_x
2,iphone_8 X tao không quan_tâm Cái tao quan_tâm ở đây là bao_giờ thằng Tùng comebank trở_lại _
2,iphone_se 2016 iphone_x 2017 Iphone 2018
2,sam fan zô chửi đinote 8 tuổi lìn đòi vượt mặt iphone_x của t nhéahihi
2, Ảnh so_sánh cấu_hình iphone_7 và iphone_8 , iphone_x 2,Vật_chất luôn_luôn phải là cái có trước F a không em L o v em Có iphone_8 cua gái dễ vậy luôn à D m
2,Rồi làm_sao mấy đứa 2 mặt xài được iphone_x
2,Hihi h Ứa_Ng F a không em L o v em Có iphone_8 cua gái dễ vậy luôn à D m
2, trải_nghiệm iphone_x , sáT_Thủ nguy_hiểm nhất của Apple 2, been Nguyễn Những thay_đổi lớn trên iphone_x đủ để bạn phải thốt lên rằng nó quá đẹp 2,Đm nghe_nói ra iphone_8X thì Ip 7 giảm đáng_kể o Tậu ngay con 7 về đi đường thì bị vỡ
2,iphone_x mắc vãi ra
2,Ôi iphone_xbán hết
2,Có iphone_8 thì 1280 có giảm_giá không nhỉ
2,Ai biet check iphone qua xa dan lay giup minh ship ve cau giay ah Ship 50k Ung 850k 2,iphone_6s 64G giờ bao_nhiêu vậy anh ơi
2,Mất con iphone nên là danh_bạ a em bb Cũng mất mới làm lại sim nên a em tc nha 2,Đầu tiền là iphone_se giờ là iphone_x phải_chăng apple muốn ám_chỉ đến SEX ác_ôn thật v
2,t là 1 ng đi like dạo thấy gì t cũng like nhưng tại_sao mọi người lại không like cho tôi haiz ps iphone 9 ms đây ạ ms vừa đập hôp luôn
2,Máy cạo râu iphone Lẻ 120k
2,IPHONE_X mới cảm_giác là người đầu_tiên được cầm trên tay nó phê lắm các bác ạ
2,Ước dì bây g ai cho mượn cục sạc iphone_6
2, iphone_x , Galaxy_Note 8S8 , mi_miX 2 , LG_G6 V30 bạn thích thiết_kế nào biết là vẫn còn nhưng rò_rỉ thì thấy thiết_kế cũng không có gì khác năm_ngoái lắm Mà mình chỉ thấy cũng chí có 3 kiểu đó sam sung , LG , Xiaomi thôi Iphone một_mình một ngựa thì không nói làm_gì 2,Tao có iphone_se tao có iphone_x À mà thôi
2,Có anh_em bạn_bè nào hack được game này trên iphone đã jab kgiúp mình với
2,iphone_x đãng siêu hot Nhưng cho em hỏi ngu tí Giờ các ninja đi_ngoài đường mà giơ lên mở máy thì như_thế_nào nhỉ
2,vcl F a không em L o v em Có iphone_8 cua gái dễ vậy luôn à D m
2,Người_ta có iphone_x_Mình cũng có haiz
2,Em đổi lấy iphone_x
2,Hazzz hai đơi F a không em L o v em Có iphone_8 cua gái dễ vậy luôn à D m
2,đãng đi có con nó kêu đi nhởi các man ạ mà t nghĩ iphone_8 mới ra nên t về 2, Những thay_đổi lớn trên iphone_x đủ để bạn phải thốt lên rằng nó quá đẹp 2, iphone_x dùng sao sao ý , không quen lắm 2,Đâu_đâu cũng pissed
2,iphone_x sắp ra mà em nó vẫn còn xài ip 6 Tính mình không thích chạy theo công_nghệ hay tiếc tiền Chắc đáp_án số 2 quá
2,Đi_khách tới khi iphone_x ra chắc đủ tiền F a không em L o v em Có iphone_8 cua gái dễ vậy luôn à D m
2,Dời ơi iphone_8 đẹp hết có biết mà chỉ Sài iphone 4 đi_sau công nghệ 4 vòng không bt khi nào mới có chắc có iphone_8 thì người_ta ra iphone 20 ùi puon thiệt
2, Đạt_Nguyễn Những thay_đổi lớn trên iphone_x đủ để bạn phải thốt lên rằng nó quá đẹp 2,Nghe_nói mới ra iphone_x Giá thận nay thế_nào rồi anh_em 2, Apple hay thật nó ra iphone_se xong bây_giờ nó ra iphone_x , thế ý chúng_mày có phải là cho đầy_đủ chữ SEX không 2,Trần_Trung_Kiên iphone Z nè
2, iphone_6 plus 64gb gold zin All bản Mỹ hàng hiếm bh 6 tháng , giá bất_chấp Giá 8xtr 2, Chị JEONJUNGKOOK_BAR tặng iphone_x cho ông Út kìa trời Chị_gái ưi , chị đánh_rơi em_gái nè 2,Why do you need an iphone when all you need is iđó
2,Thấy đâu_đâu các bạn cũng iphone_x nghe_nói em nó đãng hot
2,Khi nào có_giá iphone_8 iphone_10 em mới báo_giá Hiện_tại chỉ là lời đồn
2, Bao_Quoc Những thay_đổi lớn trên iphone_x đủ để bạn phải thốt lên rằng nó quá đẹp 2,iphone_8X ra thi em cung lên đơi thôi 3
2,loa trong iphone_6 sửa hết nhiêu tiền vậy moi người
2,iphone_x nghĩ rồi bỏ nha
2,iphone Chưa ra mà đã mất mẹ nó không
2,Lâu oy iphone bắn vẫn ok
2,NICKI_miNAJ pour mon cadeau danniversaire je veux IPHONE_X stp mon bébé fais moi ce plaisir la
2,Fb điên_đảo vì iphone_8 còn tôi thấy chả có gì không đủ tiền chạy theo công_nghệ Con_Plus này mới kich hoạt được 15 ngày hiện_tại chua co ý_định Tiên đo để làm viẹc khác 2, sao đua lại đây Những thay_đổi lớn trên iphone_x đủ để bạn phải thốt lên rằng nó quá đẹp 2, Nguyen_Thi_Huong Những thay_đổi lớn trên iphone_x đủ để bạn phải thốt lên rằng nó quá đẹp F a không em L o v em Có iphone_8 cua gái dễ vậy luôn à D m
2, trải_nghiệm iphone_x , sáT_Thủ nguy_hiểm nhất của Apple 2, Thắc_mắc một tý , lỡ thức khuya nóng trong người , mặt bị nổi đầy mụn má nhận không ra vậy iphone_x có nhận_diện để mở máy được không ta 2,Muốn có iphone_x quá
2, Có friend nào đặt iphone_x liên_hệ mình sớm nhất nhé in Ho_Chi_minh_City , Vietnam 2,Ngày nào cũng vứt đi vài cái iphone_xthật là lãng_phí
2, Thấy cái iphone_x mà thấy thèm quá , cái đó mà về nhúng dấm hay_là tái chanh đều ngon đó nhỉ điên_đầu vi iphone_se và iphone_x 2,Sắp ra Iphone ếch
2, Apple iphone_x thiết_kế mới , màn_hình OLED 5 8 , nhận_dạng khuôn_mặt 3D , không còn Touch ID iphone_x ngon hết_chỗ_nói 2, Video_Người tham_dự Note 8 nói_gì Hỏi khách mời cũng_như không , note 8 tốt nhưng rất tiếc các chế vẫn chọn iphone v 2,Khi 2 vợ_chồng bàn_luận về iphone
2,Mình thì mình không quan tân tới iphone_x đâu v neo Kem_Gấu Hãy_Tag người sẽ chui xuống dưới để nhặt iphone_x cho bạn KemvaGau IphoneX Merino
2, trải_nghiệm iphone_x , sáT_Thủ nguy_hiểm nhất của Apple 2,X_Iphone sẽ thất_bại thảm_hại tại thị_trường Vietnam nè
2,Nhiều khi mình đéo thể hiểu F a không em L o v em Có iphone_8 cua gái dễ vậy luôn à D m
2,K có tiền đú iphone_8 thì đú IOS 11 thôi vậy
2, Tớ cũng thích lắm hihi Những thay_đổi lớn trên iphone_x đủ để bạn phải thốt lên rằng nó quá đẹp 2, Mạnh yếu tuy từng lúc khác_nhau , nhưng giá iphone như bây_giờ thì năm nào cũng thấy 2, Bầu_Kiên ngồi_tù , vợ_chồng vẫn thu về hàng trăm tỷ đồng nhờ cổ_phiếu ACB Quote Originally_Posted by iphone_x 1972 45 tuổi , được không mí anh_em Có nhiều ảnh thế_thì share cho mình ngắm bớt đi anh bạn 2, Nguyễn_Xuân_Hiệp Những thay_đổi lớn trên iphone_x đủ để bạn phải thốt lên rằng nó quá đẹp 2, hix khách ngóng Bơ_Booth nhà em như ngóng iphone_x Bị chửi , bị gọi , bị hối hix thậT_Tình là em đãng đi kiếm đồ ngon cho mấy chế đây Bơ phải to tầm 600gr đến 700gr em mới lấy Bơ này ăn giảm cân là bao ngon , chắc Em bé ăn dặm là nhức_nhối luôn hix , chờ em nhé Có em giao hàng liền đừng hối em 2,Sáng giờ mấy cha mấy má đua nhau bình_luận iphone_x iphone_8 thấy mệt lôl
2,iphone_8 ra giá nó nhẩy như ếch tập nhẩy
2,Cũng vì cái iphone_x mà nhiều má lộ rõ bản_chất nghề_nghiệp dễ_sợ Đừng lấy ip x ra để PR trá_hình nhé Đi_khách cũng từ_từ chứ có đâu mà rần_rần hà lost
2,sao ai cũng iphone_x hết vậy
2,Hội ninja lead không dùng đx đâu Trọng_Tín shared Cười đãu cả bụngs photo Cười đãu cả bụng Ninja nói không với iphone_x
2,k dám vs a à F a không em L o v em Có iphone_8 cua gái dễ vậy luôn à D m
2,Kết rồi đấy cơ_mà nhiều tiền quá iphone_x ơi iphone_x_On hands Preview iphone_8 iphone_8 plus iphone_x
2,Apple thâm lắm iphone_seX hỗ_trợ Jav chất_lượng cao anh_em nhỉ
2,Chờ mãi thì cuối_cùng iphone_x cũng ra Ai có cái 4s nào để lại giá bèo không ạ
2, iphone_5 SE iphone_x , thật_là thâm_thúy 2, iphone_x mới ra đã bị hacked , thật buồn cho ifan 2, Bầu_Kiên ngồi_tù , vợ_chồng vẫn thu về hàng trăm tỷ đồng nhờ cổ_phiếu ACB Quote Originally_Posted by iphone_x Klq , ahihi bầu Kiên ơi , anh trong tù nhìn hình này hộc máu mà chết Thím cho em xin tí thông_tin gầm giường với 2, Bầu_Kiên ngồi_tù , vợ_chồng vẫn thu về hàng trăm tỷ đồng nhờ cổ_phiếu ACB Quote Originally_Posted by iphone_x 1972 là năm sinh vl 45 tuổi mà trẻ vãi 2,Nguoi ta deo kieng mat ra duong Em deo kieng mat xem iphone 2, Enfin liphone_8 est sorti Cela signifie quil yaura moins de demande pour liphone_7 , ce qui fera ch û ter le prix de liphone_6 Et qui rendrait liphone_5 moins chèr et de cette fa ç on je vais enfin acheter un iphone 4 Dieu est vraiment grand 2,Mẹ cho tiền đổi iphone_x luôn ca 8
2, nghe đồn siêu phẩm iphone_x mới ra , có_khi nào nhận_diện mặt không xài được vì make_up kĩ quá không 2, S đua lại đây Những thay_đổi lớn trên iphone_x đủ để bạn phải thốt lên rằng nó quá đẹp 2, Iphone_Mùa_Này_Không_Như Ý , Đã buồn rồi Bị_Bơ còn buồn hơn gấp trăm lần Chắc hết giá_trị rồi 2, anh_em chuan bi thoi nhi iphone_8 , iphone_8 plus , iphone_8X danh_gia overview 2,iphone chủ_nhật ra rồi mà kinh_tế vẫn buồn lắm
2, Những thay_đổi lớn trên iphone_x đủ để bạn phải thốt lên rằng nó quá đẹp 2, Nupakachi Những thay_đổi lớn trên iphone_x đủ để bạn phải thốt lên rằng nó quá đẹp 2, trải_nghiệm iphone_x , sáT_Thủ nguy_hiểm nhất của Apple 2,Hình_như iphone_8 chỉ làm nền cho iphone_x
2,Nghe_nói vuốt và mở khoá màn_hình trên iphone_x đã lắm Giờ vuốt đỡ con này tập làm_quen trước đợi hàng zìa
2,Thèm ip 8plus iphone_x qá phải túc_trực đứng mọi nẻo đường để kiếm ip thâu crazy
2, Lê_Thị_Giang Những thay_đổi lớn trên iphone_x đủ để bạn phải thốt lên rằng nó quá đẹp 2,Muốn iphone_sex
2,Sau khi coi màn iphone_x thì tôi có 2 câu_hỏi 1 Ví_dụ bạn đi ngủ mà mấy thằng bạn lầy nó lấy ip X của bạn để trước mặt bạn thì nó unlock được điện_thoại để đăng mấy stt md lên FB 1 cách ez Như v có gọi_là bảo_mật cao không 2 Apple mới ra ip 8 thôi còn ip 9 đâu cmnr mà lên tới ip X vại
2,Cày tiền thôi Máy sắp hỏng zồi Đạ T_Be Tuyvan Siêu phẩm iphone_x đầu_tiên trên thế_giới
2,iphone_7 32G may moi kich hoat chua được 2 tuan apple bao hanh 23 8 2018 gia 16500 2, Diệu_Hiền Những thay_đổi lớn trên iphone_x đủ để bạn phải thốt lên rằng nó quá đẹp to the album iphone with Thiệnx_Sôkiuu and 14 others
2,Gặp ngay quả khách bực hết cả mình Trong lúc bực_mình đập ngay cái điện_thoại của người_ta Phải đền ngay quả iphone_8x annoyed
2,Nghe iphone_8 mới ra là đập bể luônkkk
2, Bầu_Kiên ngồi_tù , vợ_chồng vẫn thu về hàng trăm tỷ đồng nhờ cổ_phiếu ACB Quote Originally_Posted by iphone_x Klq , ahihi bầu Kiên ơi , anh trong tù nhìn hình này hộc máu mà chết 2, tiền ơi Những thay_đổi lớn trên iphone_x đủ để bạn phải thốt lên rằng nó quá đẹp 2, khi nhà_nhà thèm ịphone , mơ iphone , thì tôi lại mơ về em này 2, Đầu_tiên là iphone_se , giờ lại iphone_x Tóm_lại thằng apple đãng ám_chỉ đến SEX đấy 2,Sáng giờ thấy iphone_x ầm_ầm trên các trang mạng Tôi đăng đỡ em này cho hot thêm vậy 2,ở nhà em đãng sẵn mấy cái này cho iphone hàng in nổi max đẹp ạ chỉ 40k một cái thôi
