2, Share làm động_lực mấy chục năm nữa chị đưa em về Những thay_đổi lớn trên iphone_x đủ để bạn phải thốt lên rằng nó quá đẹp 2, Apple iphone_x thiết_kế mới , màn_hình OLED 5 8 , nhận_dạng khuôn_mặt 3D , không còn Touch ID sao_apple AMOLED ta , không phải ifan nói cái màn này lòe lẹt sao 2, Apple iphone_x thiết_kế mới , màn_hình OLED 5 8 , nhận_dạng khuôn_mặt 3D , không còn Touch ID May quá , em nó không hấp_dẫn như mình nghĩ Vậy_là lại có lý_do để chờ ẻm xuống giá_mà không phải vội 2, Apple iphone_x thiết_kế mới , màn_hình OLED 5 8 , nhận_dạng khuôn_mặt 3D , không còn Touch ID em nghĩ anh Hiệp có_thể đề_xuất Apple tặng cái iphone_x , vì họ lấy ý_tưởng từ anh 2, Apple iphone_x thiết_kế mới , màn_hình OLED 5 8 , nhận_dạng khuôn_mặt 3D , không còn Touch ID Thiết_kế trông cục_mịch vãi ra 2, Apple iphone_x thiết_kế mới , màn_hình OLED 5 8 , nhận_dạng khuôn_mặt 3D , không còn Touch ID bumbum2010 đã nói Còn cái face id thì ăn roi học cả đời ăn roi nó có mở khoá bằng khuôn_mặt tám_đời rồi nhưng_mà đủ sáng mới nhận_diện được , các hãng không đầu_tư cho nó thôi 2, Apple iphone_x thiết_kế mới , màn_hình OLED 5 8 , nhận_dạng khuôn_mặt 3D , không còn Touch ID poiuy1234 đã nói Ngon rồi , đây mới đáng siêu phẩm mong_đợi Apple quá sáng_tạo 2, Apple iphone_x thiết_kế mới , màn_hình OLED 5 8 , nhận_dạng khuôn_mặt 3D , không còn Touch ID Apple đã cho ra một codec video hoàn_toàn mới , hi_vọng chất_lượng codec này ngon , và nếu có_thể thì sẽ được hỗ_trợ rộng_rãi trong trường_hợp yêu_cầu cấu_hình phần_cứng ghi_hình không quá cao 2, Apple iphone_x thiết_kế mới , màn_hình OLED 5 8 , nhận_dạng khuôn_mặt 3D , không còn Touch ID Lấy trộm chỉ cần đến soi mặt cái là mở được nhỉ v 2, Apple iphone_x thiết_kế mới , màn_hình OLED 5 8 , nhận_dạng khuôn_mặt 3D , không còn Touch ID Máy trắng nhưng hình_như mặt trước vẫn đen hết phải không ad Chỗ màn_hình bị khoét mà màu trắng giống mấy cái ảnh rò_rỉ thì đúng là thảm_họa về thiết_kế 2, Apple iphone_x thiết_kế mới , màn_hình OLED 5 8 , nhận_dạng khuôn_mặt 3D , không còn Touch ID CHỨC_NĂNG_TAGE đã có trên ios 11 Apple đã vay_mượn JB rồi đó là điều đáng mừng , Giờ có thêm cái chức_năng Giống thằng RUBIK nữa thì hay tự_động tắt 4G chuyển 2G khi_không bật máy 2, Apple iphone_x thiết_kế mới , màn_hình OLED 5 8 , nhận_dạng khuôn_mặt 3D , không còn Touch ID iphone_x bị khuyếT_Tật màn_hình 2, Apple iphone_x thiết_kế mới , màn_hình OLED 5 8 , nhận_dạng khuôn_mặt 3D , không còn Touch ID brightway79 đã nói em thấy thao_tác vuốt từ dưới lên để tắt ứng_dụng giống con Blackberry em đãng dùng Học_hỏi bb 10 mà hạa 2, Apple iphone_x thiết_kế mới , màn_hình OLED 5 8 , nhận_dạng khuôn_mặt 3D , không còn Touch ID Nhìn cái vụ thử_nghiệm face id sáng nay giống như vụ em Phương_Linh mở s 8 bằng mống mắt tại lễ SS tại VN quá 2, Apple iphone_x thiết_kế mới , màn_hình OLED 5 8 , nhận_dạng khuôn_mặt 3D , không còn Touch ID nguyenqthin đã nói Tưởng những tính_năng này trên android đã là đồ cổ rồi chứ Có trước nhưng chưa phải là tốt nhất 2, Apple iphone_x thiết_kế mới , màn_hình OLED 5 8 , nhận_dạng khuôn_mặt 3D , không còn Touch ID nổ 8 nhái xóa phông anh chứ gì anh cho luôn cam trước xóa phông 2, Apple iphone_x thiết_kế mới , màn_hình OLED 5 8 , nhận_dạng khuôn_mặt 3D , không còn Touch ID Yêu quá đi thôi , cách_mạng thực_sự với Iphone 2, Apple iphone_x thiết_kế mới , màn_hình OLED 5 8 , nhận_dạng khuôn_mặt 3D , không còn Touch ID lúc chơi game mà cái U nhọt nó che như_thế_này coi như nát 2, Apple iphone_x thiết_kế mới , màn_hình OLED 5 8 , nhận_dạng khuôn_mặt 3D , không còn Touch ID nói về unlock bằng face đặt ví_dụ , nếu 1 người đi phẫu_thuật thẩm_mỹ thì ít_nhiều sẽ thay_đổi thậm_chí sẽ bó cả đầu , vậy lúc này ip sẽ phải tắt face id và không an_toàn 2, Apple iphone_x thiết_kế mới , màn_hình OLED 5 8 , nhận_dạng khuôn_mặt 3D , không còn Touch ID Giá IP càng_ngày_càng chát 2, Apple iphone_x thiết_kế mới , màn_hình OLED 5 8 , nhận_dạng khuôn_mặt 3D , không còn Touch ID Đôt biến đấy chứ Mình đánh_giá cao màn oled mới với faceid Còn mục touch thì theo kiểu mấy tweak trên cydia Zephyr 2, Apple iphone_x thiết_kế mới , màn_hình OLED 5 8 , nhận_dạng khuôn_mặt 3D , không còn Touch ID nguyenqthin đã nói Tưởng những tính_năng này trên android đã là đồ cổ rồi chứ Có trước nhưng chưa phải là tốt nhất 2, Apple iphone_x thiết_kế mới , màn_hình OLED 5 8 , nhận_dạng khuôn_mặt 3D , không còn Touch ID minh rất thích cái sạc không dây , sạc được 3 thiết_bị cùng lúc 2, Apple iphone_x thiết_kế mới , màn_hình OLED 5 8 , nhận_dạng khuôn_mặt 3D , không còn Touch ID stalker _ Nomad đã nói nói ít thôi , vừa đàn_bà vừa dốt , nói nhiều làm ô_nhục thế_hệ 92 Ủa 2 người từng quan_hệ sao biết him đàn_bà 2, Apple iphone_x thiết_kế mới , màn_hình OLED 5 8 , nhận_dạng khuôn_mặt 3D , không còn Touch ID wow tất_cả , vẫn trừ cái cụm đen_thôi phía trước 2, Apple iphone_x thiết_kế mới , màn_hình OLED 5 8 , nhận_dạng khuôn_mặt 3D , không còn Touch ID làm cho phần lõm bằng luôn cho_rồi nhìn xấu quá Vuốt đã_nhiệm thì coppy BB10 cũng khá hay 2, Apple iphone_x thiết_kế mới , màn_hình OLED 5 8 , nhận_dạng khuôn_mặt 3D , không còn Touch ID Có cách nào khắc_phục phần màn_hình bị cắt phía trên không nhỉ , nhìn dị quá Viền mỏng sao không làm 665 inch , vẫn đút vừa túi quần mà 2, Apple iphone_x thiết_kế mới , màn_hình OLED 5 8 , nhận_dạng khuôn_mặt 3D , không còn Touch ID 2 quả thận đủ không các bác 2, Apple iphone_x thiết_kế mới , màn_hình OLED 5 8 , nhận_dạng khuôn_mặt 3D , không còn Touch ID Kể mà cái cạnh của nó sắc nét như 5 , 5S , SE thì không còn gì để chê nữa sao mình không thích kiểu bo tròn này thế , thấy nó yếu yếu_thế nào ấy 2, Apple iphone_x thiết_kế mới , màn_hình OLED 5 8 , nhận_dạng khuôn_mặt 3D , không còn Touch ID trieutuan _ vnu đã nói Đây là tương_lai của smartphone Vcl cuồng sheep 2, Apple iphone_x thiết_kế mới , màn_hình OLED 5 8 , nhận_dạng khuôn_mặt 3D , không còn Touch ID dark _ baron41 đã nói không ai vỗ_tay Cho cái lí_do để vỗ_tay an_ủi coi 2, Apple iphone_x thiết_kế mới , màn_hình OLED 5 8 , nhận_dạng khuôn_mặt 3D , không còn Touch ID Nhìn_chung chỉ ẩn cái nút home , giá quá cao công_nghệ chưa xứng tầm top cầm 1 tay khó xử dụng hết chức_năng 2, Apple iphone_x thiết_kế mới , màn_hình OLED 5 8 , nhận_dạng khuôn_mặt 3D , không còn Touch ID Ai camera đúng CHẤT là đây 2, Apple iphone_x thiết_kế mới , màn_hình OLED 5 8 , nhận_dạng khuôn_mặt 3D , không còn Touch ID càng ngày em càng thấy nể mấy bác tung tin_đồn giờ đến ngày là hầu_như biết hết rồi 2, Apple iphone_x thiết_kế mới , màn_hình OLED 5 8 , nhận_dạng khuôn_mặt 3D , không còn Touch ID iphone_x này về VN chắc giá bằng con AB2016 quá 2, Apple iphone_x thiết_kế mới , màn_hình OLED 5 8 , nhận_dạng khuôn_mặt 3D , không còn Touch ID Phần hiển_thị cột sóng và pin để âm_bản thì ngon , theo cá_nhân mình 2, Apple iphone_x thiết_kế mới , màn_hình OLED 5 8 , nhận_dạng khuôn_mặt 3D , không còn Touch ID nếu có steve job chắc không cho làm màn_hình chữ U đâu , nhìn dọc thì cũng đẹp đẹp nhưng xem phim hoặc game full màn_hình xoay ngang thì bị tèo nặng 2, Apple iphone_x thiết_kế mới , màn_hình OLED 5 8 , nhận_dạng khuôn_mặt 3D , không còn Touch ID Thao_tác vuốt sướng tay đó làm mình nhớ lại BB10 2, Apple iphone_x thiết_kế mới , màn_hình OLED 5 8 , nhận_dạng khuôn_mặt 3D , không còn Touch ID Vuốt_vuốt , ôi giống N9 quá 2, Apple iphone_x thiết_kế mới , màn_hình OLED 5 8 , nhận_dạng khuôn_mặt 3D , không còn Touch ID Nghe đến pin cái hụt hẵn 2, Apple iphone_x thiết_kế mới , màn_hình OLED 5 8 , nhận_dạng khuôn_mặt 3D , không còn Touch ID sao không ráng làm camera sau nhìn đẹp hơn tý nữa nhỉ 2, Apple iphone_x thiết_kế mới , màn_hình OLED 5 8 , nhận_dạng khuôn_mặt 3D , không còn Touch ID Anchelsea1211 đã nói iphone_8 8 plus là theo chu_kỳ trước đó của nó rồi Theo chu_kì kinh thì_phải là 7s và 7s plus nhé Mà kệ đi thích đặt tên gì chả được 2,cày tiền đi ah em ra rồi đấy Apple 革 新 に 満 ち た Apple の 世 界 へ よ う こ そ Apple の ウ ェ ブ サ イ ト で は iphone か ら iPadApple WatchMacApple TVま で す べ て の 製 品 の 購 入 が で き ま す ア ク セ サ リ や エ ン タ ー テ イ ン メ ン ト を 探 す 時 も 専 任 ス ペ シ ャ リ ス ト に よ る デ バ イ ス の サ ポ ー ト が 必 要 な 時 も こ の サ イ ト で ど う ぞ
2,Fb hôm_nay là ngày của iphone_x
2, Giờ biết phải làm_sao chọn đây Những thay_đổi lớn trên iphone_x đủ để bạn phải thốt lên rằng nó quá đẹp 2,Vâng iphone_10 giá 49 triệu 990k Timcook bảo là iphone không_chỉ dành cho người giàu
2, Phạm_Huy_Nam_Cường Những thay_đổi lớn trên iphone_x đủ để bạn phải thốt lên rằng nó quá đẹp 2, Siêu phẩm ngàn đô Những thay_đổi lớn trên iphone_x đủ để bạn phải thốt lên rằng nó quá đẹp 2, Những thay_đổi lớn trên iphone_x đủ để bạn phải thốt lên rằng nó quá đẹp 2,Cần đặt gia_công mặt kính lưng cho iphone_7 plus 2, Vũ_Thành_Chung Những thay_đổi lớn trên iphone_x đủ để bạn phải thốt lên rằng nó quá đẹp 2, Hana_Nguyen Những thay_đổi lớn trên iphone_x đủ để bạn phải thốt lên rằng nó quá đẹp 2, Muk_Vu Những thay_đổi lớn trên iphone_x đủ để bạn phải thốt lên rằng nó quá đẹp 2, Hana_Nguyen Những thay_đổi lớn trên iphone_x đủ để bạn phải thốt lên rằng nó quá đẹp 2, Siêu phẩm là đây Những thay_đổi lớn trên iphone_x đủ để bạn phải thốt lên rằng nó quá đẹp 2, Những thay_đổi lớn trên iphone_x đủ để bạn phải thốt lên rằng nó quá đẹp 2,Cáp sạc điện_thoại iphone Giá35k
2, Bich_Vu_Ngoc Những thay_đổi lớn trên iphone_x đủ để bạn phải thốt lên rằng nó quá đẹp 2, Bao tháng_ngày sml to the album Ốp iphone siêu xinh 2, Địa_điểm ăn_uống Fan nhà Táo đâu chuẩn_bị tiền hốt mí ẻm thôi nè iphone_8 8 Plus , iphone_x IPHONE8 iPHONEX TEAMTAO Nguồn_Kênh 14 2,iphone_x vàng đồng hạp mạngtrời ơi trời sáng mở_mắt ra nhức đầu ghê
2, đẹp xuất_sắc Ai tích đủ tiền để rước em nó về rồi điểm_danh nào 3 Những thay_đổi lớn trên iphone_x đủ để bạn phải thốt lên rằng nó quá đẹp 2,Ai cũng tập_trung vào iphone Mai em xách tay về ít điện_thoại nhật Chống nước giá chỉ 1500000
2, Nhận_Oder iphone_8 8 Tại_Mỹ Ai có nhu_cầu liên_hệ 410 có_mặt tại VN Sắp tới có về vài cây 8 Giá 23,300,000 đ 2,Tổng_quan về iphone_x_Giá tính bằng thận
2, Nu_Lê Những thay_đổi lớn trên iphone_x đủ để bạn phải thốt lên rằng nó quá đẹp 2, Oà Những thay_đổi lớn trên iphone_x đủ để bạn phải thốt lên rằng nó quá đẹp 2, Long_Thành Những thay_đổi lớn trên iphone_x đủ để bạn phải thốt lên rằng nó quá đẹp 2, Saiu o iphone_x em eu já tô colocando a venda os órgãos , vamo aproveita que o pre ç o da lingui ç a aumentou 2, Troi ôiiii Những thay_đổi lớn trên iphone_x đủ để bạn phải thốt lên rằng nó quá đẹp 2, Chiến_Nguyễn Những thay_đổi lớn trên iphone_x đủ để bạn phải thốt lên rằng nó quá đẹp 2, Trời đẹp quá Những thay_đổi lớn trên iphone_x đủ để bạn phải thốt lên rằng nó quá đẹp 2, Hằng_Thúy Những thay_đổi lớn trên iphone_x đủ để bạn phải thốt lên rằng nó quá đẹp 2,IPHONE_X đẹp không_thể chê
2, ĐD Đặng Những thay_đổi lớn trên iphone_x đủ để bạn phải thốt lên rằng nó quá đẹp 2,Tôi like hết mấy cái post nào đề_cập đến iphone_x_Lol Fall in love with the x newfancyiphone mànhình trànbờđê
2,Gửi về cho tao 1 cái iphone_x ngay mau Kin_Loc Ps m có ké không Anh Duy
2, Chung nao em no ve doi cua minh day ta Những thay_đổi lớn trên iphone_x đủ để bạn phải thốt lên rằng nó quá đẹp 2,Hóng iphone_se thôi
2, Mần cấy hè Những thay_đổi lớn trên iphone_x đủ để bạn phải thốt lên rằng nó quá đẹp 2, Những thay_đổi lớn trên iphone_x đủ để bạn phải thốt lên rằng nó quá đẹp 2, Những thay_đổi lớn trên iphone_x đủ để bạn phải thốt lên rằng nó quá đẹp 2,Ngập_tràn newfeed sáng nay là iphone_x dự_đoán con này về Vn_Bèo bèo cũng 40 củ
2, Đỉnh thực_sự Những thay_đổi lớn trên iphone_x đủ để bạn phải thốt lên rằng nó quá đẹp 2, Úi dời Những thay_đổi lớn trên iphone_x đủ để bạn phải thốt lên rằng nó quá đẹp 2, Ngày_càng giống sam sung Những thay_đổi lớn trên iphone_x đủ để bạn phải thốt lên rằng nó quá đẹp 2,iphone_8x chuẩn bi ra đơi mình lại phải chia_tay em iphone_7lpus 128GB nay mới 97 ai có nhiêu câu đặt gạch nhé
2, Trang_Tâys Những thay_đổi lớn trên iphone_x đủ để bạn phải thốt lên rằng nó quá đẹp 2, Ô_mai gót Hoa_Hải Những thay_đổi lớn trên iphone_x đủ để bạn phải thốt lên rằng nó quá đẹp 2,Nói_gì về iphone_8 iphone_x
2,iphone tám chưa có thì chiến i OS mười_một đi anh_em Rất phê nhất_là i Pad
2, Đinh_Tưn Những thay_đổi lớn trên iphone_x đủ để bạn phải thốt lên rằng nó quá đẹp 2, Những thay_đổi lớn trên iphone_x đủ để bạn phải thốt lên rằng nó quá đẹp 2, Su_Su Những thay_đổi lớn trên iphone_x đủ để bạn phải thốt lên rằng nó quá đẹp 2, Đặng_Thịnh Những thay_đổi lớn trên iphone_x đủ để bạn phải thốt lên rằng nó quá đẹp 2,Mặn vãi Ngất_ngây với iphone_x siêu phẩm của những siêu phẩm Không phải là iphone_8 hay 8 plus mà chính iphone_x mới là sản_phẩm được trông_đợi nhất ở buổi vào rạng sáng nay
2, Ai đổi iphone_x không ạh , mới chụp x_quang còn đủ 2 quả 2, Apple Iphone , bọn lởm này xào kịch_bản của anh Quảng tôi , hihi May_mà tôi đã ghi lại được làm bằng_cớ iphone_8 tuổi tôm so với Bphone à khà_khà 2, O Những thay_đổi lớn trên iphone_x đủ để bạn phải thốt lên rằng nó quá đẹp 2,iphone_8 va 8 Plus
2, Diệu_Ngọc_Diệu Những thay_đổi lớn trên iphone_x đủ để bạn phải thốt lên rằng nó quá đẹp 2, iphone_x giới_thiệu rồi , gôm thóc thôi biết_đâu lúc đó 4Gs lại giảm_giá thêm ahihi 2, Giá_như bố_mẹ hiểu và thương em 2,iphone_x đã quấy
2, X ơi Anh thích em mất roài Những thay_đổi lớn trên iphone_x đủ để bạn phải thốt lên rằng nó quá đẹp 2,Sáng ngủ dậy thấy tràn_lan nhận_xét với oder iphone thế_hệ mới Em chỉ quan_tâm liệu rằng màn Oled nó sẽ được ép kính như_thế_nào và sẽ phải đền bao_nhiêu cái đây
2, iphone_x trắc trết Những thay_đổi lớn trên iphone_x đủ để bạn phải thốt lên rằng nó quá đẹp 2,Nói_chung thì iphone thế_hệ kì này chả khác_gì so với thông_tin bị lộ Thực_sự mà nói thì hình_như cái gì nó có thì chỉ là đi_sau không gì hot thôi_thì sài cùi mía cho chắc
2, đẹp thế Những thay_đổi lớn trên iphone_x đủ để bạn phải thốt lên rằng nó quá đẹp 2,Này thì iphone_8 không khác_gì cái 7 với 7 iphone_x mới là đẹp ngất cmn ngư
2, Bạn nào có ý_định chuẩn_bị sài iphone_x thì cần chú_ý là khi bị cướp , bọn cướp sẻ chặc đầu bạn để mở khoá nhận_diện khuôn_mặt đó 2,Dậy thôi lũ voz bần_nông Đêm coi iphone_x giờ hơi phê Sent from Samsung SMT285 using voz FApp
2, Bh có mặt tại store VN vạiii Những thay_đổi lớn trên iphone_x đủ để bạn phải thốt lên rằng nó quá đẹp 2, Công_thức tungsanpham là đây 3 thậT_Tình cũng muốn đua_đòi D Những thay_đổi lớn trên iphone_x đủ để bạn phải thốt lên rằng nó quá đẹp 2, Vũ_Anh_Bin Những thay_đổi lớn trên iphone_x đủ để bạn phải thốt lên rằng nó quá đẹp 2, HenNi Nguyễn Những thay_đổi lớn trên iphone_x đủ để bạn phải thốt lên rằng nó quá đẹp 2, CAMERA_YOOSEE , KÍCH_SÓNG_WIFI , DÂY_CHUYÊN_ĐỔI_IPHONE_SANG_TIVI , BỘ_PHÁT_WIFI_VỀ_NHIỀU được129 lương văn can Tp_Huế được258 dương văn an Tp_Huế LH 2, Ố ồ Những thay_đổi lớn trên iphone_x đủ để bạn phải thốt lên rằng nó quá đẹp 2, Lucia_Hong_Nguyen Những thay_đổi lớn trên iphone_x đủ để bạn phải thốt lên rằng nó quá đẹp 2,bản iphone_x đặc_biệt và cũng kén người dùng vì giá khá cao nên Apple sẽ dè_chừng thăm_dò thị_trường với iphone_8 và 8plus
2, đẹp gáiii qá dị Những thay_đổi lớn trên iphone_x đủ để bạn phải thốt lên rằng nó quá đẹp 2,Thế_này có chết tôi không Mất_ngủ vì mày iphone_x an early first look apple future iphone arrives in November
2, Những thay_đổi lớn trên iphone_x đủ để bạn phải thốt lên rằng nó quá đẹp 2, Nguyễn_Ngọc_Ánh Những thay_đổi lớn trên iphone_x đủ để bạn phải thốt lên rằng nó quá đẹp 2, iphone_6 quốc_tế 16gb , bỏ sim vô là dùng , máy nguyên zin , máy không lỗi_lầm , full chức_năng , không lỗi_lầm Giá 5 triệu 3 Bao test 7 ngày 2, Cà_Phê_Sữa Những thay_đổi lớn trên iphone_x đủ để bạn phải thốt lên rằng nó quá đẹp 2,má ơi iphone_x đập chai quá
2,vừa mất điện_thoại là iphone_x ra liền giờ sao ta
2,Hoà_Nguyen shared Architecture_Designs video Architecture_Design apple iphone_x_Ten_Years_After_The_Launch of The_First iphone ᴷ ᴬ No_Home_Button Scans_Your_Face Costs 999 Video_Credit CNN Tech
2, Apple iphone_x thiết_kế mới , màn_hình OLED 5 8 , nhận_dạng khuôn_mặt 3D , không còn Touch ID sáng ra đọc cái giá cellphone S 50 củ tỉnh cả người 2, Apple iphone_x thiết_kế mới , màn_hình OLED 5 8 , nhận_dạng khuôn_mặt 3D , không còn Touch ID Cái giá thật đáng mong_đợi cho siêu phẩm , người_ta đi đầu nên có quyền ra giá , các hãng khác phải ăn_theo lối mòn thôi 2, Apple iphone_x thiết_kế mới , màn_hình OLED 5 8 , nhận_dạng khuôn_mặt 3D , không còn Touch ID Mặt trước mà làm dải loa và cảm_biến siêu_âm như mi mix 2 thì nhìn tuyệt_vời Mặt sau nhìn buồn , lởm thật không biết nói sao luôn 2, Apple iphone_x thiết_kế mới , màn_hình OLED 5 8 , nhận_dạng khuôn_mặt 3D , không còn Touch ID lhn đã nói Nhận_diện gương_mặt không tốt cho bảo_mật Khi bị bắt phải mở máy mà là con_tin thì chỉ cần dí vào mặt là máy mở trong trường_hợp đấy thì kể_cả touch id cũng vậy thôi 2, Apple iphone_x thiết_kế mới , màn_hình OLED 5 8 , nhận_dạng khuôn_mặt 3D , không còn Touch ID khoa471989 đã nói Đọc bình_luận thấy dân Vn ngu vãi Mày thấy mày ngu thì đúng rồi Chứ dân vn đéo ngu nhá 2, Apple iphone_x thiết_kế mới , màn_hình OLED 5 8 , nhận_dạng khuôn_mặt 3D , không còn Touch ID Mặt trước mà làm dải loa và cảm_biến siêu_âm như mi mix 2 thì nhìn tuyệt_vời Mặt sau nhìn buồn , lởm thật không biết nói sao luôn 2, Apple iphone_x thiết_kế mới , màn_hình OLED 5 8 , nhận_dạng khuôn_mặt 3D , không còn Touch ID zTommyDoz đã nói Aniemoji hay_hay Nó mắc_cười á 2, Apple iphone_x thiết_kế mới , màn_hình OLED 5 8 , nhận_dạng khuôn_mặt 3D , không còn Touch ID trieutuan _ vnu đã nói Đây là tương_lai của smartphone Có thấy gì đâu mà gọi_là tương_lai 2, Cherry_Diễm Những thay_đổi lớn trên iphone_x đủ để bạn phải thốt lên rằng nó quá đẹp 2, Mỹ_Phương Những thay_đổi lớn trên iphone_x đủ để bạn phải thốt lên rằng nó quá đẹp 2,iphone_8 iphone_x Chuẩn_bị cày còng lưng
2, đẹp quá Thận còn 2 Trái Những thay_đổi lớn trên iphone_x đủ để bạn phải thốt lên rằng nó quá đẹp 2, Sáng ngủ dạy mà quặn lòng Những thay_đổi lớn trên iphone_x đủ để bạn phải thốt lên rằng nó quá đẹp 2, Pốp_Py_Fes Những thay_đổi lớn trên iphone_x đủ để bạn phải thốt lên rằng nó quá đẹp 2, Với việc bỏ Touch ID trên iphone_x , chị_em ninja lead đi đường rất không thích điều này 2, Nguyen_Tuan_Anh Những thay_đổi lớn trên iphone_x đủ để bạn phải thốt lên rằng nó quá đẹp 2,iphone_x đẹp quá bây Mê quá mê quá em phải nàm thao
2,Gom bạc dần kiếm con iphone_x nào P
2, Mới than nghèo đêm qua , mà giờ viết stt khen iphone_x , iphone_8 sợ chúng chửi đua_đòi 2, chia_tay Những hình_ảnh đầu_tiên về iphone_x iphone_x sở_hữu màn_hình OLED 5,8 inch tràn viền , hai mặt kính như thời iphone 4 và trang_bị sạc không dây 2, Nguyễn_Tuấn_Hưng Những thay_đổi lớn trên iphone_x đủ để bạn phải thốt lên rằng nó quá đẹp 2, Con_Cám Những thay_đổi lớn trên iphone_x đủ để bạn phải thốt lên rằng nó quá đẹp 2, Bjo mới được dùng nó nhỉ Những thay_đổi lớn trên iphone_x đủ để bạn phải thốt lên rằng nó quá đẹp 2,Đợi đến tháng 11 làm con iphone_10 vậy Nhìn đã mê rồi 2, Nguyen_Manh_Quan Những thay_đổi lớn trên iphone_x đủ để bạn phải thốt lên rằng nó quá đẹp 2, Như_Quỳnh Những thay_đổi lớn trên iphone_x đủ để bạn phải thốt lên rằng nó quá đẹp 2, Ng_Thuy Anh Những thay_đổi lớn trên iphone_x đủ để bạn phải thốt lên rằng nó quá đẹp 2,Mở_mắt ra đầy iphone phát sợ
2,Có_thể các mày chưa biết iphone_se iphone_x_SEX Xoạc thôi
đẹp vãi nồi Thôi đẹp đi
2, Đinh_Phương_Anh Những thay_đổi lớn trên iphone_x đủ để bạn phải thốt lên rằng nó quá đẹp 2, Tuyệt_phẩm ip 8 to the album Phụ_kiện iphone
2,iphone_8 xấu vãi
2, Có ai có_thể đập vào mặt mình iphone_x không Những thay_đổi lớn trên iphone_x đủ để bạn phải thốt lên rằng nó quá đẹp 2, Gom lúa được rồi Uyên_Đổng_Tố _ Những thay_đổi lớn trên iphone_x đủ để bạn phải thốt lên rằng nó quá đẹp 2, Nguyễn_Ngọc_minh_Phương Những thay_đổi lớn trên iphone_x đủ để bạn phải thốt lên rằng nó quá đẹp 2, haiz Những thay_đổi lớn trên iphone_x đủ để bạn phải thốt lên rằng nó quá đẹp 2, Trường_Giang_Phan Những thay_đổi lớn trên iphone_x đủ để bạn phải thốt lên rằng nó quá đẹp 2, đẹp quá Những thay_đổi lớn trên iphone_x đủ để bạn phải thốt lên rằng nó quá đẹp 2,Chát iphone_x như_thế_nào khi_không có nút Home cứng và TouchID Chi_tiết về video trong bài viết 2, X Những thay_đổi lớn trên iphone_x đủ để bạn phải thốt lên rằng nó quá đẹp 2,iphone_xấu lắm thành à quên nó đi
