1,Anh_em BlackBerry đang rất sướng vì cảm_giác được trải_nghiệm iphone X trước thiên_hạ gần chục năm
1," Đam_mê chưa bao_giờ tắt Nhận sửa_chữa tất_cả các bệnh của iphone , ipad Giá tốt nhất Lh 01686263263 "
1," Nghèo lắm rồi các anh các chị đừng post gì liên_quan đến iphone đi mà , làm_ơn làm_ơn Đỗ_Quang_Đạt was feeling down "
1," Hà_Định shared Đại_Kỷ_Nguyêns post Đại_Kỷ_Nguyên . iphone 8 ra_mắt thị_trường , tính_năng mới độc_quyền và mạnh_mẽ "
1,T k hút thúc 24 năm mak củng k có nổi iphone 3 mà dùng chứ nói j iphone 8vậy nên ai hút cứ hút đuê haha
1," Ai dắt bà Mị này đi chơi đi , . Via_Linh_Tong . , . Tham_gia group để thảo_luận và cập nhập tình_hình iphone X nhé "
1,Iphone X ra là tậu liền thôi haaa . ae nào hóng X điểm_danh nào
1,IPhone x cũng đánh giấu 10 năm mình xài IP nhưng vẫn cảm_thấy ko thoả_mãn như hồi trc Tuan_Cat was feeling down
1,Sẽ cố_gắng Heorom_Pokm shared Trần_Liên_Hươngs post Trần . Dù nợ ngập_đầu . . Nhưng vẫn cố_gắng yêu anh_ấy
1,Thanh li iphone 5s Photos from Thanh_Từs post
1,Muốn có iphone 8 không khó Timeline_Photos
1," Theo cơn_sốt Iphone các bạn ạ . . Iphone X 64Gb , iphoneX 256 G , Iphone8 , Iphone8Plus "
1,Những cách thanh_toán để sỡ hữu dòng Iphone vừa ra_mắt
1,Giá cổ_phiếu Apple giảm nhẹ còn 160 sau khi ra_mắt iphone X . . vãi cỡ 7 lần gdp việ nam
1," Đặt gạch cái nhợ Phan_Ngọc_Oanh shared Đại_Kỷ_Nguyêns post Đại_Kỷ_Nguyên . iphone 8 ra_mắt thị_trường , tính_năng mới độc_quyền và mạnh_mẽ "
1," Trong sự_kiện vừa được tổ_chức , Apple đã chính_thức công_khai khẳng_định Sài_Morris_Motley còn sướng hơn cả cầm Iphone X . . Các fan tóc_tai có cảm_thấy đúng không nè "
1,éo biết iphone 8 có nhận_diện được nhồn ko nhỉ v . . via get highhh
1,Ngồi nhà_ăn cơm và lướt facebook xem mọi người bàn_luận chuyện iphone x Cũng vui chứ
1,Con cũng muốn có Iphone X để xài cho sành_điệu cô_chú ơi Làm_ơn chỉ cho con kiếm đâu ra tiền để tậu nó đây
1,Ước gì có ngưòi tặng iphone X
1,Và thế iphone 8 đã được ra_mắt
1,Em có 3 tai_nghe rin bóc máy chính hãng FTP dành cho iphone 7 Giá 700k cái Ace muốn xài đồ rin xin đừng mặc_cả về giá
1," Iphone X đẹp quá , có mục_tiêu để kiếm tiền thật nhiều rồi "
1,Iphone X là iphone mang tên_chữ cái đầu của mình Apple ưu_ái quá còn chuẩn_bị gửi riêng cho mình 1 cái rồi Ngọc_Xim was feeling excited
1,Apple ra_mắt Iphone X nhằm nhiệt_liệt chào_mừng sinh_nhật lần thứ 20 của Diên vào tháng 10 Ôi thật cảm_động rưng_rưng
1,Ư ư Nhìn_Iphone X cả 8 vừa ra_mắt anh_em fan Táo có thấy rạo_rực khôngg
1," E quá đẹp iphone X đây rồi . Các fan của Apple một lần nữa lại được dịp phấn_khích bởi những hình_ảnh được cho là iphone X bất_ngờ phủ_sóng trên mạng , chỉ vài giờ trước sự_kiện ra_mắt chính_thức "
1,Newf tràn_ngập iphone X mình có nên suy_nghĩ 1 cái gì xa_vời k nhỉ
1,Iphone X và anh_em chọn đi 3
1,Những cách thanh_toán để sỡ hữu dòng Iphone vừa ra_mắt
1,Iphone se iphone x iporn
1,Siêu phẩm Iphone X ra_mắt rồi chuẩn_bị gom lúa lụm 7 pờ lếch thôi kakaka
1,VNE Mỹ đề_xuất thả 25 triệu iphone xuống Triều_Tiên . . biết_đâu 1 ngày lên tinhte dc xem clip trên tay iphone phiên_bản đặc_biệt dành cho Triều_Tiên
1," VNE Mỹ đề_xuất thả 25 triệu iphone xuống Triều_Tiên . . Đấy tả con IP_X ấy , 1000 x25 triệu 25 tỷ trump tệ "
1,Iphone 8 đã xuất_hiện dự là sẽ có nhiều em ngon ngon đau háng lắm đây . Hiện_tại mình cũng nhận và chấp_nhận đau lỗ nhị ai có nhu_cầu liên_hệ 300 bao phòng nhé
1,Iphone X chính_thức ra_mắt nha bà_con
1," Hóng iphone X đặt lên má bạn , chắc bạn thích lắm "
1,Theo dòng sự_kiện Apple ra_mắt Iphone X với công_chúng 3 . . Cre_Group_Buê_Đuê_Lỡ_Làm_Tràn_Đê
1," Phải nói là Apple đi nước cờ sâu quá là sâu , đảm_bảo lượng tiêu_thụ iphone x giai_đoạn đầu 70 , Iphone 8 là 30 , sau 1 năm phiên_bản x là 100 , vận_động thu_gom Iphone 8 và ném xuống Triều_Tiên ccmnl "
1," Iphone 8 sắp ra rồi , năm nay cố_gắng tậu em nó về mới đckakaka "
1,Hướng_dẫn unlock iphone ATT miễn_phí cho máy clean imei . . bác ơi của e check đều ra att clean nhưng chưa unlock đc Bác xem giúp e với . imei 353819085855738 iphone 7 plus . Model MNQL2LLA . Cảm_ơn bác rất nhiều
1,Nhiều người dự_định tặng Iphone X cho mình quá
1,VNE Mỹ đề_xuất thả 25 triệu iphone xuống Triều_Tiên . . cách này ngon nè . hóng ủn bắn tên_lửa diệt vệ_tinh
1,Bảng tin hôm_nay toàn tin iphone 8X . Khổ_nỗi . Yêu em nhưng không với tới
1," Pồ shared Iphone chính hãng giá rẻs post Iphone chính hãng giá rẻ . Ơ , thằng trẻ trâu này "
1,Iphone x ra rồi có ai chán 7plus 128 đen nhám máy đẹp 98 giá tốt ibox e đi
1,iphone X và những tính_năng thời_thượng HOT nhất Vietsub . iphone X nổi_bật với màn_hình vô_cực và tính_năng FaceID nhận_diện khuôn_mặt mới của Apple
1,Thôi lại chăm_chỉ cày_cuốc kiếm con Iphone_Xoạc thôiiiiii
1,Giá cổ_phiếu Apple giảm nhẹ còn 160 sau khi ra_mắt iphone X . . ko ảnh_hưởng gì
1,iphone x có_giá khởi_điểm là 34 củ thật hay đùa
1,Iphone 8 ra rồi Iwatch có giảm_giá không
1," Sau khi kiểm_tra , mình thay Iphone4 tốt hơn nhiều so với iphone 8 , vì_vậy mình quyết_định xài iphone 5 "
1," Trên tay iphone X , 2 màu đen và trắng Thiên_Ân added 2 new videos with Ân_Võ "
1,Mình ko thích mn share video và hình_ảnh về iphone mới đâu nhé
1," Chọn iphone 8 cũng được anh_em ạ Vừa tầm tiền , cấu_hình tạm ổn v "
1," Phạm_Nguyên shared Đại_Kỷ_Nguyêns post Đại_Kỷ_Nguyên . iphone 8 ra_mắt thị_trường , tính_năng mới độc_quyền và mạnh_mẽ "
1,Sag triêu tiên xin iphone nay Thắng_Bùi shared Đại_Kỷ_Nguyêns post Đại_Kỷ_Nguyên . Một cựu đặc_nhiệm hải_quân Mỹ đưa ra sáng_kiến bất_ngờ để giải_quyết khủng_hoảng Triều_Tiên
1,Bảng đánh_giá mới nhất của các chuyên_gia . Iphone X
1,Ốp Spigen bên này rẻ bằng nửa Việt_Nam rùiii Nhưng_mà lo_lắng iphone X quá ko biết nên thay ốp mới ko Cũng 500k hic
1," Quất thôi Ly_Hany shared Đại_Kỷ_Nguyêns post Đại_Kỷ_Nguyên . iphone 8 ra_mắt thị_trường , tính_năng mới độc_quyền và mạnh_mẽ "
1,iphone X_Thần đèn toát mồ_hôi hột vì iphone X
1," Bữa_nay là đại_tiệc Iphone_Xmở FB tưởng lạc dzô wed iphone k chứhihi . Sạc không dây , màn_hình tràn cạnh Samsung cũng có trước rồi màmấy chế làm quá hàlàm em nôn theo mún chớt dzị á Minh_Thư was feeling nôn_nao "
1," Giá cổ_phiếu Apple giảm nhẹ còn 160 sau khi ra_mắt iphone X . . 7 bỏ 35 , 8 bỏ vân tay , 9 bỏ sim và 10 bỏ cổng sạc "
1,Giá cổ_phiếu Apple giảm nhẹ còn 160 sau khi ra_mắt iphone X . . Mọi người cứ chế chứ Xấu đẹp thfi các hãng cũng copy theo Vụ face ID này có_vẻ hay
1," Ai dùng iphone 5s , ib mk mk nhờ chuyện "
1,Chọn con tim hay_là nghe lí_trí . Chọn em thôi không chọn iphone X nha
1,Iphone X 1000 dola of toi dang hóng tung ngay ve viet namco ai hong cung ko a
1,Bọn trẻ danh bây_giờ ngoài iphone ra thì không ham cái gì cả
1," Chẳng cần món quà gì to_tát đâu , ai đó tặng iphone X là mình vui lắm rồi "
1," Giá cổ_phiếu Apple giảm nhẹ còn 160 sau khi ra_mắt iphone X . . ngoại_trừ cái thiết_kế thì cái thích nhất_là ar , cái này samsung không bằng và cũng chả ai bằng cả Apple đang dẫn_đầu cái phần này "
1,2 lần là đủ con Iphone X
1,IPhone X_Các thẩm_mỹ_viện và các trung_tâm phẫu_thuật thẩm_mỹ sẽ rất KHÔNG_THÍCH_RỒI
1,Cái câu này đúng nè ghét của nào trời trao của đó Chắc mai_mốt có ghét sang chút iphone 8
1,Sau khi iphone x ra_mắt các nhà_sản_xuất quyết_định không lấy hình quả táo để làm thương_hiệu nữa mà sẽ đổi thành_quả thận
1,Đồng_ý làm vk anh nhé anh tặng iphone X
1," Nghe bảo iphone X đẹp lắm , cố cày thôi . Grab . đùachútthôi "
1,Xem iphone x thật thú_vị
1,Ai đó đã săn được em nó chưa . Lung_linh là lên luôn ạ . iphone apple
1,Giá cổ_phiếu Apple giảm nhẹ còn 160 sau khi ra_mắt iphone X . . Một_chút giảm nhẹ để chuẩn_bị tăng phi_mã
1,Giá cổ_phiếu Apple giảm nhẹ còn 160 sau khi ra_mắt iphone X . . nhìn cái biểu_đồ thì khó mà đi xuống được lắm Chắc_chắn iphone X sẽ mang lại kết_quả kinh_doanh tốt cho Apple và ảnh_hưởng lớn đến thế_giới công_nghệ Nhát là QI và Face ID
1,Giá cổ_phiếu Apple giảm nhẹ còn 160 sau khi ra_mắt iphone X . . Vâng_Apple vạn_tuế vạn_tuế vạn vạn_tuế
1,Giá cổ_phiếu Apple giảm nhẹ còn 160 sau khi ra_mắt iphone X . . gdp việt nam 600 tỷ usd mà
1,Giá cổ_phiếu Apple giảm nhẹ còn 160 sau khi ra_mắt iphone X . . soncon _ cuchuoi9x . . . . tuansangnguyen xem_lại đi iphone x mới là iphone chính lần này ra_mắt . còn bản 8 với 8plus chỉ dc coi như 7s thôi
1," Giá cổ_phiếu Apple giảm nhẹ còn 160 sau khi ra_mắt iphone X . . rickyvietnam . . . . killed Dấu vân tay dở_ẹc , nhiều lúc mãi không vào được buộc phải nhập password , về cái khoản vân tay này , iphone thua samsungg xa , Samsung vân tay bấm cái nào ăn cái ấy liền , rất ít khi_không mở được bằng vân tay "
1,Giá cổ_phiếu Apple giảm nhẹ còn 160 sau khi ra_mắt iphone X . . Gnaht _ 26 . . . . soncon _ cuchuoi9x Tổng_cục thống_kê thuộc bộ kế_hoạch và đầu_tư
1,Giá cổ_phiếu Apple giảm nhẹ còn 160 sau khi ra_mắt iphone X . . cười đau ruột
1," Giá cổ_phiếu Apple giảm nhẹ còn 160 sau khi ra_mắt iphone X . . Chiêu_bài cũ , đợi ngày ra_mắt lên vùn_vụt lại thôi Apple luôn là số 1 thôi "
1,Đúng là siêu phẩm Anh_em gom đủ lúa để tậu chưa Cận_cảnh trải_nghiệm nhanh các tính_năng nổi_bật của siêu phẩm iphone X . Click để xem và tham_gia chém gió
1,Khả_năng cao iphone x về Việt_Nam sẽ không được hội chị_em tin_dùng
1,Yêu em đi em cho Iphone X
1," Ai phôn X iphone X_Chiếc iphone đắt_giá nhất của Apple . iphone X iphone 10 , chiếc điện_thoại kỷ_niệm 10 năm dòng sản_phẩm iphone của Apple_Chiếc điện_thoại với thiết_kế hoàn_toàn khác_biệt cùng công_nghệ nâng c "
1,Giá cổ_phiếu Apple giảm nhẹ còn 160 sau khi ra_mắt iphone X . . Da_Ga_Cua_Sat ucw8 . . . . Khánh_Bê đê tào_lao nữa lúc_nào không kỳ_vọng cao vào apple ra iphone mới quang trong thời_gian sau khi doang số đảm_bảo thì cổ_phiếu lại lên thui
1,Giá cổ_phiếu Apple giảm nhẹ còn 160 sau khi ra_mắt iphone X . . cho mình hỏi luôn là gdp của việt nam_ai cấp cho và ai là người_quản_lý vậy
1," iOS Beta_Đã có i OS 11 Beta 10 , mời tải về Update 792017 . . kvinh95 đã nói . . . . . . Tải bản gm ở đâu vậy mn Bấm để mở_rộng . . Cài 3utools vào pc rồi cắm iphone vào , rồi check vào bản 11 rồi bấm flash "
1,Giá cổ_phiếu Apple giảm nhẹ còn 160 sau khi ra_mắt iphone X . . mùa nào chả vậy rùi cũng tăng lại thui mà
1,Giá cổ_phiếu Apple giảm nhẹ còn 160 sau khi ra_mắt iphone X . . nhìn mấy con_số tiền thấy lùng_bùng trong đầu quá
1," Giá cổ_phiếu Apple giảm nhẹ còn 160 sau khi ra_mắt iphone X . . Sẽ còn giảm tiếp thôi 4 năm ko thay_đổi được_cái thiết_kế i FAn có_thể còn trung_thành nhưng người trung_tính sẽ chuyển_đổi và nhà_đầu_tư là người thông_minh , cái gì ở đỉnh lâu quá mà ko thay_đổi thì sẽ thụt_lùi thôi "
1," Giá cổ_phiếu Apple giảm nhẹ còn 160 sau khi ra_mắt iphone X . . Giỏi thật , nhưng phải_chi con X vẫn có dấu vân tay , xài tiện "
1," Giá cổ_phiếu Apple giảm nhẹ còn 160 sau khi ra_mắt iphone X . . Sheeple đâu rồi nhỉ , triết_lý doanh_số cao này_nọ đâu rồi , các chiên da kinh_tế việt nam chắc bận về chuồng do chủ lùa "
1,Thừa 2 cái ốp iphone 6plus của vk ai lấy mình để rẻ choae bạn_bè thân_thiết cho cũng đcđẹp lắm
1,Giang_Hà added 6 new photos to the album Siêu phẩm Iphone X88plus nàoooooooo Hàng_Mỹ bản quốc_tế LLA
1,Từ_khoá được tìm_kiếm nhiều nhất Google ngày hôm_nay sau khi Apple tung Iphone mới v . . Metoo
1,Lê hào . Nhận phân_phối . Sửa_chữa _ bảo_hành iphone 8plusx . Giá tốt cho ae cửa Hàng 0987729096
1,Trong khi cả thế_giới hồ_hởi với iphone 8 mí lại X được nguyên 1 vé 1 chiều về với em 5S thân_thương
1," Ngóng IPhone 8 mà phải chờ lâu quá , thôi dùng tạm con này vậy "
1," có ai ở nước_ngoài ko , gửi giúp chiếc iphone 8 về vớihết mấy mình gửi "
1," IPhone SE_IP hone X_IP hone SEX . . IPhone SEX là sự kết_hợp của SE và X , đợi sang_năm ra em hốt luôn "
1,Thấy dòng iphone X có_vẻ sang_trọng hơn nhưng màn_hình khá là nhỏ
1," TIỆN_ÍCH Hỏi phần_mềm tự_động ghi_âm cuộc_gọi trên Iphone . . kobebryant . . . . tuxedo075 Có nghe thiết_bị này , nhưng gắn nó vào đúng thiểu_năng Vì công_việc chắc buộc phải xài android rùi , iphone ghi_âm được thì tuyệt "
1,Iphone X có nhận_dạng khuôn_mặt sau khi tẩy_trang không Timeline_Photos
1," TOÀN_QUỐC Dock sạc 2 trong 1 , thiết_kế thông_minh , tinh_tế Dùng cho iphone Micro_Usb 2230 149 . . _ _ _ _ _ _ _ _ _ _ Update BOSS_HIỆN_TẠI_ _ _ _ _ _ _ _ _ _ . . MS1 150k . MS2 , 3 chưa bid . . Bước giá tối_thiểu 20k Phút cuối TỰ_DO . Tối mai end 2230 nhé các bác "
1,A k cần iphone a k cần ipad a chỉ cần ai đó bên a mỗi ngày . Ps cơ_mà ai góp gạo k p
1," IPhone X có chức_năng mở khóa nhận_diện khuôn_mặt Các ông chồng hay đi_đêm thì cẩn_thận nhé , đang ngủ nó đưa cái iphone vào cái mặt để mở khóa là xác_định luôn "
1,Tôi có nghệ_danh mới rùi các ông ei iphone X
1,So với những gì hãng điện_thoại khác đã làm trong năm 2017 thì Apple với Iphone X cũng không có đột_phá như thời Steve_Jobs_Chán vậy_mà cũng tung_hô dc
1,Galaxy A7 2016 hàng công_ty nhé máy chạy endroid 7 giao_diện giống s 8 cực mượt pin khỏe . Cần gl iphone 6plus lock hoặc mất vân ạ Photos from Huy_Vinhs post
1,Galaxy A7 2016 hàng công_ty nhé máy chạy endroid 7 giao_diện giống s 8 cực mượt pin khỏe . Cần gl iphone 6plus lock hoặc mất vân ạ Photos from Huy_Vinhs post
1,Galaxy A7 2016 hàng công_ty nhé máy chạy endroid 7 giao_diện giống s 8 cực mượt pin khỏe . Cần gl iphone 6plus lock hoặc mất vân ạ Photos from Huy_Vinhs post
1,Nếu đã không là gì của nhau thì giúp nhau cái iphone
1,Galaxy A7 2016 hàng công_ty nhé máy chạy endroid 7 giao_diện giống s 8 cực mượt pin khỏe . Cần gl iphone 6plus lock hoặc mất vân ạ Photos from Huy_Vinhs post
1," Một chàng_trai thả thính với cô_gái Em làm bạn_gái anh nhe , anh sẽ tặng quà kỷ_niệm ngày hẹn_hò đầu_tiên cho em là Iphone X 128GB "
1,Thật_ra nhiều người vẫn thắc_mắc là cái chỗ đen của iphone X này lúc chụp màn_hình nó ra cái gì
1," Đáng_giá iphone 2017 Apple_Face ID của trên iphone X mới ra_mắt là thứ đáng_giá nhất . thêm dòng công_nghệ ý_tưởng bắt_nguồn từ cảm_hứng phân_tích , đánh_giá và dự_báo công_nghệ "
1," 1K Tuấn_Vũ shared Đại_Kỷ_Nguyêns post Đại_Kỷ_Nguyên . iphone 8 ra_mắt thị_trường , tính_năng mới độc_quyền và mạnh_mẽ "
1,Iphone X đẹp quá . Giá_mà có ai tặng mình
1," Supy_Trinh shared Đại_Kỷ_Nguyêns post Đại_Kỷ_Nguyên . iphone 8 ra_mắt thị_trường , tính_năng mới độc_quyền và mạnh_mẽ "
1," Dacsanbonmien_Phanrang shared Đại_Kỷ_Nguyêns post Đại_Kỷ_Nguyên . iphone 8 ra_mắt thị_trường , tính_năng mới độc_quyền và mạnh_mẽ "
1,Bị cắt thưởng nên thấy Iphone X không đẹp lắm
1,Pồ shared Iphone chính hãng giá rẻs post Iphone chính hãng giá rẻ . Ui xời
1," Nghe_nói iphone 8 sắp ra , nhận_diện cả khuôn_mặt để mở khóav "
1,iphone 6 giá đang lên cao vcl các ông ạ
1,nhân_dịp iphone 88 lếch iphone x ra_đời sau đây là bản giá để mọi ngừ tham_khảo
1,Nghe_nói logo quả táo trên Iphone X sẽ được thay bằng quả thận
1," Iphone 6,6 plus lock giá phải_chăng Ai cần ib mình nhé "
1," Trên tay đang là Iphone XXX , quay_phim chất_lượng tràn HD không che Timeline_Photos "
1,Chào_mừng iphone 8 ra_đời em tậu ngay ip 4 đập_hộp
1," Ios 11 cảm_nhận thế_nào mọi người , iphone 5s rất ok "
1,Thèm hủ_tiếu k có để ăn . Ở đó iphone 8 với X
1,Vãi cả Iphone 8 ra_mắt đúng vào sanh nhật em
1," Ai cũng rần_rần IPhone X , chắc phải nhấn nhẹ em nó cái Ai có đường link dow hình iphone X đẹp cho mình với "
1,Không biết con traii có ủng_hộ Iphone X cho ba nó không nữaaa
1," Đây là con AI đầu_tiên mà mình biết quét gương_mặt và nhận_diện giọng nói , siêu hơn con Iphone X v Vùng_Đất_Thủ_Lĩnh_Rồng_Tập 25 Tập 26 P2 "
1,Iphone xxx nhá
1,Hãy nhanh tay trở_thành những người đầu_tiên sở_hữu chiếc Iphone X
1,KhôngNênMua IphoneX nhé các bạn Nữ vì đã có trường_hợp tẩy_trang xong iphone ko nhận ra_mặt chủ và máy bị block vĩnh_viễn lun
1," Nguyễn_Tiên shared Đại_Kỷ_Nguyêns post Đại_Kỷ_Nguyên . iphone 8 ra_mắt thị_trường , tính_năng mới độc_quyền và mạnh_mẽ "
1," Tao là tao nể mấy thằng cơm cha áo mẹ , thân thì như cái nùi lao mà suốt ngày lên fb iphone 8 iphone x có tính_năng này , tính_năng kia , phải rước e nó về , bao_nhiêu ngày chờ_đợi , bla bla bla đm tao nhìn hài vcc "
1,Hệ_thống apple quá đẳng_cấp iphone X chính_thức ra_mắt có sạc không dây và màn_hình cực đẹp . iphone X chính_thức ra_mắt có sạc không dây và màn_hình cực đẹp
1," iphone 8 xấu nhỷ , xấu thật_sự luôn ý , ai tặng thì dùng tạm thôi "
1," Nf vs các trang mạng hôm_nay toàn nói về iphone X nhể , năm nay k theo phong_trào đc nữa r "
1,Mỗi lần iphone ra sản_phẩm mới là dân_tình dậy sóng
1,Sau khi iphone x ra_mắt các nhà_sản_xuất quyết_định ko lấy hình quả táo để làm thương_hiệu nữa mà sẽ đổi thành_quả thận
1," Mít_Mít shared a link Trên tay iphone X_Tuyệt đẹp , smartphone tương_lai là đây . Và câu trả_lời vào ngày 129 vừa_rồi trong sự_kiện ra_mắt iphone của Apple chính là chiếc iphone X , đánh_dấu sự_kiện 10 năm lần đầu_tiên iphone ra_đời "
1,Có giấc_mơ gọi_là IPhone X_Tối qua đã mơ và nay mơ tiếp . PS thí_dụ đi chơi xui xui té gãy mũi hay xức môi làm_sao mở khoá nó ta
1,Nói lên suy_nghĩ của em Uyên_Nghi shared Calvin_Trans post Calvin . Lần nào IPHONE ra cũng thấy rầnrần dân_số dạo này giàu vc sửu cũng có dịp XL theo qua bão IP mạnh đứa nào nấy thiếu nợ
1,Kakak dự là anh chuỵ em muốn xài iphone X thì_phải để mặt mộc và ko đeo khẩu_trang kaka
1," Ăn_mừng em Iphone X 256G đầu_tiên đã có người đặt gạch Người nông_dân vô_cùng phấn_khích 3 . . Các ty có nhu_cầu đặt mới ip 8 , 8 và ip X thì ới ơi em nó nhé . . Mãi yêu 3 3 "
1," Iphone X đang có nhận_diện khuôn_mặt để mở khoá , không biết lúc tẩy_trang rồi mở khoá sao đây "
1," Lại có táo mới_rồi nhìn đẹp thật Ảnh thực_tế iphone X_Tưởng không đẹp , nhưng ai_ngờ đẹp không_tưởng . Những thay_đổi lớn trên iphone X đủ để bạn phải thốt lên rằng nó quá đẹp "
1,Mấy bạn nữ đừng nên dùng Iphone 8 hỉ Trang_điểm xong cài_đặt nhan dien khuon mat khoa man hinh Đi chơi về tẩy_trang xong may ko nhận_diện dc nữa
1,Iphone X là mục_tiêu chứ k phải là ước_mơ 3
1," Samsung_Pay ra_mắt tại Việt_Nam , lần đầu_tiên có_thể dùng điện_thoại thay thẻ ATM . . Quote . . . . . . Originally_Posted by Liberty . . . tôn_thờ apple thế . nhân_tiện apple pay bao h xài dc nhỉ . . . . . . Dùng iphone chả nhẽ xài samesung pay "
1,Iphone 6 Gold quôc tế 16G zin đep 98 phu kiên đây đu Giá yêu lắm 4xxx cho ae cân LH 0987395196 gặp Phong_Apple_Photos from Phạm_Văn_Phongs post
1,Iphone 6 Gold quôc tế 16G zin đep 98 phu kiên đây đu Giá yêu lắm 4xxx cho ae cân LH 0987395196 gặp Phong_Apple_Photos from Phạm_Văn_Phongs post
1,Vâng ước_mơ của tuổi_trẻ . . iphone864g 25500giá 17triệu 600 . iphone8256g 30900giá 21triệu 600 . iphone8 plus64g 28900giá 20triệu . iphone8 plus256g 34500 giá 24triệu . . iphone X64g 35900 giá 25triệu . iphone X256g 41500 giá 29triệu
1,Iphone 6 Gold quôc tế 16G zin đep 98 phu kiên đây đu Giá yêu lắm 4xxx cho ae cân LH 0987395196 gặp Phong_Apple_Photos from Phạm_Văn_Phongs post
1,Iphone 6 Gold quôc tế 16G zin đep 98 phu kiên đây đu Giá yêu lắm 4xxx cho ae cân LH 0987395196 gặp Phong_Apple_Photos from Phạm_Văn_Phongs post
1,Iphone 10 ra_mắt đại_gia v và đối_với tao đó là ước_mơ xa_xôi 3
1,iphone 8 lếch lếchsỉ và lẻ siêu rẻ
1," nỗ nực cày_cuốc , cuối_cùng cũng được sở_hữu con IPHONE_XXX "
1,Iphone X đẹp xuất_sắc lun tr ơi
1,Ai cho em hỏi vệ_sinh iphone có cần phải bung máy không và ở đâu có làm . . Bên chi_nhánh uỷ_quyền của Apple ở THĐ ko bjk có làm ko ạ
1," Cả newfeed ngập_tràn iphone X . x , apple đại đế "
1," iphone 8 vừa ra_mắt , mùa mang tới rồi anh_em gom lúa xem được bao_nhiêu , đê rước em nó về "
1,cứ siêng_năng đi . tiền và niềm_vui tự đến với mình . Nhận sửa thay độ tất_cả các dòng iphone . liên_hệ 01549615879 0935031314
1,Dự là sẽ có bản Iphone SEX . Có SE giờ có cả X
1," A nghĩ là sau tất_cả , e đừng sắm iphone X . Vì khi đêm xuống , đth của e sẽ bị block vì méo mở khóa đc sau khi chiếc mặt_nạ kia được tháo "
1,iphone X sinh_nhật này The8 sẽ có
1,video giới_thiệu về siêu phẩm kỉ_niệm 10 năm ra_mắt Iphone của Apple_Iphone X cho các mem nhé . Chuẩn_bị gom lúa thóc rồi
1,Cpi về đội Cận_cảnh trọn_vẹn vẻ đẹp Thần_thánh đến từng milimet của Iphone thế_hệ mới điện_thoại của tương_lai . Click để xem video và tham_gia chém gió
1," usb 32gb chuẩn usb 30 tốc_độ cao , có 1 đầu cắm iphone ipad backup data , hàng xt usa . giá 3xxe Photos from Nguyen_Nams post "
1,Thật đơn_giản để chúng_ta có_thể sở hưu Iphone X
1," Cai meo gicung muôn chi thiêu môi tiên Ngoc_Rosa shared Đại_Kỷ_Nguyêns post Đại_Kỷ_Nguyên . iphone 8 ra_mắt thị_trường , tính_năng mới độc_quyền và mạnh_mẽ "
1," Trước khi Iphone X có_giá thấy Note8 22tr mắc vãi_linh_hồn , sau hôm_qua cái thấy nó rẻ ghê trời "
1,Huhu iphone X đẹp nhởđẹp thếthậtđẹpđẹđcótiền
1,tụi m hiểu ý tao chứ . Đừng quan_tâm từ iphone
1,Nhìn_Note 8 vẫn phê hơn Ip X . với tui thì Iphone SE là đẹp nhất thôi . ps đang xài
1," Thu_Nguyễn shared Đại_Kỷ_Nguyêns post Đại_Kỷ_Nguyên . iphone 8 ra_mắt thị_trường , tính_năng mới độc_quyền và mạnh_mẽ "
1,Iphone 8 cũng không sang bằng vẻ đẹp của emm
1,Hot iphone X và những tính_năng thời_thượng HOT nhất Vietsub . iphone X nổi_bật với màn_hình vô_cực và tính_năng FaceID nhận_diện khuôn_mặt mới của Apple
1,Vụ này hay nha D_Mỹ sẽ thả 25 triệu iphone xuống Triều_Tiên để hạ nhiệt căng_thẳng . Một cựu đặc_nhiệm hải_quân Mỹ đưa ra sáng_kiến bất_ngờ để giải_quyết khủng_hoảng Triều_Tiên_Jocko
1,Sao vẫn thấy sam sung galaxy S8 Note 8 vẫn đẹp hơn iphone x nhỉ
1,rất nhiều lựa_chọn cho ae nhé thế_giới có ip 8 iphone x . tôi có iphone 3
