2,Hqua đến giờ lướt fb ko có cái tin gì ngoài iphone 8 . Mắc mệt
2," Người dùng cho rằng iphone X quá đắt_đỏ Người dùng cho rằng iphone X quá đắt_đỏ . Người dùng cho rằng iphone X quá đắt_đỏ Thời_sự VTV , Dân_trí , Báo mới , Tin_tức "
2,Con_buôn Tim_Cook sẽ dìm chết Apple bằng iphone X . . Mình đang xài iphone chỉ vì cái ios . Bởi_vì android chưa thực_sự tốt như ios . Nếu 1 ngày nào_đó android tốt như ios lúc đó mình sẽ chuyển qua android . Dù gì thì android đa_dạng nên có nhiều lựa_chọn
2," Con_buôn Tim_Cook sẽ dìm chết Apple bằng iphone X . . Đang tính múc con MiMix đây , nhìn cái máy liền lạc mà thèm vãi "
2,Xưa thì_ra iphone se bây giời lại còn ra thêm ai iphone x
2,kéo lên kéo xuống chỉ toàn thấy iphone T thây nó tính hết cả rồi trước nó ra IP_SE giờ nó làm nốt quả IP_X ghép lại thử xem rước về hại cả thânnnn
2,Iphone X_Camera xấu mà nhìn cái mặt trước mê quá
2,linkhay Nhiều anh_em lại bảo tuần vừa_rồi cho đi tong mất mấy cái iphone X rồi Nhiều anh_em lại bảo tuần vừa_rồi cho đi tong mất mấy cái iphone X rồi
2," Hơi bị mê rồi Dương_Dương shared Đời sốngs post Video trải_nghiệm iphone X , sát_thủ nguy_hiểm nhất của Apple "
2,Thịnh_Văn_Trần shared F a k e L o v es post F a k e L o v e . Có iphone 8 cua gái dễ vậy luôn à D m
2,Rảnh ngồi tìm_hiểu tại_sao ko có iphone 9 mà_lại lên thẳng X ten cũng hay có_vẻ bên tây số 9 là số xui thì_phải Hoang_Song_Thai was looking for four leaf clovers
2,đm tao cố lắm chỉ được 3 cuốc chúng_mày ạ 3 thế_này éo có iphone X rồi v
2,các bạn nữ mà sài iphone X chắc mở khoá cũng khó_khăn ấy nhỉ
2,Con_buôn Tim_Cook sẽ dìm chết Apple bằng iphone X . . thế mới thấy đẳng_cấp của Steve_Jobs . tạo ra 1 sản_phẩm marketing chục năm sau ăn_theo vẫn quá ngon
2,Thật chỉ buồn chút cụm sénor mẹt trc iphone mười H có cả hình nền đen_ngòm luônđúng là iphone vẫn nhứt Luôn iu iphone ý
2," anh không thích iphone X , a chỉ thích e thui "
2,ai se la nguoi so huu iphone x dau tien
2,Điện_thoại kiểu gì mà gần chục tấn thóc toàn đầu_độc người nghèo thôi phải bỏ_tù iphone
2," Con_buôn Tim_Cook sẽ dìm chết Apple bằng iphone X . . Nói cũng đúng , trừ đoạn Apple sẽ bị dìm chết "
2," Con_buôn Tim_Cook sẽ dìm chết Apple bằng iphone X . . Đối_với tôi IPhone của Steve_Jobs đã chết , xuống mồ cùng ông rồi . . . Sent from Samsung SMG950F using voz FApp "
2," Jay_Chou shared a link Ảnh thực_tế iphone X. Tưởng không đẹp , nhưng ai_ngờ đẹp không_tưởng . Những thay_đổi lớn trên iphone X đủ để bạn phải thốt lên rằng nó quá đẹp "
2,Ủa gì vậy có ip 8 là có tất_cả à Quỳ_Phương_Trâm shared F a k e L o v es post F a k e L o v e . Có iphone 8 cua gái dễ vậy luôn à D m
2," ối zồ ôi đẹp quá Mai_Mai shared Đời sốngs post Video trải_nghiệm iphone X , sát_thủ nguy_hiểm nhất của Apple "
2," Mộng_Thu shared Vietnamnetvns post Video trải_nghiệm iphone X , sát_thủ nguy_hiểm nhất của Apple "
2,Kiểu tóc hot nhất mùa mưa_bão năm nay . Sau khi iphone X ra_mắt . iphoneX
2,Fb có biến tòan là iphone 8iphone x gì tè le
2,Thấy fb rầm_rộ ip 8 với ipx gì gì đó loạn quá . Mình post lên khoe cấy iphone 10 . Mà dùng ốp nên cũng_như iphone tàu thôi Nên mọi người bớt rầm_rộ đi
2,Sáng giới fan Táo đang xôn_xao iphone X nhận_diện bằng khuôn_mặt Chợt nhìn lại mình đang xài 305Sh hàng thải công_nghệ Nhật cũng nhận_diện khuôn_mặt đây
2," Nóng_bức quá Mai_Kim_Vy shared Vietnamnetvns post Video trải_nghiệm iphone X , sát_thủ nguy_hiểm nhất của Apple "
2," Thực_chất ra mà nói thì điện_thoại nào mà chả dùng đc Cứ nghe gọi , Lên mạng , xem sex , lướt web , online facebook chém gió ầm_ầm là ok rồi . Iphone 89 làm_gì cho tốn tiền "
2,chừng nào ghé sang Việt_Nam nhỉ để kéo lứoi ra giăng Châu_Nguyễn shared Cười_Ngả_Nghiêngs post Cười_Ngả_Nghiêng . Mỹ chơi được đấy V
2," Hường_Nguyễn shared Thánh nhọ Brians video Thánh nhọ Brian . Tổng_quan , tổng_kết một_chút về Iphone X ghi_nhớ ngày ra_mắt "
2,Điện_thoại gì cứ điên cả tuần nay mất hết tất_cả dữ_liệu Em chưa có máu đổi iphone xxx gì đâu nha bây_giờ muh chia_tay là em ve Nokia 1310 đo nha
2," Lướt fb thấy ai cũng bàn về iphone 8 đồ giàu_có quá , hậm mô gêchúc mừng "
2," Mình nhận đổi Iphone máy cũ thành máy mới 100 chưa active . máy bạn nào còn bảo_hành là đổi được . vỏ xấu , kiếng xấu , móp "
2," Nhà_nhà người_người iphone S , iphone X_Kìm hãm lại , iphone 6s còn chưa đổi lên được Bị sếp đầu_độc muốn bọn chen con iphone 7plus của sếp T_ T "
2," Đến giờ đổi đth mới_rồi , nhưng phải đợi giá nó xuống đã hihi iphone X_Introducing iphone X_Apple . Its all screen Face ID lets you unlock with a look Portrait_Lighting lets you define the light in a scene Wireless charging Augmented reality A11 Bioni "
2,IPhone 8 là cái lờn gì nhề v Nguyễn_Đình_Thảo shared F a k e L o v es post F a k e L o v e . Có iphone 8 cua gái dễ vậy luôn à D m
2,Con_buôn Tim_Cook sẽ dìm chết Apple bằng iphone X . . Công_nhận bài viết này nói quá chuẩn Từ sau IP5s là Apple xuống_dốc hẳn
2," Ao ướt quá Bông_Hana shared Đời sốngs post Video trải_nghiệm iphone X , sát_thủ nguy_hiểm nhất của Apple "
2,Iphone X nhận_diện bằng khuôn_mặt vậy làm pttm chung lò bs vậy mặt nào cũng nhận đc ha
2,Iphone lại cập bến . Miếng dán cuong lực . ib báo_giá Photos from Thu_Thủys post
2,Iphone mới trả IPHỒN_Y con cặc ấy đkm 12h trưa vừa_mới ép lại kính song . Thỳ 9r tối đéo být làm_sao chỉ để 1 chỗ thôi lại vỡ màn_hình tiếp Mà trong khi đó kòn dán kả kính cường_lực nữa mới nhục chứ . Đời chó_chết thậ T
2,Nghe_nói iphone x mới ra
2,Nhìn mấy mẫu iphone mới ra thấy nó xấu thiệt
2,Iphone 8 thì chả khác rù 7 mà iphone 10 thì chất vcd Nhah_Kons was feeling wonderful
2," Sáng giờ fb rần_rần vụ iphone , nhưng có_lẽ mình em không để_ý đến nó không tiền . Xì_Trum was feeling awesome "
2," Mình thấy nó thiệt là zữ tợn chứ mình hong thấy đẹp Ảnh thực_tế iphone X_Tưởng không đẹp , nhưng ai_ngờ đẹp không_tưởng . Những thay_đổi lớn trên iphone X đủ để bạn phải thốt lên rằng nó quá đẹp "
2,Con_buôn Tim_Cook sẽ dìm chết Apple bằng iphone X . . Đúng quy_trình Cơ_mà hơi sớm rồi thằng thớt . . Sent from my LGF460 using voz Forums
2," Thầy bảo phong_thuỷ mình hợp_số 8 và màu gold Ảnh thực_tế iphone X_Tưởng không đẹp , nhưng ai_ngờ đẹp không_tưởng . Những thay_đổi lớn trên iphone X đủ để bạn phải thốt lên rằng nó quá đẹp "
2,Mom nói nghỉ nhậu có ngay con iphone x Nên ko ae
2,Lấy iphone chống lưng cho ipad với mục_đích xem phim đỡ mỏi tay Hiềnn_Monn
2,Có_khi nào thả nhầm qua Việt_Nam_Hoàng_Lệ shared Cười_Ngả_Nghiêngs post Cười_Ngả_Nghiêng . Mỹ chơi được đấy V
2,Iphone X đẹp quá nhưng_mà thôi vậy
2,Ra_mắt iphone X nhìn đẹp thế_này thì dự là có nhiều em_gái sẽ đau háng lắm đây
2,Newsfeed toàn tin về chiếc iphone mới ra đặc_biệt của apple không dành cho con_gái là sao ta Đức_Tiến is at Bệnh_Viên_Gang_Thép
2,Iphone SE xoạt iphone X iphone SEX Dobinh_Phan was feeling wonderful
2,Đang định đổi iphone . Ai giúp được nt riêng nhe
2,Đang có chút thắc_mắc là những bạn nghiện phẫu_thuật mẹt thì mở iphone mứi kiểu gì nhỉ hahaaaa
2,K phải nghèo mà chê Iphone X xấu vãi
2,hok có iphone để tự sướng thì đành vác máy_ảnh ra vậiii
2,iphone X được chào_giá gần 50 triệu đồng ở Việt_Nam . . Quote . . . . . . Originally_Posted by daidam 07 . . . Mới à Báo lỗi cho Apple có_khi dc nhiều tiền đấy . . . . . . ý mình là nó cài vân tay của nó vào dt mình trong phần cài_đặt ấy
2,Tính ra mình có cũng khoảng 6 cái IPhone X rồi nhẩy
2,Bộ đôi iphone chất lừ là SE và X . Công_nhận không
2," Hai_Lethanh shared Vietnamnetvns post Video trải_nghiệm iphone X , sát_thủ nguy_hiểm nhất của Apple "
2,iphone X nghe đến đã sang con_người rồi Nguyễn_Thanh was feeling motivated
2,iphone X xxxxxxxxxxxxxx nao long ghe lunnn Manh_Vo is with Kha_My
2,Kiếm cái IPhone sài sao khó quá vậy trời
2,V_Duyên_Tháii shared F a k e L o v es post F a k e L o v e . Có iphone 8 cua gái dễ vậy luôn à D m
2,Ốp Xi đỏ Táo khoét đã có hàng trở_lại . Đủ iphone 566plus7plus đặc_biệt có luôn iphone 10 . 35 ngèn nha Thuý_Quỳnh added 4 new photos Photos from Thuý_Quỳnhs post
2,huhuGG trả iphone X cho tao
2," Apple iphone X thiết_kế mới , màn_hình OLED 5 8 , nhận_dạng khuôn_mặt 3D , không còn Touch ID . . Khánh_Bê đê đã nói . . . . . . Con cờ hó Khánh_Bee bảo_vệ chủ đã hiển kinh xuất_hiện rồi Bấm để mở_rộng . . Seeder cay_cú ghê vậy Thấy tội e quá , haha "
2,Iphone SE và Iphone X sắp ra tạo thành_bộ đôi quá CHẤT . Các hãng khác tuổi gì sánh_vai
2,IPhone 8 đã có Thả thính đánh bả đi các xị em Cũng đáng đồng_tiền bắt gạo lắm ý Nhung_Lê is feeling pumped
2,Nỗi ám_ảnh iphone XXX
2,Vl ip 8 Thành_Danh shared F a k e L o v es post F a k e L o v e . Có iphone 8 cua gái dễ vậy luôn à D m
2,Có iphone của ai bị giống e ko Thỉnh_thoảng ai gọi đến có_tiếng kiểu cháy âm ko nghe thấy gì đầu bên kia thì nghe thuê baophải tháo sim ra lau lại mới được mà chỉ plus mới bị thôi
2,Chỉ còn vài tiếng nữa thôi là sẽ cầm trên tay em nó 500 like sáng_mai sẽ trên review Iphone X cho anh_em xem Cường_Nguyễn was feeling excited with Truc_Linh_Tran in United_States
2," iphone 9xxx chỉ có 2 triệu rớt không bể kháng nước vô_tư , lướt web bằng giọng nói , tích_hợp mạng 6G , lưu được 200 film cấp 5 Japan_Quánh lộn vũ_khí lợi_hại mà không sợ bị cướp "
2," Mai_Phương_Thiên_Ân shared a link Ảnh thực_tế iphone X_Tưởng không đẹp , nhưng ai_ngờ đẹp không_tưởng . Những thay_đổi lớn trên iphone X đủ để bạn phải thốt lên rằng nó quá đẹp "
2,Bao_nhiêu chuyện phải suy_nghĩ mệt như chó cắn . 2710 mới ra iphone 10
2,Từ lúc iphone X nó ra không hiểu sao điện_thoại mình thấy pin nó nhanh hết thế
2," Dung_Seoul shared Vietnamnetvns post Video trải_nghiệm iphone X , sát_thủ nguy_hiểm nhất của Apple "
2," Iphone X , 8 , ra_mắt rồi thì chắc là khá nhiều em_gái đau háng lắm "
2,bác nào có iphone 6 lock còn đẹp thì báo_giá em ạ tầm 3tr đổ lại em sinh_viên k có nhiều tiền ăn mì tích_cóp mấy tháng đấy ạ em ở hà_nội ạ
2,Trong trường_hợp này mà xử dụng Iphone X thì cũng đau_đầu nhỉ không biết phải làm_sao
2,Muon iphone X vá trời
2,Yêu với đương cái gì Thanh_Bình shared F a k e L o v es post F a k e L o v e . Có iphone 8 cua gái dễ vậy luôn à D m
2,Hóng mấy anh đi Sing mang iphone 8 về cho chụp hình sống ảo quá đi
2,Vừa lấy iphone X về thì bị lock vì ko nhận_diện đc mặt do da quá đen
2,iphone X da tren tay
2,sơn_mài 4d nét dã_man . . iphone 566plus 77plus . . 80k thuii Pé_Quý added 5 new photos to the album Hàng mới tháng 9 Photos from Pé_Quýs post
2," Chắc tuôi chớt vs nó . Khi nào đủ money đây Ảnh thực_tế iphone X_Tưởng không đẹp , nhưng ai_ngờ đẹp không_tưởng . Những thay_đổi lớn trên iphone X đủ để bạn phải thốt lên rằng nó quá đẹp "
2,Ai ở gần công_viên trới có sạc iphone cho mình mượn mai sáng trả
2," Ko còn từ nào để tả Ảnh thực_tế iphone X_Tưởng không đẹp , nhưng ai_ngờ đẹp không_tưởng . Những thay_đổi lớn trên iphone X đủ để bạn phải thốt lên rằng nó quá đẹp "
2,Đi ngủ thui và mơ về ẻm IPhone 8X ở trong tay mình . Cả nhà ngủ ngon ạ . 大 家 晚 安
2,Iphone X ám_ảnh t quá man Tim t tan_vỡ mất
2,Iphone X là cái ôn_vật gì mà ace thi nhau khoe mất thận thế
2," Khi iphone x ra , tôi nghĩ ngay đến bê f , sam 8 , xạo li , hơ vú , són nầy tôi nhớ nội tôi "
2,Xin_lỗi em Anh không dùng iphone 5s Hix
2,Trùng_hợp dữ . iphone X mười . Bão số 10 Doksuri . . Keep calm The storm is comming Le_Tan_Trung_Ba posted 3 photos on Instagram_Photos from Le_Tan_Trung_Bas post
2,Iphone X cũng bó_tay mà
2," Vânn_Annh shared a link Ảnh thực_tế iphone X_Tưởng không đẹp , nhưng ai_ngờ đẹp không_tưởng . Những thay_đổi lớn trên iphone X đủ để bạn phải thốt lên rằng nó quá đẹp "
2,Iphone giờ rẻ quá Dùng 1202 thôi
2," Cầm hàng thật trên tay mới cảm_thấy thật đáng đồng_tiền_bát_gạo Video trải_nghiệm iphone X , sát_thủ nguy_hiểm nhất của Apple "
2,Tag bạn nữ nào cũng đang ngắm_nghía iphone X nhé các bạn nam
2,Tín_đồ iphone 56 ai ưng rước e ấy gia chi 40k mai ship lun ạ Photos from Trần_Thảos post
2," Liên_Liên shared a link Ảnh thực_tế iphone X_Tưởng không đẹp , nhưng ai_ngờ đẹp không_tưởng . Những thay_đổi lớn trên iphone X đủ để bạn phải thốt lên rằng nó quá đẹp "
2,dm đéo có tiền sài đen_trắng ol fb toàn iphone 8 với iphone X là cc gì vậy xa sỉ vl v
2,iphone X của tôi bị rơi nếu chẳng may Phạm_Băng_Băng nhặt được thì_sao nguy_hiểm quá ahuhu
2,Nguyễn_Thị_Minh_Nguyệt shared F a k e L o v es post F a k e L o v e . Có iphone 8 cua gái dễ vậy luôn à D m
2,Truong_Cao shared F a k e L o v es post F a k e L o v e . Có iphone 8 cua gái dễ vậy luôn à D m
2,Anh có 2 chiếc 8s plus Anh Tatoos shared F a k e L o v es post F a k e L o v e . Có iphone 8 cua gái dễ vậy luôn à D m
2," Dạo này đúng nhà_quê luôn Ra iphone 8 , 8 , lại cả iphone X thế_mà không hay_biết gì cả , may nhờ thằng e nó up FB mới bik Đúng là tối_ngày quay_cuồng với mấy khúc xương chó ultraracing và pizza Sparco_Jen_Ng is with nguyễn đình khang at Cty_Tonys_Team "
2,Quên IPhone X đi không phù_hợp với chúng_ta đâu
2,Lương tháng các bạn mình nghĩ chưa chắc đã được 30 củ 1 tháng . mở_mắt ra là nói iphone X
2,Chắc_chắn 1 câu là iphone x ra_mắt nhiều chị_em sẽ bị đau háng Bởi_vì iphone x thiết_kế bằng kim_loại lại to khi chị_em mặc quần_jean bó sẽ gây ra đau háng
2,Muốn giả_bộ rớt điện_thoại rồi ai đó giả_bộ tặng Linda_Iphone X
2,IPhone 8 X ra_mắt tao không quan_tâm Cái tao quan_tâm ở đây là bao_giờ thằng Tùng comebank trở_lại _
2,Iphone SE 2016 Iphone X 2017 . Iphone 2018
2,sam fan zô chửi đinote 8 tuổi lìn đòi vượt mặt iphone x của t nhéahihi
2," Ảnh so_sánh cấu_hình IPhone 7 và Iphone 8 , Iphone X "
2,Vật_chất luôn_luôn phải là cái có trước Lg_Thành_Văn shared F a k e L o v es post F a k e L o v e . Có iphone 8 cua gái dễ vậy luôn à D m
2,Rồi làm_sao mấy đứa 2 mặt xài được iphone X
2,Hihi h Ứa_Ng A shared F a k e L o v es post F a k e L o v e . Có iphone 8 cua gái dễ vậy luôn à D m
2," Hoài_Trí shared Vietnamnetvns post Video trải_nghiệm iphone X , sát_thủ nguy_hiểm nhất của Apple "
2," been Nguyễn shared a link Ảnh thực_tế iphone X_Tưởng không đẹp , nhưng ai_ngờ đẹp không_tưởng . Những thay_đổi lớn trên iphone X đủ để bạn phải thốt lên rằng nó quá đẹp "
2,Đm nghe_nói ra Iphone 8X thì Ip 7 giảm đáng_kể o . Tậu ngay con 7 về đi đường thì bị vỡ
2,Iphone X mắc vãi ra
2,Ôi iphone Xbán hết
2,Có iphone 8 thì 1280 có giảm_giá k nhỉ
2,Ai biet check iphone qua xa dan lay giup minh ship ve cau giay ah . Ship 50k . Ung 850k . 01637129561
2,iphone 6s 64G giờ bao_nhiêu vậy anh ơi
2,Mất con iphone nên là danh_bạ a e bb Cũng mất mới làm lại sim nên a e tc nha 0962250638
2,Đầu tiền là iphone SE giờ là iphone X phải_chăng apple muốn ám_chỉ đến SEX ác_ôn thật v
2,t là 1 ng đi like dạo thấy j t cũng like nhưng tại_sao mọi người lại k like cho tui haizz . ps iphone 9 ms ra_mắt đây ạ ms vừa đập hôp luôn
2,Máy cạo râu iphone . Lẻ 120k
2,IPHONE_X mới ra_mắt . cảm_giác là người đầu_tiên được cầm trên tay nó phê lắm các bác ạ
2,Ước dì bây g ai cho mượn cục sạc iphone 6
2," iphone X , Galaxy_Note 8S8 , MI_MIX 2 , LG_G6 V30 bạn thích thiết_kế nào . . biết là vẫn còn nhưng rò_rỉ thì thấy thiết_kế cũng không có gì khác năm_ngoái lắm Mà mình chỉ thấy cũng chí có 3 kiểu đó sam sung , LG , Xiaomi thôi Iphone một_mình một ngựa thì không nói làm_gì "
2,Tao có iphone SE tao có iphone X . À mà thôi
2,Có ae bạn_bè nào hack đc game này trên iphone đã jab kgiúp mình với
2,iphone X đang siêu hot Nhưng cho em hỏi ngu tí Giờ các ninja đi_ngoài đường mà giơ lên mở máy thì như_thế_nào nhỉ
2,vcl Phan_Sơn_Tuyền shared F a k e L o v es post F a k e L o v e . Có iphone 8 cua gái dễ vậy luôn à D m
2,Người_ta có Iphone X_Mình cũng có Haizz
2,Em đổi lấy iphone xxxxx
2,Hazzz hai đơi Nguyễn_Ngọc_Hươnq shared F a k e L o v es post F a k e L o v e . Có iphone 8 cua gái dễ vậy luôn à D m
2,đang đi có con nó kêu đi nhởi các man ạ . mà t nghĩ iphone 8 mới ra nên t về Tèo_Em is with Trần_Quy and 7 others
2," Ảnh thực_tế iphone X_Tưởng không đẹp , nhưng ai_ngờ đẹp không_tưởng . Những thay_đổi lớn trên iphone X đủ để bạn phải thốt lên rằng nó quá đẹp "
2," Iphone X dùng sao sao ý , k quen lắm Nguyễn_Đình_Anh_Nam is with Nguyễn_Đăng_Hải "
2,Đâu_đâu cũng Iphone X_Như_Nùn was feeling pissed
2,iphone X sắp ra mà e nó vẫn còn xài ip 6 . Tính mình ko thích chạy theo công_nghệ hay tiếc tiền . Chắc đáp_án số 2 quá
2,Đi_khách tới khi iphone X ra chắc đủ tiền
2,Hân_Chu shared F a k e L o v es post F a k e L o v e . Có iphone 8 cua gái dễ vậy luôn à D m
2,Dời ơi iphone 8 đẹp hết có biết mà chỉ Sài iphone 4 đi_sau công ngệ 4 vòng không bt khi nào mới có chắc có iphone 8 thì người_ta ra iphone 20 ùi puon thiệt
2," Đạt_Nguyễn shared a link Ảnh thực_tế iphone X_Tưởng không đẹp , nhưng ai_ngờ đẹp không_tưởng . Những thay_đổi lớn trên iphone X đủ để bạn phải thốt lên rằng nó quá đẹp "
2,Nghe_nói mới ra iphone X . Giá thận nay thế_nào rồi ae
2," Apple hay thật nó ra iphone SE xong bây h nó ra iphone X , thế ý chúng_mày có phải là cho đầy_đủ chữ SEX không "
2,Trần_Trung_Kiên iphone Z nè
2," iphone 6 plus 64gb gold zin All bản Mỹ hàng hiếm bh 6 tháng , giá bất_chấp . Giá 8xtr Dương_Vui is with Nguyễn_Hiền and 7 others "
2," Chị JEONJUNGKOOK_BAR tặng Iphone X cho ông Út kìa trời Chị_gái ưi , chị đánh_rơi em_gái nè "
2,Why do you need an iphone when all you need is iđó
2,Thấy đâu_đâu các bạn cũng iphone X . nghe_nói em nó đang hot
2,Khi nào có_giá iphone 8 Iphone 10 e mới báo_giá Hiện_tại chỉ là lời đồn
2," Bao_Quoc shared a link Ảnh thực_tế iphone X_Tưởng không đẹp , nhưng ai_ngờ đẹp không_tưởng . Những thay_đổi lớn trên iphone X đủ để bạn phải thốt lên rằng nó quá đẹp "
2,Iphone 8X ra thi e cung lên đơi thôi 3
2,loa trong iphone 6 sửa hết nhiêu tiền vậy moi người
2,iphone x nghĩ rồi bỏ nha
2,iphone Chưa ra mà đã mất mẹ nó k
2,Lâu oy iphone bắn vẫn ok
2,NICKI_MINAJ pour mon cadeau danniversaire je veux IPHONE_X stp mon bébé fais moi ce plaisir la
2,Fb điên_đảo vì Iphone 8 . còn tôi thấy chả có gì . Ko đủ tiền chạy theo công_nghệ . Con_Plus này mới kich hoạt đc 15 ngày . hiện_tại chua co ý_định . Tiên đo để làm viẹc khác .
2," sao đua lại đây Ảnh thực_tế iphone X_Tưởng không đẹp , nhưng ai_ngờ đẹp không_tưởng . Những thay_đổi lớn trên iphone X đủ để bạn phải thốt lên rằng nó quá đẹp "
2," Nguyen_Thi_Huong shared a link Ảnh thực_tế iphone X_Tưởng không đẹp , nhưng ai_ngờ đẹp không_tưởng . Những thay_đổi lớn trên iphone X đủ để bạn phải thốt lên rằng nó quá đẹp "
2,Hoắc_Thiên_Kình shared F a k e L o v es post F a k e L o v e . Có iphone 8 cua gái dễ vậy luôn à D m
2," Cuộc_Sống_Không_Màu shared Vietnamnetvns post Video trải_nghiệm iphone X , sát_thủ nguy_hiểm nhất của Apple "
2," Thắc_mắc một tý , lỡ thức khuya nóng trong người , mặt bị nổi đầy mụn má nhận không ra vậy iphone X có nhận_diện để mở máy được không ta "
2,Muốn có Iphone X quá
2," Có friend nào đặt iphone XXX liên_hệ mình sớm nhất nhé Quoc_Tran is with Ứng_Ngọc_Thủy in Ho_Chi_Minh_City , Vietnam "
2,Ngày nào cũng vứt đi vài cái iphone Xthật là lãng_phí
2," Thấy cái iphone x mà thấy thèm quá , cái đó mà về nhúng dấm hay_là tái chanh đều ngon đó nhỉ Đinh_Văn_Minh was feeling điên_đầu vi Iphone SE và Iphone X "
2,Sắp ra Iphone ếch
2," Apple iphone X thiết_kế mới , màn_hình OLED 5 8 , nhận_dạng khuôn_mặt 3D , không còn Touch ID . . Iphone X ngon hết_chỗ_nói "
2," Video_Người tham_dự sự_kiện ra_mắt Note 8 nói_gì . . Hỏi khách mời cũng_như ko , note 8 tốt nhưng rất tiếc các chế vẫn chọn iphone v "
2,Khi 2 vợ_chồng bàn_luận về iphone
2,Mình thì mình không quan tân tới Iphone X đâu v . neo
2,Thái_Thanh shared Kem_Gấus post Kem_Gấu . Hãy_Tag người sẽ chui xuống dưới để nhặt Iphone X cho bạn . KemvaGau IphoneX Merino
2," Hoàng_Thuân shared Vietnamnetvns post Video trải_nghiệm iphone X , sát_thủ nguy_hiểm nhất của Apple "
2,X_Iphone sẽ thất_bại thảm_hại tại thị_trường Vietnam nè
2,Nhiều khi mình đéo thể hiểu Đặng_Tuấn shared F a k e L o v es post F a k e L o v e . Có iphone 8 cua gái dễ vậy luôn à D m
2,K có tiền đú iphone 8 thì đú IOS 11 thôi vậy
2," Tớ cũng thích lắm hihi Ảnh thực_tế iphone X_Tưởng không đẹp , nhưng ai_ngờ đẹp không_tưởng . Những thay_đổi lớn trên iphone X đủ để bạn phải thốt lên rằng nó quá đẹp "
2," Mạnh yếu tuy từng lúc khác_nhau , nhưng giá iphone như bây_giờ thì năm nào cũng thấy "
2," Bầu_Kiên ngồi_tù , vợ_chồng vẫn thu về hàng trăm tỷ đồng nhờ cổ_phiếu ACB . . Quote . . . . . . Originally_Posted by Iphone X . . . 1972 45 tuổi , được không mí anh_em . . . . . . . . Có nhiều ảnh thế_thì share cho mình ngắm bớt đi anh bạn "
2," Nguyễn_Xuân_Hiệp shared a link Ảnh thực_tế iphone X_Tưởng không đẹp , nhưng ai_ngờ đẹp không_tưởng . Những thay_đổi lớn trên iphone X đủ để bạn phải thốt lên rằng nó quá đẹp "
2," Hix khách ngóng Bơ_Booth nhà em như ngóng Iphone X . Bị chửi , bị gọi , bị hối Hix thật_tình là em đang đi kiếm đồ ngon cho mấy chế đây Bơ phải to tầm 600gr đến 700gr em mới lấy . Bơ này ăn giảm cân là bao ngon , chắc . Em bé ăn dặm là nhức_nhối lun . Hix , chờ em nhé Có em giao hàng liền đừng hối em "
2,Sáng giờ mấy cha mấy má đua nhau bình_luận Iphone X iphone 8 thấy mệt lôl
2,IPhone 8 ra giá nó nhẩy như ếch tập nhẩy
2,Cũng vì cái iphone XXX mà nhiều má lộ rõ bản_chất nghề_nghiệp dễ_sợ . Đừng lấy ip XxX ra để PR trá_hình nhé . Đi_khách cũng từ_từ chứ có đâu mà rần_rần hà Bob_Nguyen was feeling lost
2,Sao ai cũng Iphone X hết vậy
2,Hội ninja lead k dùng đx đâu Trọng_Tín shared Cười đau cả bụngs photo Cười đau cả bụng . Ninja nói không với Iphone X
2,k dám vs a à Việt_Hoàng shared F a k e L o v es post F a k e L o v e . Có iphone 8 cua gái dễ vậy luôn à D m
2,Kết rồi đấy cơ_mà nhiều xiền quá IPhone X ơi iphone X_On hands Preview . iphone 8 IPhone 8 plus iphone X
